Datetime,Text,TweetID,username,geo
2020-04-18 23:49:40+00:00,Mudah-mudahan wabak Covid19 segera terhapus.. . Nanti boleh gi pantai lagi ok? @D'Punggai Desaru Beach Resort https://www.instagram.com/p/B_JCkA-liYz/?igshid=1pxee9qghrz5y,1251659191795802112,MuizzZaki,
2020-04-18 23:27:47+00:00,All McDonald’s branches in Singapore will stop operations from today till 4 May following some confirmed cases of COVID-19 among their staff members. https://sg.news.yahoo.com/covid-19-mc-donalds-to-temporarily-suspend-all-restaurant-operations-in-singapore-230224039.html,1251653685060333568,theartofmezame,
2020-04-18 22:46:32+00:00,"Exploring my archives | Mask up in public | #stayhome #covi̇d19 #getai #singapore #sgmemory @Pulau Ubin, Singapore https://www.instagram.com/p/B_I7VhBn-5P/?igshid=lpstvoyln7kd",1251643302681677829,JeromeKG,
2020-04-18 20:21:12+00:00,Paano ba hindi mag worry kung kahit Circuit breaker mode dito sa SG e yung kasama mo naman sa bahay ay may COVID-19 related assignment????? #worried #anxious,1251606726983352321,quenniedevega,
2020-04-18 18:44:27+00:00,"A few weeks later: Headline: Pogba develops first working vaccine against Covid19 Souness: “What’s he doing in a lab developing a vaccine. Yes, it will help people but I have to wonder does Pogba take his football seriously? I have to say NO!”",1251582379598073857,LeFalseNumber12,
2020-04-18 17:12:42+00:00,"Former #Reuters #technology journalist @loosewire interviewed UIB #CEO @tobyruckert on his #LifeInAPandemic #podcast. “The #crisis has leveled the playing field. Large company or small, everyone is #workingfromhome” - https://www.buzzsprout.com/962143/3354634?fbclid=IwAR3QztxhjyZEVuuZqKmppNrmg7gFpHEi0m9n7BGQGCPqHWZvbPEbqL3GDKo. 🦠 #COVID19 #WFH #AI #IoT #AIoT #H2M",1251559292500615168,uibglobal,
2020-04-18 17:06:54+00:00,"Haha if u have a clear kind u won't even suggest threatening pple and nor did I. U are trying hard to find excuses and avoiding the threat to society at covid-19 time .imagine everyone took ur reaction and acted the same way. Why we hve qualities like rationality, and patience.",1251557829556580353,KassimARah,
2020-04-18 16:27:26+00:00,आज से हगना नही नही तो Cornovirusesआ जायेगा #coronavirus #COVID #Covid_19 ,1251547898350759936,sundarbishnoi29,
2020-04-18 16:11:36+00:00,#Singapore overtakes #Malaysia in Covid-19 cases ,1251543915083083781,bemnyax,
2020-04-18 16:11:26+00:00,"Some of you guys might already know of my involvement in Ramadan Bazaar Committee for the past years and it is unfortunate to hear that this year, due to the current COVID-19 situation, all Ramadan Bazaars islandwide… https://www.instagram.com/p/B_IOHdCB6UZ/?igshid=hswfzdxttz6x",1251543873169563650,khairulyunos,
2020-04-18 15:41:18+00:00,"New high of 942 Covid-19 infections confirmed in S'pore, majority are work permit holders in dorms https://str.sg/JMJP why is our govt classified PR in the same tier as Singaporeans? Are the PRs at par level with Singaporeans? Vote for a govt that put locals 1st tier citizens",1251536289406480384,poortan,
2020-04-18 15:29:20+00:00,This is what we say commitment towards work at this #Covid_19 critical situation. Mam @GummallaSrijana 🙏🙏Heartily Appreciated. Pls take care of your health &amp; God bless your little son @AndhraPradeshCM @ysjagan @peddireddyysrcp @BotchaBSN @GVMC_OFFICIAL #AndhraFightsCorona,1251533278382682112,prakash4jaganys,
2020-04-18 15:29:03+00:00,@DrAdhamBaba I wanna travel and see all those 500 countries before I die.Will start rite after covid19 crisis gone.,1251533207113134080,501deghie,
2020-04-18 15:21:26+00:00,Finding it hard to believe/evaluate any book written before #Covid19. The constant question as I read is - how would the premise change in light of the #publichealth and economic damage wreaked by a #pandemic? But it seems the wisdom in @factfulness stills holds true.,1251531290005794817,hsienlei,
2020-04-18 15:09:35+00:00,"8am KST, means 7am SGT 😂😂 My eyes not even open bro HAHAHA #SuperM #HealthForAll #COVID19 #GlobalCitizen",1251528308795162624,mochi__1485,
2020-04-18 14:46:24+00:00,Bersyukur banget.. sebelum kejadian COVID19 selama sebulan kemaren aku udh jalan jalan keliling jkt&amp;pdg hehehe ,1251522474199506945,Nrd9999,
2020-04-18 13:45:27+00:00,"During these uncertain times, I’ve decided that I will make an effort to support local businesses and #savefnbsg especially the restaurants and cafes I love. _ During #covid_19 #circuitbreaker many F&amp;B businesses… https://www.instagram.com/p/B_H9aW-nbVT/?igshid=kn75xcdr3xt1",1251507134577152002,beckalim,
2020-04-18 13:36:57+00:00,"With #COVID19 resulting in shutdown of schools and childcare centres, it’s the ultimate zombie apocalypse nightmare, says @NTUsg sociologist Teo You Yenn. The unfolding story of COVID19 is a story of inequalities, she adds. ",1251504994819297281,NTUsg,
2020-04-18 12:36:28+00:00,"New local cases remains low. Sadly, more and more migrant workers living in cramped dormitories have been tested positive https://www.channelnewsasia.com/news/singapore/covid-19-singapore-foreign-worker-dorm-outbreak-increase-12649472 #Singapore #COVID19",1251489776592543745,grodog,
2020-04-18 12:34:02+00:00,Covid-19 CircuitBreaker CB-Day12 Sunset @Singapore https://www.instagram.com/p/B_H1PaSpRUH/?igshid=lzim4v7cl6zz,1251489163456778246,Saniroz,
2020-04-18 12:02:20+00:00,This is how Singapore citizens embrace the circuit breaker. Watch and wait till the end part 😂. #SGUnited #Covid_19 ,1251481185080864769,Wizmicks,
2020-04-18 11:52:57+00:00,Kes positif di Johor top 1 hari ni. Hati2 semua.. Yang komen ni pun boleh tahan mulut dia. Kena kat batang hidung sendirik baru tawu. . . . #covid19 @Johor https://www.instagram.com/p/B_HwigWlKrY/?igshid=1mmfz3iqvftax,1251478823901806596,bysyamei,
2020-04-18 11:39:42+00:00,With genaphua at #macritchiereservoir in 2017 Everything was so calm (before the storm - COVID-19) #calm #peaceful #lovely #water #FitnessBodyAsia @MacRitchie Reservoir https://www.instagram.com/p/B_HvBdpj6QP/?igshid=1pa6l9t1qn0d8,1251475488683569154,fitnessbodyasia,
2020-04-18 11:12:05+00:00,“Pengaruh Tingkat Kepesekan Hidung Terhadap Pemakaian Masker Selama Pandemi Covid19” Udah bisa dibikin judul skripsi.,1251468540722307074,rckymrz,
2020-04-18 10:37:03+00:00,Masterchef na kami dahil sa COVID19. 🤣 ,1251459721246040064,CharmelleMutia,
2020-04-18 10:21:29+00:00,Colleague : name 1 thing that is made from china and can last long Me: covid 19.,1251455805171232768,theshowoff20,
2020-04-18 10:05:26+00:00,"‘Semoga kita semua dilindungi dan dijauhi oleh wabak Virus Covid-19, In shaa Allah. Ameen!’ ♻️🇲🇾♻️ . . . . . #StayAtHome #KitaJagaKita #SayangMalaysia #SongCongCodei @Johor Bahru https://www.instagram.com/p/B_HkO8RJa3o/?igshid=11bvr8a0zrlap",1251451764940906497,___Hisyxm,
2020-04-18 10:02:29+00:00,Ubiquitous home testing for COVID-19 - ,1251451022930702347,simonkearney,
2020-04-18 09:31:11+00:00,"这日子 麦当劳都不能吃了 喝奶茶呗 😑 #covi̇d19 #milktea #nomoremacdonalds @Woodlands, Singapore https://www.instagram.com/p/B_HgUJPh6gT/?igshid=gojcy5vg5d7x",1251443145881145347,black_angel_JJ,
2020-04-18 09:30:22+00:00,I wanna ride outside with friends :( Covid-19 please end faster so i can be outside @Tanah merah Coast Road https://www.instagram.com/p/B_HgORhn2sV/?igshid=11dtajajlyzs2,1251442941090050049,FragilePenguin_,
2020-04-18 07:56:10+00:00,Thank you Dr St John for joining us! Looking forward to learning from you. #covid19 #vaccines,1251419235944812544,hsienlei,
2020-04-18 07:55:09+00:00,"#Singapore adds 942 confirmed #Covid19 cases, with total now surpassing Malaysia. Good that @sporeMOH is releasing figures earlier. Previous practice of releasing data at night gave rise to fake news. Officials shld consider daily televised presscons too.",1251418977630171136,jbhavan,
2020-04-18 07:52:44+00:00,Tak percaya sgt artis2 buat kutipan derma utk covid19 ni. korang kalau nk menderma boleh salurkan pada @tweetebitlew sekurang2 nya kite nampak and tau kemana duit tu pergi,1251418369502310400,FitriAzahraaa,
2020-04-18 07:36:40+00:00,"Hope the foreign workers are okay though. They must be so afraid knowing each day, someone they know is taken away. May the peace of God be with them and healing will flow through their veins right now to help them conquer #covid19",1251414329426972672,GLWT2403,
2020-04-18 07:29:09+00:00,"Day 12: Sambal ikan, sup sawi fishball, telur dadar. #menuoftheday #byyourstruly #bismillah #alhamdulillah #circuitbreaker #covid19 #stayhome @Boon Lay Meadow https://www.instagram.com/p/B_HSWVwhNAxm3-FHEJ3z4nQfneCLdJ_skXlxpY0/?igshid=j32h820ym9rb",1251412434516131841,roselynaris,
2020-04-18 07:21:02+00:00,"Circuit Breaker be like 😂😂😂 #thanksgod #ofwlife🇵🇭 #stayhome #missingthem #edits #picsart #covid19 @Woodlands, Singapore https://www.instagram.com/p/B_HRa6ujLQD-ltlD6k2rC4hMpyW898MOtP1wL40/?igshid=71c2x0uvthzy",1251410392905121793,glennb15,
2020-04-18 07:11:19+00:00,- 最近很多人都開直播唱歌 就是沒有人開直播念經 要不要我開直播念經呢🤔 #StayAtHome #SaveMalaysia #Covid19 @Johor Bahru https://www.instagram.com/p/B_HQT0jAWO2/?igshid=er2rmptfgjoc,1251407948796121089,LucusLer,
2020-04-18 06:46:35+00:00,"Ada kemungkinan tidak akan ada herd immunity untuk #COVID19 ""The expectation that ... the majority in society may have developed antibodies, the general evidence is pointing against that, so it may not solve the problem of governments."" ",1251401724637483009,ainunnajib,
2020-04-18 06:45:26+00:00,4 dari temenku hari ini terpaksa dirumahkan dr kerja karena covid-19. Sedih 😭😭😭,1251401433410187264,putraaaws,
2020-04-18 06:08:12+00:00,"Just because we want it to, doesn’t mean it will. #fatherandson #askingforavirus #covi̇d19 @One Kind House https://www.instagram.com/p/B_HJFgrHLnW/?igshid=doh09iqrut46",1251392064606142465,yerrowman,
2020-04-18 05:51:03+00:00,About last night. #chill #Covid_19 #StayHome #isolation #lockdown #StayAtHome #SocialDistancing,1251387747203338242,jobeetweets,
2020-04-18 05:03:27+00:00,"The Covid19 Pandemic has caused many working adults to lose their job. In 2018, we had a breakthrough to equip participants who want to take charge of their finance to learn and able to plot the chart… https://www.instagram.com/p/B_HBq9RjvLF/?igshid=16mzfixb32hpw",1251375769877721089,raynlim,
2020-04-18 04:53:50+00:00,Nip it in the bud before it explodes into something very ugly undermining our unity. Call out Thks. @MOHsg @STcom #SGUnited We don't wt to end up like with new China bias on blacks _ foreigners based on xenophobic views esp during Covid-19. Singaporeans pse stay united. Bless,1251373350821040128,KassimARah,
2020-04-18 04:47:58+00:00,"4 reps this morning. Shall increase by one rep each week. See whether I can do 6 reps by the end of circuit breaker. It shall not only be a COVID-19 circuit breaker, it shall be my fats circuit breaker as well! 💪 – at Ghim Moh Edge",1251371870881902592,MichaelSChia,
2020-04-18 04:14:10+00:00,"On an average about 9 M people die every year in Indian?(7% mortality rate assuming 1.3B population?If so, under 500 deaths due to #Covid_19 is a stupendous achievement.Kudos to much maligned Indian governance systems,politicians,Babus,doctors &amp; law enforcement agencies 👏👏 ",1251363366297194497,RajeshChakram,
2020-04-18 04:12:21+00:00,Sometimes you got to be Beauty and the Beast... 🎶 A whole new world 🎶 eh... wrong movie... . . . #movementrestrictionorder #movementcontrolorder #MRO #mco #coronavirus #covid19 #covid_19 #bamboo #besafe #staysafe… https://www.instagram.com/p/B_G71DkH7vZ/?igshid=1dywx7dm7zg51,1251362911215407104,SyaSyazlee,
2020-04-18 04:11:22+00:00,"Of all the sports, I really think PAINTBALL is one that can go on during this Covid-19 period for a few reasons... 1. We ALWAYS abide to the term ""MASK ON!"" 2. The Referees will swarm you the moment the mask is not… https://www.instagram.com/p/B_G7tkYBfE3/?igshid=plv7wm15ehb1",1251362662723846146,DinMonzter,
2020-04-18 04:07:59+00:00,Where all those #COVID19 nice render-like images come from? This @voxdotcom video explains the process of seen a ~100nm virus particle,1251361810801848320,TmarcoH,
2020-04-18 03:50:19+00:00,Latest info of Dutch Netherlands Enterprise Agency and #Covid_19 @RVO_Int_Ond @NLinSingapore,1251357365481267200,MargrietVonno,
2020-04-18 03:24:42+00:00,A once bustling shopping strip turned into a ghost town. These pics were captured by my brother. 📸 Jerome Ong #CCB #Circuitbreakersg #MySingapore #Singapore #SGUnited #COVID19 #stayhome #StayHomeMusings @Orchard… https://www.instagram.com/p/B_G2X3YHP0j/?igshid=udlr0fqzmcu,1251350916323700736,SunGoddessTarot,
2020-04-18 03:06:05+00:00,"I agreed, these are the few bunch of people who should work with MOH at Singapore Expo to care the 450 patients recovering from Covid-19.",1251346233743966209,Tugiman2439,
2020-04-18 02:44:16+00:00,"The Rays Of Hope during Covid-19 pandemic CCB day 12 @Jurong West, Singapore https://www.instagram.com/p/B_GxvyAJxiv/?igshid=11gvn7myjc4su",1251340743161057281,Saniroz,
2020-04-18 02:18:18+00:00,Saturday is a day to be happy but I'm not. Why? Feeling trapped and like a caged bird. So Covid19 please fuck off and never return. #akunickmikhail @Singapore https://www.instagram.com/p/B_Guxr1DUTo/?igshid=1s1vto4tdrptp,1251334208125128705,hombretwentyone,
2020-04-18 02:00:30+00:00,"I'm so amazed by the fact that china nationals who can't even speak a word in english has a job here in Singapore but some of our Singaporeans are jobless. Not talking with regards to covid 19, i'm just saying it in general.",1251329728650174465,theshowoff20,
2020-04-18 01:15:25+00:00,"#circuitbreakingorange day 12 - this is how we get our fresh vegetables now, via delivery. This amount can last the two of us for about a week. #fullfridge #freshveggies #covid_19 #stayathome #stayhome #singapore… https://www.instagram.com/p/B_GnlMXFuMV/?igshid=1bsapih0b6wio",1251318384702230528,hongruilee,
2020-04-18 01:12:12+00:00,Thanks @STcom for sharing about #SGStrong Lots of heart by lots of folks during this difficult time of #COVID19 ,1251317574245072898,martintan,
2020-04-18 00:50:40+00:00,Every Covid-19 ad is the same. H/T @Mumbrellanews,1251312152939388931,kbeddoe,
2020-04-18 00:48:44+00:00,"Could it be? The guys at Gilead Sciences may have found a treatment for COVID-19 - in the form of their drug, Remdesivir. (Shares up as much as 17%, Dow also jumps) We wait with bated breath...",1251311665716424704,ElizabethNeoCNA,
2020-04-18 00:45:34+00:00,"When will this all end? No one knows. Not really. And even when it does, the life we get back to will not be the one it was. My thoughts on staying positive amid amid #COVID19 for @successmagazine https://www.success.com/finding-courage-amid-uncertainty/ #FlattenTheCurve",1251310870828683264,margiewarrell,
2020-04-18 00:21:45+00:00,Let’s test all the people who went there... problem you did not get enough tests.. see how many have COVID-19. And you want to almost see how many of them die.. let’s see who’s irresponsible and is talking after that... common sense and stupidity is ruling USA,1251304876392488960,DannyDuijs,
2020-04-18 00:12:33+00:00,"I don't understand why you bother about China when your own country has the highest numbers of COVID-19 cases now, Mr President @realDonaldTrump",1251302561010728960,Anis_Ashraff,
2020-04-18 00:09:24+00:00,COVID-19 Fun moment @Singapore https://www.instagram.com/p/B_GgAVUgOou/?igshid=qwfbe8yb0ibj,1251301767440150530,Gulfee_Karthi,
2020-04-17 23:38:15+00:00,Stop becoming crazy at home.🤯 Keep calm and have a juice cleanse.😇 Grab your covid-19 promo set of 10 bottles freshly coldpressed juice delivered right to you at only… https://www.instagram.com/p/B_GcdXfn4vT/?igshid=19r2gf4u3kycp,1251293929238138880,JuiceTales,
2020-04-17 23:03:52+00:00,Exploring my archives | voluntary distancing | #covid19 #stayhome #singapore #sgmemory @Rochor Centre https://www.instagram.com/p/B_GYhpqn3ol/?igshid=76wfw18e6spk,1251285278767144960,JeromeKG,
2020-04-17 22:46:54+00:00,@narendramodi Donald Trump said our scientific community is working hard to try novel therapies for COVID19. Modiji Where are we funding our science. The only funding we give Is for Space research. We hardly support science.For us ancient India had great science.,1251281005924642816,Narasim20561265,
2020-04-17 22:34:45+00:00,Understand the seriousness of #COVID19 &amp; The real doctors and Nurses are the god right now..so follow their instructions strictly... ,1251277949401067520,arunr93,
2020-04-17 20:42:45+00:00,Updates on the COVID-19 Situation ,1251249765574078464,Lynalexz,
2020-04-17 19:49:28+00:00,"foot reflexy , full body massage body scrub. pembersihan dimandikan Dll. All in treatment 90menit outcall only Batam whatsapp +62895383316656 #massagebatam #Covid_19 #StayAtHome #modelbatam",1251236354203070464,Kevinbrian931,
2020-04-17 19:42:15+00:00,"Nu mask, who dat? 😂🦠 • It’s Friday night, &amp; I’m home doin’ a mask haul tryout... 😆😅😝 • Also, stay the f**k home y’all! • #fridayvibes #covıd19 #2020 #sarscov2 #lifegoals💯 #yoloswag #pandemic2020 #maskon #iphonex… https://www.instagram.com/p/B_GBc3-BtOO/?igshid=182zj2pi9mn19",1251234540493983748,ryo741,
2020-04-17 19:32:53+00:00,The difference in just few days! These are legit client’s review! Keep yourself healthy during Covid-19 period Do you experience it too? ㅤ ㅤ ㅤ #susenjigold #chinlift #beauywithin #orangemofa #detox #innerbeauty… https://www.instagram.com/p/B_GAYPrBohN/?igshid=htnmfyf9enpv,1251232180103233537,flutterytips,
2020-04-17 19:32:30+00:00,The difference in just few days! These are legit client’s review! Keep yourself healthy during Covid-19 period Do you experience it too? ㅤ ㅤ ㅤ #susenjigold #chinlift #beauywithin #orangemofa #detox #innerbeauty… https://www.instagram.com/p/B_GAVcUB0eP/?igshid=qeilep5dkph1,1251232085869826050,flutterytips,
2020-04-17 19:22:35+00:00,"Nu mask, who dat? 😂🦠 • It’s Friday night, &amp; I’m home doin’ a mask haul tryout... 😆😅😝 • #fridayvibes #covıd19 #2020 #sarscov2 #lifegoals💯 #yoloswag #pandemic2020 #maskon #iphonex #randomthings #onfleek #truth💯 @… https://www.instagram.com/p/B_F_Mtmhyd1/?igshid=1w3uoe56e2emr",1251229587926913024,ryo741,
2020-04-17 19:02:59+00:00,"Kalau menurut kelen bisa melawan covid19 dengan gowes, ngeym, lari, salto, gowes malam ku rasa ada sariawan di otak kelen. Kalo emang itu semua bisa, pemerintah ga akan nyuruh kalian di rumah. Gak akan. Jadi jangan stupid 🐕💕",1251224658264784896,Abeeptr251,
2020-04-17 18:21:22+00:00,"Despite staying at home and the rising cases of Covid-19, remember there is always hope and light amidst the gloom. You may feel trap but optimism will carry you through your darkest or loneliest of times...… https://www.instagram.com/p/B_F4MjNAMpF/?igshid=19ndv148gaoaj",1251214182931935238,teelip,
2020-04-17 16:42:20+00:00,"#nerdytime A week of COVID-19 stories. The backstage of the projects, some curiosities and my favorites ",1251189260125827072,TmarcoH,
2020-04-17 16:37:17+00:00,"My Covid-19 timeline has the sources for this thing at the 31 December entry, if you want to check for yourself: ",1251187991743049728,sehof,
2020-04-17 16:20:48+00:00,"‘We have an ongoing surveillance programme, where a small sample of patients at our primary care facilities are tested for Covid-19 infections’ ‘We have picked up some cases through these tests, which is an indication of undetected cases in the community.’ ",1251183841030492160,sehof,
2020-04-17 15:57:57+00:00,Orchard road just few days before Covid-19 Circuit Breaker. A rare scene I would dare say first time ever in my life. #trialanderror #jessnalism @Orchard https://www.instagram.com/p/B_Fnx-WHx0V/?igshid=agqgmiojilh1,1251178090832842752,Jesslam03,
2020-04-17 14:47:40+00:00,"You’re right, more than 25 dorms now. #singapore #COVID19",1251160403297447938,grodog,
2020-04-17 14:19:41+00:00,"Ungkapan cinta dan dukungan utk tenaga medis sebagai garda terdepan dlm penanganan COVID-19 #documentary #antarafoto #covid-19 #love #kanua_shots #photojournalism @Batam, Riau, Indonesia https://www.instagram.com/p/B_FcidpnFiS/?igshid=3dxf52vk52pj",1251153364030640131,Kanua_Black,
2020-04-17 14:17:36+00:00,"My boss said to take a second look and see where i can cut cost. God, i don’t have a choice but to cut the October’s. Wooo.. pls stop spreading #Covid_19",1251152838484344835,RaiGonzales,
2020-04-17 13:46:44+00:00,Can't wait for the Covid-19 situation to be over. Miss SUP-ing &amp; kayaking. ,1251145072034189312,PremaSam90,
2020-04-17 13:30:28+00:00,"Circuit Breaker, 17th April 2020, Day 11, doing the essentials... #Singapore #PeoplesCreatives #PassionPassport #Empty #Landscape #Covid19 #ExploreToCreate #CircuitBreaker #StreetMagazine #IG_Masterpiece #GameOfTones… https://www.instagram.com/p/B_FW5t3nqvM/?igshid=nbeuricha6uo",1251140976258641922,Wyn_photos,
2020-04-17 13:12:58+00:00,Remember to wear your mask! #Covid_19 #coronavirus #SpectrumFa #archerytag #archerytagsingapore – at ACE The Place CC,1251136572025528320,TeamSpectrum__,
2020-04-17 13:06:41+00:00,#Covid_19 #COVID #circuitbreaker,1251134990168907777,Ali_Naseer786,
2020-04-17 13:00:59+00:00,#jogging #Covid_19 😷🏃‍♂️🏃‍♂️ ,1251133555213651970,Ali_Naseer786,
2020-04-17 12:22:10+00:00,Berjoget depan tv tengok statistik covid-19. Not funny enough sis!,1251123787417804800,AziziDain,
2020-04-17 12:08:11+00:00,Stay home to save lives ... be calm .. have a rest ... Dream ! 😴😴😴😇😇😇😘😘😘#covid_19 #stayhomestaysafe #stayhome #staysafe #homequarantine @Singapore https://www.instagram.com/p/B_FNfNpn7he/?igshid=1dmmtpewuoja2,1251120267163828225,MySECRETCorner,
2020-04-17 11:55:27+00:00,Demikian juga dengan yang berteriak tentang betapa bahayanya #COVID19 akan diperlakukan seperti Y2K juga. https://twitter.com/rileyjsilverman/status/1250803006632685570,1251117063285817346,ainunnajib,
2020-04-17 11:15:14+00:00,I am 80% certain this CB is going to get extended for at least 2 weeks.. and SG is going to rise to at least top 30 (to be conservative) of Covid19 cases in the world..,1251106942015041536,cassis_rose,
2020-04-17 10:49:40+00:00,"Keep others, your family and yourself safe . Stay home! #covid_19 #stayhome #homequarantine #selftaughtartist #beadstash #homesweethome @Singapore https://www.instagram.com/p/B_FEgJsnynW/?igshid=alsa66ije9gw",1251100510716784641,MySECRETCorner,
2020-04-17 10:44:10+00:00,"Harus diakui Arab Saudi 🇸🇦 jauh lebih bijak, cepat dan tanggap merespon wabah #COVID19 Sangat tidak terbayang apa yang bisa terjadi di negara-negara Muslim kalau Saudi telat menutup umroh. Sementara itu pemimpin Indonesia 🇮🇩 malah minta warganya dikecualikan dibolehkan umroh 🤦🏻‍♂️ ",1251099126814531584,ainunnajib,
2020-04-17 10:40:43+00:00,kudap-kudapan dlu..🤤🤤🤤 #kekbatikhomemade #day31 #covıd19 #semilockdown #movementcontrolorder #ᴋɪᴛᴀᴊᴀɢᴀᴋɪᴛᴀ #covidjahat @Dapur @Kitchen https://www.instagram.com/p/B_FDekkheC7/?igshid=1f092pspqb3xv,1251098257813655553,AqibShahrom,
2020-04-17 10:40:37+00:00,"1351 cases in 2 days! This is coming our to be uncontrollable now 😱Singapore reports 623 new cases of COVID-19, most of them foreign workers in dormitories ",1251098232232476673,Hi_Dalvinder,
2020-04-17 10:14:10+00:00,"In light with the recent Covid-19 situation, i hope you will understand the space between us. Love is never about the distance Khai. NEVER. *bukak seluar*",1251091576064892928,nasrulljarlani,
2020-04-17 10:02:25+00:00,- 太陽公公真的是太熱情了啦 #MCO #Covid19 #StayAtHome @Johor Bahru https://www.instagram.com/p/B_E_GC_gpsF/?igshid=hnklwdpolczr,1251088616987799552,LucusLer,
2020-04-17 09:49:15+00:00,Our journey to the most challenging times ahead...the stillness of our roads with less carbon emissions during Covid-19 pandemic have have changed the environment with bright n clear skys....as I've done my own… https://www.instagram.com/p/B_E9llBJRsx/?igshid=17j5j6urdt9co,1251085306658320384,Saniroz,
2020-04-17 09:48:36+00:00,Sesuatu pengurangan kes yg memberansangkan. Harap berterus-terusan hingga capai 0 jangkitan #DudukRumah #HapusCOVID19 #Covid_19 #JustStayHome,1251085142338072577,oscarjoshua69,
2020-04-17 09:33:51+00:00,"This might be the hardest time for all the leaders of the world, anything wont work if the citizens are at worst, themselves. #covid19 ",1251081428357406720,aoisakumura,
2020-04-17 09:12:45+00:00,Tens of thousands of foreign workers are in quarantine as Singapore reports a spike in COVID-19 infections across migrant worker dormitories. https://infographics.channelnewsasia.com/covid-19/singapore-map.html via @ChannelNewsAsia,1251076120872513536,emikofrancois,
2020-04-17 09:11:55+00:00,dear sir i am suraj kumar bhaskar. I am studying in Trinity international college Singapore. Now this time is so difficult during covid-19 in Singapore. All indian students very hartfull to surviving. I grant to request to you please be airlift for all Indian student. We wnt cmb ,1251075908208783361,SurajKumarBhas4,
2020-04-17 08:40:57+00:00,Uncle Sam’s pandemic is not from the Covid-19..... it’s from POTUS. ,1251068116156641283,PuvenTirren,
2020-04-17 08:40:31+00:00,Found a good rhythm to work with daily - my circadian rhythm is slowly going back into motion without the disturbance of an alarm ⏰🚨 #sleepcycle #health #stayhome #Covid_19,1251068007041732610,etchedhands,
2020-04-17 08:13:52+00:00,"Yaaaass, just received an e-mail that there’ll be a mini 200sgd bonus this month “in recognition of your perseverance in the face of Covid-19” wow. Kala front liner but then! Thank you padin 🙏",1251061301473771521,fafuierice,
