Datetime,Text,TweetID,username,geo
2020-04-17 08:07:00+00:00,"Thanking Temasek Foundation for continuing #RISING Solidarity &amp; Collaboration during this critical time to address COVID-19 Pandemi. Sanitisers, PCR machines, PCR based covid-19 test-kit, surgical masks, PPE,… https://www.instagram.com/p/B_Ex4kRD86n/?igshid=hl71k9vbddyr",1251059571440799744,SwajayaN,
2020-04-17 08:06:54+00:00,"Get ready to jumpstart your business after the #COVID19 #circuitbreaker. van graphics are the easiest and most cost effective way to get your brand, product or service the maximum visibility. #signaramacbdsingapore… https://www.instagram.com/p/B_Ex2fclwoT/?igshid=11kqg7qxwg1pr",1251059549961928705,SignaramaCBD,
2020-04-17 08:04:34+00:00,Kinda doing my own WFH (Work From Home) haha #WFH #COVID19 #circuitbreakersg,1251058961542901765,Cheejyg,
2020-04-17 06:57:40+00:00,"#BatAppreciationDay, a thread There has been a lot of flak regarding #bats with the recent #COVID19 global pandemic, especially with the unnecessary culling of bats in a erroneous attempt to prevent the spread of the virus. ",1251042123199049728,JKannanR,
2020-04-17 06:30:50+00:00,"Pada saat2 mewabahnya Covid-19, jadi sulit untuk mencari Lunch or dinner. Da Vienna menawarkan solusi dan menu2 yang menarik. Yuk di coba gaes.... Kami siap mengantarnya ketempat anda... For order… https://www.instagram.com/p/B_Em4SjlvAw/?igshid=h053u3ojc225",1251035374266146816,davienna_hotel,
2020-04-17 06:23:08+00:00,People are all in this together... #covid2020 #Covid_19 #StaySafe #gratitude #Grateful #circuitbreakersg #lockdown #PeopleFoodPlanet #StayHomeStaySafe,1251033433725235201,dr_ashok0124,
2020-04-17 06:02:14+00:00,"Done with marketing and back home on time for lunch and 1pm online sharing session by my fellow colleague on what are the opportunities in real estate during and after the Covid-19 situation💪 ! @Jurong West,… https://www.instagram.com/p/B_Ejm-bn3NV/?igshid=14tf80uh2pc6t",1251028174525382658,milsonng,
2020-04-17 05:18:51+00:00,Thank you Farouk Braimah and @sdinet for shining a light on the ongoing fight to protect lives in slums. #COVID19 is a new virus that adds to existing challenges for slum dwellers worldwide. #COVID19 is an opportunity to increase investment to help vulnerable communities. ,1251017257288781835,LaurenSorkin18,
2020-04-17 05:15:11+00:00,Lol good one China. Looks like they just purchased an installment plan to incrementally report deaths #COVID19 #Wuhan,1251016334072090625,karthik_20,
2020-04-17 04:29:36+00:00,COVID -19 in Singapore #COVID19singapore #COVID19Maldives #Covid_19 ,1251004863158251520,Ali_Naseer786,
2020-04-17 04:23:56+00:00,"Have we noticed one thing. In the lockdown mode, most people seem healthier at home with not as many emergencies that one sees usually. Home made food, fresh air and doctors not pushing medicines, maybe. #lockdown #justsaying #Covid_19 #HomemadeFOOD",1251003434922201089,JagdishMahapat1,
2020-04-17 04:19:31+00:00,"COVID-19: Singapore confirms record 728 more cases, 5 new clusters; total at 4,427. #Covid_19 #COVID19Update #Singapore https://sg.news.yahoo.com/covid-19-singapore-confirms-record-728-new-cases-majority-linked-total-at-4427-151135988.html?soc_src=community&amp;soc_trk=tw via @yahoosg",1251002326019522560,AquibIkubal,
2020-04-17 04:16:27+00:00,"And we have banks in India, they charge PL and interest during this period! Shame! #coronavirus #COVID2019india #Covid_19 ",1251001554561187841,AquibIkubal,
2020-04-17 02:58:17+00:00,"The Spanish flu, yet the virus is called #COVID19 and not from whr it came from. #usa",1250981884189802498,KassimARah,
2020-04-17 02:57:22+00:00,@sporeMOH @NEAsg @govsingapore I think you need to test all the SG resident with covid19 test kits. And do disinfection in whole island.,1250981652592902145,bryantoh8881,
2020-04-17 01:50:41+00:00,Crazy Nancy is the Face & Enabler for Covid-19😂😂😂😂,1250964869047697408,Firehorse77,
2020-04-17 01:37:13+00:00,"H-7 Marhaban Ya Ramadhan. Bulan suci ramadhan semakin dekat. Mari kita panjatkan do'a bersama, memohon kehadirat Ilahi agar wabah Covid-19 ini segera hilang dan berakhir... Agar kita bisa beribadah menjalankan… https://www.instagram.com/p/B_EFRqvFG7s/?igshid=1jw31uv9tf4vd",1250961479593013250,davienna_hotel,
2020-04-17 01:24:20+00:00,Avo and Scrambled Egg Bagel For Breakfast! #breakfastofchampions #avocado🥑 #workfromhome #covi̇d19 #circuitbreaker #circuitbreakersg #circuitbreakerday11🇸🇬 @Singapore https://www.instagram.com/p/B_EDzltl5ji/?igshid=1c4lwzwdxgu9h,1250958237710651401,RySchleck,
2020-04-17 01:19:05+00:00,"All the solutions we're working on now around essential activities, contact tracing, remote working, universal broadband - we'll need those again. COVID-19 isn't where this ends.",1250956916974481408,kiwibrew,
2020-04-17 01:17:31+00:00,"Mask on. Almost forget to put on my mask when I step out of the house earlier. Guess how many masks have I put on? Reminder: [Sent by http://Gov.sg - 15 Apr] *COVID-19: Mask up when out* Stay at home, unless for… https://www.instagram.com/p/B_EDBarnbSJ/?igshid=1ptd2aayayhzs",1250956522185650176,milsonng,
2020-04-17 01:00:15+00:00,"Banyak org bijak pandai kat singapore ni.. New case dah 728.. Still lagi boleh relax2, smoking & etc. 💆‍♂️ #COVID19 #StayAtHome",1250952176123273221,Asylums,
2020-04-17 00:39:41+00:00,What to do during covid19 pandemic? Stay home! Watch Isa pa with feelings. #POPMyxVJMaineDay6 #MaineMendoza Parang Kailan Lang,1250947000842850305,lili_eyebags,
2020-04-17 00:29:16+00:00,Stay home. Iwas covid19. Watch #POPMyxVJMaineDay6 #MaineMendoza Isa pa with feelings. Parang Kailan Lang,1250944382250790912,lili_eyebags,
2020-04-16 23:52:25+00:00,It's #compulsory to #wearamask now in #singapore #outside .. 🤗☺️☺️ . #lifeofrosse #wearmask #covi̇d19 #coronavirusoutbreak⚠️ #covid_19 #circuitbreaker #singapore🇸🇬 #singaporefashion #singaporedancer… https://www.instagram.com/p/B_D5SI_hOjz/?igshid=1682tny84kemh,1250935106627424257,rosse_tdl,
2020-04-16 23:46:21+00:00,. #wecareweshare #westayatworkforyoupleasestayathomeforus #stayathome #kitajagakita #jangandegil #usemask #usehandsanitizer #washyourhands #covid_19 #corona #loveyourself #loveyourfamily… https://www.instagram.com/p/B_D4l9OjoLX/?igshid=xkc6417qvuvv,1250933581729447936,Saidatulamalina,
2020-04-16 22:32:30+00:00,Chapter 135 Act 2: That's the most gracious act from the Chicken Rice stall in Ang Mo Kio that offer 1089 packets of Chicken rice to people who are in need or Taxi & Private Hire Driver during the Covid19 Circuit… https://www.instagram.com/p/B_DwI4Fnyrg/?igshid=1axe26g258gw4,1250914994767704066,Leeqiuwei,
2020-04-16 19:04:54+00:00,"Ramai lagi yg keluar tak tentu hala masa PKP ni. tangkap je yg degil2 ni & suruh diorg backup frontliner. buat cleaning kat wad covid19, kemas2 katil ke, mop lantai ke. tengok tahan ke tak diorg ni. #StayAtHome #DudukRumah #COVID19 #KitaJagaKita #KitaMestiMenang",1250862750563065857,WanSB_WanNawi,
2020-04-16 17:21:00+00:00,i hope this COVID19 situation will end soon,1250836604601524224,_nsyqh,
2020-04-16 16:31:05+00:00,"do your own research on Covid-19, its much more frightening then what we mostly perceive. now that i learnt more what is capable of this virus, its a blessing you have not caught it and we should take our isolation orders from the government as a huge helping hand.",1250824043864797185,BLinthehouse,
2020-04-16 16:27:09+00:00,728 new #COVID19 cases today in Singapore ,1250823051719008257,zest_singapore,
2020-04-16 16:25:11+00:00,"Am I the only who is not shocked with the recent spikes of Covid-19 cases in Singapore? Like, I can’t with the reaction of Singaporeans seeing the number of new cases everyday. I mean like, in one of LHL’s earlier speeches, it’s already mentioned we are expecting the number -",1250822557516935173,bintmohari,
2020-04-16 16:10:30+00:00,Humanity in action in times of crisis #global #motivation #benevolence #humanity #singapore🇸🇬 #covi̇d19 @Singapore https://www.instagram.com/p/B_DEX5PjRRe/?igshid=1eic4yc1joz9o,1250818862779678721,jwalantudesai,
2020-04-16 16:03:26+00:00,"Bila satu start kecundang ah Mula lah yang lain berjangkit.. 🔋🔋battery dah lebih setahun tak boleh warm-up engine je, kene drive jugak at least stgh jam.. #musimpkp #pkp #franz #covid19 #stayathometv3 #hiluxtrd #hrv… https://www.instagram.com/p/B_DDnPihz94/?igshid=jz7vbgv17pc7",1250817083472056320,faliqfarhan,
2020-04-16 15:47:02+00:00,The new mask...ideal. Swipe left for improvised version. #covid19 #mask #sgunited #hatevirus #youarenotalone #fightcovid19 @The Peak @Balmeg https://www.instagram.com/p/B_DBvG6H5_i/?igshid=1jaanr5tn88fp,1250812955983335430,AngelaLoh,
2020-04-16 15:46:59+00:00,How tf did covid-19 cases rise up so much even with circuit breaker???,1250812943156965376,ShaunDanish,
2020-04-16 15:42:54+00:00,"Singapore coronavirus cases cross 4,000 with 728 cases in new daily record #singapore #covid19 ",1250811914583605253,asiaonecom,
2020-04-16 15:39:39+00:00,"Coronavirus: As of 16 April 2020, 12pm, the Ministry of Health has confirmed and verified an additional 728 cases of COVID-19 infection in Singapore. #covid19 #singapore",1250811099726753795,asiaonecom,
2020-04-16 15:38:05+00:00,Really heart wrenching. #StayAtHome #WearAMask #COVID19 #COVID19singapore,1250810705638350848,oscarjoshua69,
2020-04-16 15:35:32+00:00,@sporeMOH @STcom Posted latest already. Its heart wrenching. #COVID19 #COVID19singapore #StayAtHome #StaySafe #putonmask,1250810064660619264,oscarjoshua69,
2020-04-16 15:31:13+00:00,How the fuck you bitching abt covid19 ruining ur nightlife but yet I still see you going out with yr friends and even to their house? Brainless fucks,1250808976502976515,M4lev0lent,
2020-04-16 14:23:50+00:00,"So sad to read this. Game of Life and Cellular Automata were a big part of my falling in love with computer science. John Conway, inventor of the Game of Life, has died of COVID-19 ",1250792019053514752,caesars,
2020-04-16 14:08:52+00:00,"If after the COVID-19 nightmare ends, you feel like you’ve found your calling in dancing or cooking and want to pursue this - kindly slap yourself and get back to work. Also, here’s a nice meal I cooked. ",1250788252987977729,WhiteNoiseAF,
2020-04-16 13:19:35+00:00,"In our current situation, connection before content and curriculum is important more than ever. I wish all families understood this... #homelearning #COVID19 #balance #wellbeing",1250775849210540033,megziannone,
2020-04-16 13:03:26+00:00,Fight Covid19 with some immunity nutrition.❤️ ,1250771786116919297,conventgirl12,
2020-04-16 12:54:01+00:00,"Yeap. Saw this coming a mile away. That COVID19 will just be a trigger. And after a smidge of the virus, the people's ""call to freedom"" will make this pandemic go on and on in USA. ",1250769414691020801,FarieRose,
2020-04-16 12:31:33+00:00,"@tanjooilong Study shows Iceland got it right with early, widespread COVID-19 testing https://www.channelnewsasia.com/news/world/covid-19-iceland-testing-early-widespread-symptoms-screening-12645468#.XphQBeKP8gY.twitter",1250763759611596801,_rodahidup,
2020-04-16 12:20:56+00:00,"GE Healthcare and Microsoft have launch a cloud-based #COVID19 #patientmonitoring software for #healthsystems, providing a central hub from which hospital staff can monitor #patients in intensive care units. #medtech #DigitalHealth #healthIT https://techcrunch-com.cdn.ampproject.org/c/s/techcrunch.com/2020/04/15/ge-healthcare-and-microsoft-are-bringing-a-covid-19-patient-monitoring-tool-to-health-systems/amp/",1250761088745893888,GabrielSim,
2020-04-16 12:04:58+00:00,COVID-19 is turning her crazy... she thought the curtain is her dress 😅🤣 #stayhomestaysafe #staysafe #ootd #covi #coronavirus @Singapore https://www.instagram.com/p/B_CoT-mHJm2/?igshid=1p41iy2lnxgyp,1250757069851983874,chokfern,
2020-04-16 11:45:39+00:00,Kang Emil ini memang paling riil & kongkrit responnya atas wabah #COVID19 dibandingkan pemimpin-pemimpin bangsa kita yang lain saat ini. ,1250752208695554048,ainunnajib,
2020-04-16 11:31:22+00:00,Want to know how you can help to support others locally during #COVID19? Check out this @GlblCtzn article now on how we can all make a difference!,1250748617888985093,GowthamanR,
2020-04-16 11:24:45+00:00,The #COVID19 crisis has provided a great opportunity to demonstrate the value of #digitalhealth technologies in managing #publichealth challenges.,1250746950736941057,GabrielSim,
2020-04-16 10:20:22+00:00,"I'm mandatory quarantined for 5 days due to a respiratory infection, probably just mycoplasma, but I cannot leave the house. Failure to comply is $10K fine and/or 6 months in jail. I'm pretty sure it's not #COVID19. Send red wine. ",1250730748098699265,mbspinks,
2020-04-16 09:51:49+00:00,Aku rasa Singapore weekend ni mesti lintas Malaysia dlm confirmed case Covid-19.,1250723563385974784,HarirZharfan19,
2020-04-16 09:50:50+00:00,🤦‍♂️ It is “ Addu City” and should have COVID 19 test facilities 😳,1250723314282008576,Ali_Naseer786,
2020-04-16 09:50:29+00:00,"Belgium have just announced their Covid19 figures. Christ they're in trouble, now a death every 7.2 cases. I dont know whats gone wrong over there.",1250723229385121792,Marvo5Marvo,
2020-04-16 09:18:38+00:00,A clean room is a happy me 😄 #stayhome #COVID19 ,1250715212639944704,etchedhands,
2020-04-16 08:22:55+00:00,"The War Discourse Trap⁣ ⁣ [•]⁣ ⁣ It is common to frame the covid-19 pandemic as war. Doctors are on the front lines, a battle for mankind, we wage war against the virus.⁣ ⁣ This is a trap.⁣ War is always a… https://www.instagram.com/p/B_CO6RLh6uu/?igshid=16betxnghefak",1250701190012207104,timomitimo,
2020-04-16 08:16:24+00:00,"Covid-19 CircuitBreaker CB-Day10...very hot n bright beautiful greenery..highway emptiness towards Tuas... @Bulim Village, Singapore https://www.instagram.com/p/B_COKpyp_VW/?igshid=szf5b54tgj59",1250699552723734529,Saniroz,
2020-04-16 08:09:08+00:00,A 99 year old Briton raised 2.5 million to fight Covid 19 in the UK. 30 year olds saying they are feeling old and feel like they have not achieved anything in life please understand you are a baby and you have a lifetime to achieve something and walk on your own authentic path.,1250697720706318336,ShabirMusic,
2020-04-16 07:37:11+00:00,"Covid 19 is costing jobs and many of us have left with no choice but to stay at home. Is it possible to earn an income from home? Although economic data is bad, the stock and… https://www.instagram.com/p/B_CJrbWnqOUvZHVaxFcOXHOij4OVS74zmbe0500/?igshid=1pwodpmqyiljs",1250689680691118080,weewu,
2020-04-16 06:22:00+00:00,Nobody Around Except ME! DAMM U CCP/Covid 19 virus……… ,1250670761540415500,TanKokHua3,
2020-04-16 06:14:13+00:00,"Should babies wear face masks? Masks should not be put for Kids under age of 2 .... says @CDCgov , #StayHome #StaySafeStayHealthy #COVID19 #prudent #CircuitBreaker",1250668802477445121,dr_ashok0124,
2020-04-16 05:40:33+00:00,Best Defense Is A Good Offense – CoVid19 | Epicurious Caniggia https://epicuriouscan.wordpress.com/2020/04/16/best-defense-is-a-good-offense-covid19-epicurious-caniggia/,1250660331065614343,3rdeye_blind,
2020-04-16 05:34:21+00:00,Still loving your racquet @LuRendy 🙏🏼🎾 #covidlife condo style. Kids watching a movie in their room(s) and I’m bored AF &amp; generally restless at the best of times 😳🤬 #washyourhands #Covid_19 #stayhome #stayindoors #stayinside #tennis #lovetennis #lovesport #circuitbreakersg,1250658768783736833,jasondlp,
2020-04-16 05:21:13+00:00,#investigatetheWHO #investigateTedros follow the money #COVID19,1250655466318753792,KassimARah,
2020-04-16 05:15:43+00:00,"Oh it’s covid 19 lock down period, we still can get it delivered, but not eat on site",1250654080482963457,simplysfdc,
2020-04-16 05:04:39+00:00,Felt devastated hearing wwe released stars due to covid19.. Its an honor to have the opportunity to watch my idols live.. May the future brings success in both of you.. @KarlAndersonWWE @LukeGallowsWWE #TheOC,1250651296425631744,pipiikrab,
2020-04-16 04:57:42+00:00,"Could be that he caught the virus? When he reported that he's not afraid of the virus and he'll bring them down to zero, COVID19 got pissed off and visited him to proof he's wrong?🤔🤔🤔",1250649545383403525,hasnfouz1,
2020-04-16 04:43:58+00:00,#circuitbreakingorange day 10 - pleasantly surprised by Amazon Prime's packaging. #morethanabox #covid_19 #stayathome #stayhome #singapore #circuitbreakersg @At Home https://www.instagram.com/p/B_B12zSFeHB/?igshid=biw7zxxckeyy,1250646092087209986,hongruilee,
2020-04-16 04:25:33+00:00,水果salad~ 谁要买啊 Lelong Lelong ah ~ 我的刀工不错的~ #covid19 #SGunited #stayathome2020 #eugenenitic @Singapore https://www.instagram.com/p/B_BzwChHTjk/?igshid=w40gtl7z4g6x,1250641456164933638,eugenenitic,
2020-04-16 04:19:48+00:00,A toast to everyone of you seeing this! May we all be protected from COVID 19! Just a little energy booster and health tonic of mine to keep the body strong! Happy working from home everyone! #glennongsg #GOFDWFH… https://www.instagram.com/p/B_ByJ05gGiF/?igshid=myeht21anpnw,1250640008601645057,GlennEgoman,
2020-04-16 04:15:24+00:00,"Baked Salmon, Seafood Aglio Olio, and Ondeh Ondeh Cake. Yummy lunch delivery for today's lunch 😄 #covid19 #wfm #circuitbreaker #stayhome #SGUnited #pinkypiggustayhome #supportlocal #suppportlocalsg #savefnbsg @… https://www.instagram.com/p/B_BylaRJaWR/?igshid=zbmrdwu21i75",1250638901829668864,pinkypiggu,
2020-04-16 04:08:26+00:00,Kampong Glam @8:00pm. #covid19 #sgunited #29sultangate #deliveryfood #halalsg #halalfoodie #halalcafesg @Sultan Gate Restaurant https://www.instagram.com/p/B_BxycJhpaW/?igshid=vpt4rw52zth7,1250637148363141121,dcwinessg,
2020-04-16 04:01:16+00:00,"Don't wanna be racist pero may pagka-""Parasite"" rin 'to eh.. 404 out of 447 cases eh galing sa iisang lugar lang? These people, why? How?🤦🏻‍♀️ 😩kahit nung wala pang covid19, can't really stand beside them in at least 5secs sa public places lalo kapag sa mrt ✌🏽😞❤️ ",1250635344925474816,JustCherry23,
2020-04-16 03:53:09+00:00,"Ketegasan hukum seperti ini yang diperlukan agar Indonesia 🇮🇩 bisa menyetop penyebaran #COVID19 pak @jokowi , kang @ridwankamil , mas @aniesbaswedan , pak @ganjarpranowo , bu @KhofifahIP Di Singapura 🇸🇬 ODP disuruh isolasi di rumah, melanggar keluar pergi makan dihukum penjara.",1250633302190383104,ainunnajib,
2020-04-16 03:51:02+00:00,Dirumah aja dulu 👌 #dirumahaja #samasamadirumah #wfh #lawancorona #covid19 @Perum Taman Raya Batam Centre https://www.instagram.com/p/B_BvLXJHof9/?igshid=1wiay6w0mzb85,1250632768649859078,RahmanYasir,
2020-04-16 02:11:51+00:00,"Exploring my archives | space for distancing | #stayathome #covi̇d19 #Singapore #sgmemory @Sembawang, Singapore https://www.instagram.com/p/B_BkclPHL66/?igshid=1ahlxij5f4r8y",1250607808904601603,JeromeKG,
2020-04-16 02:11:47+00:00,"Hypertension, the renin–angiotensin system, and the risk of lower respiratory tract infections and lung injury: implications for COVID-19: European Society of Hypertension COVID-19 Task Force Review of Evidence ",1250607791862976512,kikokicks,
2020-04-16 02:01:16+00:00,"Don’t spread #Covid_19, spread this #healthhack instead. Who knows? This could even help hospitals in need of masks. #circuitbreakersg #StayHomeSaveLives Credit to video owner. (No idea who as it was circulated on Whatsapp) #HealthcareHeroes",1250605145869582337,paepaesays,
2020-04-16 01:46:37+00:00,Been keeping myself busy.. What about you? #circuitbreaker #stayhomestaysafe #iamstayinghome #covi̇d19 #behuman @Singapore https://www.instagram.com/p/B_Bhj5eH9nC/?igshid=1lyap04v1uuwa,1250601459399434241,thearlynist,
2020-04-16 00:37:34+00:00,"Greetings to all my friends, partners, colleagues and associates of the events and entertainment industry. As a media/stage host, let’s stand tall and be proud to be part of #sgeventsunited #covi̇d19 #coronavirus… https://www.instagram.com/p/B_BZqE8ns14/?igshid=f3au63sncwsw",1250584080099524608,bernardlim108,
2020-04-16 00:23:42+00:00,"So moved by Dick Lee’s 900-strong virtual choir. “Home” has become a pseudo national anthem for us lately. Very apt - Singaporeans from across 26 countries, sending their love, singing to those staying “home” during covid. https://youtu.be/-psK61cafiE via @YouTube #COVID19 #StayHome",1250580593517051904,waimae23,
2020-04-15 23:12:22+00:00,Ngikutin zaman #tiktokindonesia #BrushChallenge #MakeupBrushChallenge #makeupchallenge #TikTokviral #tiktokchallenge #TikTokGirls #tiktok #dirumahaja #AmbyarwithTayNew #COVID19 ,1250562639509327877,Riaroza702,
2020-04-15 22:06:10+00:00,"COVID-19: Singapore confirms record 447 more cases and 4 new clusters, total at 3,699 https://sg.news.yahoo.com/covid-19-singapore-confirms-record-447-new-cases-total-at-3699-144012793.html?soc_src=community&amp;soc_trk=tw via @yahoosg",1250545980878893056,lili_eyebags,
2020-04-15 20:52:40+00:00,"lol @those people who dont workout BEFORE this covid-19 even started, like wtf please just stay the fuck at home for christ sake 🙄",1250527484212154368,MaeC_28,
2020-04-15 19:49:35+00:00,My heart goes out to all the foreign workers being affected by this Covid-19 in Singapore💔 They really worked so hard in building our nation. Hoping they’ll all get well soon.,1250511610038284288,SyedHarun_,
2020-04-15 19:31:13+00:00,"A Big Shoutout to ""Developer space Google Singapore"" for Organising this informative session of ""La- Kopi"". Thoroughly enjoyed the session and learnt a variety of tech stack based solutions to fight COVID-19. @GoogleCloud_SG @gdg @DevSpaceSG #Covid_19 #kopifromhome #Google",1250506986564866051,Olive_Devang25,
2020-04-15 19:19:11+00:00,#batam #COVID19 #lockdown #StayHomeStaySafe #Photoshoot #modelindonesia,1250503958704971778,Kevinbrian931,
2020-04-15 19:14:22+00:00,"🚀 Today i work on #stayathome design project (Free Download) 😍 80 vector icons, 100 Covid-19 related designs &amp; templates 🥳 https://producthunt.com/posts/covid-19-design-pack-by-artify 😷 Covid-19 Design Pack by @ArtifyCrew, Made by @JuanPabloSarmi ✅ Design Friendly, Export in .png .svg #covid19design",1250502744793690112,fajarsiddiqFS,
2020-04-15 18:18:49+00:00,Activiti time #pkp kita basuh satu2.. nnt esok takda keje pulak.. jadi hamba keta plak kene lap2.. org pkp dia pon pkp.. parah.. #stayathometv3 #franzcarrental #covid19 #takbolehkesanakesini @Iskandar Puteri https://www.instagram.com/p/B_AuUBdha8h/?igshid=jtzhjncdioka,1250488764901834753,faliqfarhan,
2020-04-15 17:47:02+00:00,"If you think that food delivery riders are making a lot of money during the CB period, think again. We suffer the effects of the weather, long queues and exposure to #COVID19 just so you get fed, on top of getting incentives slashed, smaller trip fees and sharing a shrinking pie.",1250480769228660736,zec_chilovek,
2020-04-15 17:44:58+00:00,"#McKinsey wanted to know how consumer sentiment, economic expectations and the use of new services have changed due to #COVID19. “#RemoteWorking at scale is unprecedented and will leave a lasting impression for years to come"" - https://www.mckinsey.com/business-functions/marketing-and-sales/our-insights/global-surveys-of-consumer-sentiment-during-the-coronavirus-crisis. 👩🏾‍💻 #WFH #AI #IoT #AIoT #H2M",1250480248015249410,uibglobal,
2020-04-15 16:59:30+00:00,#covid19 now we feel the pain.. #deep,1250468804758396928,Qbie_13,
2020-04-15 16:17:45+00:00,ตัวเลข #COVID19 ของสิงคโปร์ที่สูงมากๆ ในวีคนี้ส่วนใหญ่มาจากหอพักคนงานต่างชาติ ซึ่งมีคนพักอยู่เกือบ 20k (ตัวเลขนี้แค่ 2 หอพักในช่วงแรกที่เจอ) แต่ตอนนี้มีหออื่นๆอีก เราไม่แน่ใจเรื่องตัวเลขว่ากี่คน แต่หลักหลายหมื่นแหละ ตัวเลขเลยก้าวกระโดด เพราะก่อนหน้านี้ห้องนึงเค้าพักรวมกันหลายคน,1250458298752454661,Miss_kaew,
2020-04-15 15:57:14+00:00,"During #covid19 #developers sold a total of 660 units of #privatenewlaunch #homes for the month of #mar2020 MAR 2020* Mr Ismail Gafoor mentioned that, “Even though in the absence of major new project launches,… https://www.instagram.com/p/B_AeHAfH2iy/?igshid=136bdwxdnw2sk",1250453135820275712,RealEstatebyNas,
2020-04-15 15:00:29+00:00,"Circuit Breaker, 15th April 2020, Day 9, Rush Hour, but its WFH tomorrow... #Singapore #PeoplesCreatives #PassionPassport #Empty #Landscape #Covid19 #ExploreToCreate #CircuitBreaker #StreetMagazine #IG_Masterpiece… https://www.instagram.com/p/B_AXnNEHCBU/?igshid=15k6q5xe68lxp",1250438852096831491,Wyn_photos,
2020-04-15 14:54:56+00:00,४ महिने हो रहे है COVID-19 बिमारी को आये हुये. दुनिया के किसी भी कोने से ये खबर नही सूनी की डॉक्टर्स को मारा जा रहा हो. सरकार को इतना सख्त किजिये के किसी की हिम्मत भी ना हो ये सब करने की. @narendramodi @PMOIndia @AmitShah @myogiadityanath @CMOfficeUP – at Singapore Pools @Pioneer Mall,1250437457633357826,KAPILBHATE,
