Datetime,Text,TweetID,username,geo
2020-04-13 01:59:00+00:00,Enjoy your office while it last... Work from home has been the norm this past few months and may be so till way after the coronavirus pandemic is over. Things will change and it will need really cool office space… https://www.instagram.com/p/B-50l7hHpXz/?igshid=1mhd0ajlflu83,1249517412178853888,archt_pilande,
2020-04-13 01:58:55+00:00,"@tanjooilong Coronavirus: All commuters have to wear masks on public transport, even after circuit breaker period, says Khaw Boon Wan ",1249517389688930304,_rodahidup,
2020-04-13 01:18:00+00:00,NOW: @DanielYergin says the #OPEC deal has averted a crisis and given producers more time to navigate the #coronavirus uncertainties to come. #oott @CNBCi,1249507092626427906,dan_murphy,
2020-04-13 01:17:39+00:00,"Coronavirus: 233 new infections in Singapore, seven new clusters including Black Tap at MBS. Which makes the total count to 2532. With zero imported case and 5 workers from McD also included in the list. #COVID19Update #Singapore",1249507007503036417,AquibIkubal,
2020-04-13 00:31:53+00:00,"Selamat pagi. Luar Negara: Antara hikmah corona virus, binatang-binatang bebas bergerak ke mana sahaja tanpa rasa terancam. Manusia-manusia duduk di rumah diam-diam jika tanpa urusan, biar binatang-binatang bebas di… https://www.instagram.com/p/B-5qJXwnhXh/?igshid=da9h2ckkqtvp",1249495486530289670,edtvmalaysia,
2020-04-12 22:18:08+00:00,"NOW: #WTI and #Brent turn negative. Despite the big cut, the market isn’t convinced it’s large enough to combat the #coronavirus demand destruction and avoid overflowing storage. #oott #oil",1249461828196790273,dan_murphy,
2020-04-12 16:28:02+00:00,"Going back to the office to mop the floor, make sure nobody’s stolen our gear and grab my guitars home tomorrow... please stay away from me coronavirus",1249373724744110081,basilyeo,
2020-04-12 16:01:00+00:00,the movie contagion shows alot about the virus and its pandemic. Its almost predicted the coronavirus,1249366918554779653,idkzave,
2020-04-12 15:42:44+00:00,How many cases divided by how many deaths. Basically in the UK out of every 8 people admitted to hospital with coronavirus 1 dies.,1249362321312370690,Marvo5Marvo,
2020-04-12 15:28:42+00:00,"Meanwhile back to reality. We now have the 6th most cases of Coronavirus in the world, the 5th highest death toll in the world and at 7.9 deaths per case, we're just waiting on the results from Italy to see if we've managed to topple them off top spot.",1249358793059663873,Marvo5Marvo,
2020-04-12 13:02:13+00:00,Americans are waking up to the limitations of their analogue #health #care system. It seems clear that we need an immediate digital revolution to face this crisis. #DigitalHealth #healthcaresystems #COVID19 #coronavirus ,1249321926054400000,GabrielSim,
2020-04-12 12:16:32+00:00,"But of course. In these times of the #coronavirus and lockdowns, what else is there to do? 🤨 ",1249310431144849408,VandanaHari_SG,
2020-04-12 11:44:28+00:00,"My neighborhood @McDonalds in #Singapore, checking the temperature of every single person with a thermometer gun before letting them in. 👍 #mcdonalds #covid19 #coronavirus #singapore #sglife #Covid_19 – at Siglap Centre",1249302361899593728,cheryltan88,
2020-04-12 10:48:43+00:00,Dell’s ‘Creative’ New Financial Offers Help Partners Fight Coronavirus Fallout ,1249288330727976960,roshanpkj,
2020-04-12 10:26:51+00:00,Ten of about 100 #Covid19 #vaccines under development “are very promising”. But an effective vaccine is not likely until somewhere around September 2021. #coronavirus #globalhealth #publichealth,1249282826999967745,GabrielSim,
2020-04-12 09:45:52+00:00,#Singappenney 🙏🙏🙏🙏 #Kanyakumari #RealHeroes #COVID19 #coronavirus ,1249272512602443777,stebinpari16,
2020-04-12 09:43:16+00:00,Thank you to the courageous frontliners! #healthcare #HealthCareWorkers #HealthcareHeroes #COVID19 #coronavirus ,1249271859238940674,GabrielSim,
2020-04-12 08:37:36+00:00,@JennerInstitute good luck with your coronavirus vaccine trial. The world needs some hope at the moment. I hope you can provide it.,1249255332758425600,DanielSadhu,
2020-04-12 07:49:38+00:00,"Safety doesn't happen by accident... It has to be prepared... Be Safe, Stay Safe & Keep Safe everyone... . . . #another2weeks #movementrestrictionorder #movementcontrolorder #MRO #mco #coronavirus #covid19 #covid_19… https://www.instagram.com/p/B-337HuHnS_/?igshid=hkmk2t06aalw",1249243262419943425,SyaSyazlee,
2020-04-12 07:40:49+00:00,"#speakcryptic in the times of the coronavirus, these artworks are on the construction walls of the extension near esplanade. @Singapore https://www.instagram.com/p/B-326m3nzts/?igshid=183mqhru7hc5b",1249241044887183360,reviveramesh,
2020-04-12 05:11:08+00:00,It is time to rethink and rewire Capitalism and transform it into a more equitable form – based on democracy and social justice. The Consumer in the Age of Coronavirus https://sarasotainstitute.global/the-consumer-in-the-age-of-coronavirus/ via @@sarasotainst,1249203373850742785,GowthamanR,
2020-04-12 01:56:45+00:00,Ma’am understand the point you are trying to make. But calling it the Chinese Virus instead of Corona Virus does not behoove a journalist of your standing.,1249154455779659777,_kartikgupta,
2020-04-12 00:52:01+00:00,Coronavirus: Two-thirds of severe Covid-19 cases improved on Gilead drug ,1249138165975330817,_rodahidup,
2020-04-12 00:50:04+00:00,We need the truth. #Coronavirustruth #COVID19 #coronavirus ,1249137676252581888,yangjiofeng,
2020-04-11 23:54:43+00:00,"The entire United States is now under a major disaster declaration for #COVID19 - as the total case count climbs to 501,536 including 19,552 fatalities. #Coronavirus",1249123748025962498,dan_murphy,
2020-04-11 23:30:05+00:00,Other folks: I run a successful business that is able to make profits during this coronavirus pandemic. Me: ,1249117548538445824,theartofmezame,
2020-04-11 20:47:11+00:00,Coronavirus: Out for a run? Avoid slipstream of those ahead ,1249076553062813696,_rodahidup,
2020-04-11 12:49:21+00:00,"@Oakland is flexing its adaptive capacity and helping communities weather the #coronavirus #pandemic with #OpenStreets, #testing for all &amp; relief for vulnerable #localbusiness @AlexHMcBride #ChiefResilienceOfficer @CitiesOnTheFrontLine @GlobalResCities",1248956301100511233,LaurenSorkin18,
2020-04-11 11:59:00+00:00,Married people are using this current situation to display their husband-wife wfh jokes’ skills! . . . #COVIDー19 #coronavirus #COVID__19 #coronapocalypse #pandemic,1248943630078763009,anushreetj,
2020-04-11 11:43:53+00:00,"Let foodpandasg deliver your groceries to your door step during this period for circuit breaking measures #foodpanda #coronavirus @Redhill, Singapore https://www.instagram.com/p/B-1t8FFgI28/?igshid=h5uzdj15txyg",1248939827602632705,justintanwc,
2020-04-11 08:26:02+00:00,Germany to run Europe’s first large-scale #antibody testing in an effort to help researchers assess infection rates and monitor the spread of the #coronavirus more effectively. #covid19 #diagnostic #MedTech,1248890035870416897,GabrielSim,
2020-04-11 07:40:38+00:00,How the world could change after the coronavirus pandemic (Fareed Zakaria | TED Connects) https://www.ted.com/talks/fareed_zakaria_how_the_world_could_change_after_the_coronavirus_pandemic?utm_source=twitter.com&amp;utm_medium=social&amp;utm_campaign=tedspread via @TEDTalks,1248878609470599168,harivk,
2020-04-11 07:06:46+00:00,Missing you Europe! See you again soon. #lockdown #covid19 #COVIDー19 #coronavirus #StayAtHome #StayHome,1248870086988845058,izreloaded,
2020-04-11 07:06:27+00:00,Everything you need to be the best CCB - Community #CircuitBreaker #covid19 #coronavirus ,1248870010249859072,ordbloke,
2020-04-11 05:54:46+00:00,.@TCS supports research on AI strategies to curb coronavirus ,1248851968832888832,SDAPAC,
2020-04-11 05:03:24+00:00,Day #5 Circuit breaker lunch #londonfatducksg #londonfatduck #wagyuofducks #hojiak #aroi #parents #family #familylunch #sogoodmustpost #stayhome #staysafe #covid19 #coronavirus #wfh #circuitbreaker @Singapore https://www.instagram.com/p/B-1AGzJnvgE/?igshid=x4zhgz0ua7ov,1248839042399178752,bernardlim108,
2020-04-11 04:31:17+00:00,Automated contact tracing is not a coronavirus panacea by @jasonbay,1248830959962574849,luminosita81,
2020-04-11 04:26:35+00:00,Everything you need to be the best CCB - Community #CircuitBreaker #covid19 #coronavirus https://iamaccb.sg/,1248829775679897600,paulaverilla,
2020-04-11 04:00:08+00:00,"Blessed Easter weekend everyone! Stay home, cook or order in, eat hot cross buns and chocolate eggs ❤️🐣🐰🥚 #StayHome #EasterWeekend #Covid19 #Coronavirus ",1248823119382376448,jaschintaz,
2020-04-11 03:46:33+00:00,Useful thread #coronavirus ,1248819703184670721,nareshraj5,
2020-04-11 03:40:29+00:00,'Respiratory outbreak' being investigated at retirement community after 54 residents fall ill - ABC News via @ABC - https://abcn.ws/2XKIA1i #coronavirus #COVID19 #greenspring #Coronavirustruth #TrumpVirusCoverup,1248818175384227840,yangjiofeng,
2020-04-11 03:34:02+00:00,Keeping faith during an Easter that is testing our faith like no other Via @Forbes https://www.forbes.com/sites/margiewarrell/2020/04/10/keeping-faith-and-finding-good-on-this-hardest-of-good-fridays/#7545ab855d3f #COVID__19 #coronavirus #EasterWeekend #GoodFriday #COVID19,1248816550204731392,margiewarrell,
2020-04-11 02:27:49+00:00,"Coronavirus: 198 new cases of infection, seventh death reported; 2,108 cases now. #COVID19Update #Singapore",1248799886390124546,AquibIkubal,
2020-04-11 01:31:16+00:00,Boss.. hunger is killing and no job is depressing... And understand the physiology.. no one has seen the Corona virus #CoronaVirusUpdate #IndiaVsCorona #IndiaLockdown,1248785656194707458,write2him,
2020-04-10 23:54:52+00:00,January Jakarta Flooding February WW3 possibility March Coronavirus April Anak Krakatau erupted 2020 ,1248761397212672006,putraaaws,
2020-04-10 22:24:31+00:00,"Another weekend without sport. Here’s an idea: for leagues wth just a few rounds left, play the remaining draw as the start of next season and award points for both that and the 2019/20 season. So @LFC could be #epl champions twice in the same year. #coronavirus",1248738660603662336,Gambariste,
2020-04-10 17:49:43+00:00,Dont judge by cover #lifestyle #batam #Boyfriend #modelindonesia #coronavirus ,1248669505326219264,Kevinbrian931,
2020-04-10 17:06:25+00:00,mendak sial corona virus.Tkle keluar semua cb,1248658605894590465,Fuckitznas,
2020-04-10 15:42:26+00:00,Found this while reading a book right now and it couldn’t be truer/ more true! . . . #books #bookworm #friday #friyay #GoodFriday #GoodFriday2020 #COVIDー19 #COVID19 #coronavirus #StayHome #StayAtHomeChallenge #Reading,1248637471971094528,anushreetj,
2020-04-10 13:50:24+00:00,Yaa Allah forgive us. Yaa Allah save us from coronavirus 🙏🙏. – at Tuas South Recreation Centre,1248609277897400323,ibrhim_titu,
2020-04-10 12:51:21+00:00,Everything you need to be the best CCB - Community #CircuitBreaker #covid19 #coronavirus ,1248594416605859840,ClaytonMillers,
2020-04-10 11:48:13+00:00,"Practice Safe Distancing on Public Transport by Land Transport Authority, Circuit Breaker measure by the government against Coronavirus. Once in a lifetime experience, seeing last people on public transport and in… https://www.instagram.com/p/B-zJo5-naAI/?igshid=11g1kgrrf6hbc",1248578529891155968,Muhd_Shariff,
2020-04-10 10:55:38+00:00,#FlattenTheCurve #CrushTheCurve #covid19 #coronavirus ,1248565294202675200,leejanhau,
2020-04-10 08:50:04+00:00,"Coronavirus: Malaysians working in Singapore should remain there, says KL health chief https://str.sg/JgUY no thanks, they should go home as foreign workers here are costing us with huge medical bills to look after being infected. Thought package helps local but includes all!",1248533698078584832,poortan,
2020-04-10 08:45:13+00:00,Coronavirus: PM Lee warns that circuit breaker measures will be strictly enforced; still too many gatherings taking place https://str.sg/JgGD check migrant workers including maids as no circuit breaker actions taken until the infections grew so high,1248532474210050049,poortan,
2020-04-10 08:37:33+00:00,Currently a CCB ambassador Everything you need to be the best CCB - Community #CircuitBreaker #covid19 #coronavirus https://iamaccb.sg/,1248530547963379713,an1esa,
2020-04-10 08:00:13+00:00,Coronavirus tracked: the latest figures as the pandemic spreads | Free to read https://www.ft.com/content/a26fbf7e-48f8-11ea-aeb3-955839e06441?campaign=march20&amp;segmentID=a0cb7514-b923-9fa0-fc31-40cea8a92101 via @financialtimes,1248521151636103169,ninakhong,
2020-04-10 07:17:25+00:00,"Among so much else, the coronavirus pandemic seems likely to delay the USMCA from coming into force. Mexico joins Canada, notifies U.S. it's ready to implement new NAFTA | CBC News ",1248510379707084800,CIL_investment,
2020-04-10 06:19:52+00:00,There’s a slight change to the repertoire with the addition 2 special Piano performance of the National Anthem of England & France as special dedication to our British and French families who have lost their relatives during this Coronavirus. See u live on Facebook #Homeconcert,1248495895206744064,Vmc123456,
2020-04-10 05:46:59+00:00,"sorry banget aku gabisa pilih hadiah lain selain pulsa.. posisiku di sg, kalo aku GA barang, aku gatau kapan bisa ngumumin dan kirim barangnya due to corona virus 😭🙏",1248487621866610689,leeeunsangnoona,
2020-04-10 05:43:04+00:00,Hong Kong's edge over Singapore in fighting the coronavirus shows that early social distancing works https://www.bloomberg.com/news/articles/2020-04-10/hong-kong-edge-over-singapore-shows-early-social-distance-works?sref=1PMaiQH4 via @business,1248486635546632192,Joyce__Koh,
2020-04-10 05:41:28+00:00,“Which of these people cared about migrant workers before coronavirus” is a really cold take and only reveals your ignorance. Better that people are letting this moment open their eyes instead of staying wilfully ignorant like you boomer k bye,1248486233392558081,pauriahcarey,
2020-04-10 05:20:01+00:00,The #Covid19 outbreak has prompted a surge in demand for #telehealth in #Indonesia. #HealthTech #DigitalHealth #mobilehealth #coronavirus https://nyti.ms/2JQIhZe,1248480835407212545,GabrielSim,
2020-04-10 05:09:42+00:00,Singapore suspended the use of video-conferencing tool Zoom by teachers on Friday after “very serious incidents” occurred in the first week of a coronavirus lockdown that has seen schools move to home-based learning ,1248478237560209409,geddiejdk,
2020-04-10 04:25:34+00:00,LOCKDOWN #coronavirus cukup dirumah aja ya!!!,1248467132943220736,dicky_perkasa17,
2020-04-10 04:23:20+00:00,Who else woke up today and attended a work call!? 🙋🏻‍♀️ . . . #GoodFriday #Singapore #WFH #WorkFromHome #remotework #longweekend #SGUnited #COVIDー19 #coronavirus #GoCoronaGo,1248466571409813505,anushreetj,
2020-04-10 04:08:24+00:00,Fauci: I don't think we should shake hands 'ever again' #covid19 #coronavirus ,1248462810784206848,GabrielSim,
2020-04-10 03:48:41+00:00,"Japan Will Pay Its Firms to Leave China, Relocate Production as Part of Coronavirus Stimulus Package ",1248457852340953094,vnktsubramanian,
2020-04-10 03:10:58+00:00,"How is EDC helping in SEA ""We’re trying to help Canadian exporters stay in touch with potential buyers by encouraging and organizing conference calls and video calls, and providing information about the situation on the ground."" #COVID19 #coronavirus ",1248448358554845184,KlausHouben,
2020-04-10 00:35:13+00:00,Whoa this @nytimes chart really puts Singapore’s recent #coronavirus spike in perspective. Stay safe people. https://www.nytimes.com/interactive/2020/04/09/world/asia/coronavirus-hong-kong-singapore-taiwan.html,1248409164654637056,taneliang,
2020-04-09 18:07:39+00:00,"The end of my one day Doc Mario trilogy, and, as a matter of fact, my very first meme video #coronavirus #StayHome",1248311629759967232,fizoto,
2020-04-09 15:36:40+00:00,"kingsmenbarberhaus 💯; Bila dah tak boleh RUNSGD, standby entah gelombang keberapa dah ni. Hmm #coronavirus #malaysia #runsgd #standby @CIQ Check Point Johor Bharu https://www.instagram.com/p/B-w-VZNnKBW/?igshid=63f9iohxqij4",1248273630846427136,SICKSDRSMY,
2020-04-09 12:24:04+00:00,"Staying ahead of the #coronavirus (#COVID19) continues to be challenging for #governments, #businesses and #healthcare systems across the globe. Are you prepared to keep your employees and citizens safe? https://youtu.be/TI_fbchXjnY @Khairykj @leehsienloong @kemkominfo @KKMPutrajaya",1248225164598210560,danielcfng,
2020-04-09 11:14:33+00:00,"Had to do my laundry by hand for the first time many years, cos all commercial laundromats have been shut down due to the corona virus. Looks like our lives will be altered in many ways...",1248207666951774209,bemnyax,
2020-04-09 10:53:03+00:00,Hahaha coronavirus lah,1248202256375115780,cockporn,
2020-04-09 10:16:44+00:00,#WATCH: Former Treasurer and U.S Ambassador @JoeHockey on how #coronavirus is changing the world and global politics as we know it. @CNBCi #auspol,1248193117913661440,dan_murphy,
2020-04-09 06:37:21+00:00,#WATCH: Singapore’s Trade and Investment Minister explains how the import-dependent nation is ensuring #foodsecurity during the #coronavirus crisis. ,1248137910861189120,dan_murphy,
2020-04-09 06:01:40+00:00,Ce coronavirus nous aura bien détruit nos plans,1248128930407571456,E11B09,
2020-04-08 18:59:07+00:00,.@CMOTamilNadu I have done my bit. Though it's very small. Others plz do donate whatever you can. #coronavirus #COVID19 #COVIDー19 #TN_Together_AgainstCorona #TNHealth #TNGovt #TNCoronaUpdate #TN_Together_Against_Corona #TamilNadu #CMReliefFund #tamilnadugovt #TNCMReliefFund,1247962193523429378,iSureshTweet,
2020-04-08 17:34:04+00:00,Coronavirus Prayer Wave - Nader Mansour https://youtu.be/9JrCISG_-uY via @YouTube,1247940790371758080,ninakhong,
2020-04-08 13:41:14+00:00,"Singapore confirms 142 new coronavirus cases in biggest daily jump, 40 linked to foreign worker dormitories",1247882195810676737,NancyCNBC,
2020-04-08 13:28:57+00:00,"Working from home is can be a challenge or be taken as a chance to be creative... The echo from my ""WHY IS WORKING FROM HOME HARD"" video was because of this. It was recorded here. #coronavirus #covid19 #somatics… https://www.instagram.com/p/B-uLk6cno6G/?igshid=55oyqo71pjxu",1247879103203729409,DanspireVy,
2020-04-08 12:44:32+00:00,Went on to yolo_livesg for a interview before the start if this CCB. Glad to be able to share some of my views on the CCB! #CCB #coronavirus #Singapore #SG #freelancer #GoCoronaGo #4d #SingaporePools #Prayer @… https://www.instagram.com/p/B-uGfg4nSZB/?igshid=8080o7evohl8,1247867925488418816,leonlimyz,
2020-04-08 12:33:00+00:00,Neighbour। #covid19 Signs of the time of Coronavirus @Singapore Botanic Gardens https://www.instagram.com/p/B-uFLEFHGps/?igshid=1q4mq0h31bu79,1247865023877218305,reviveramesh,
2020-04-08 11:50:36+00:00,"Repost from @cristiano &amp; @who • Hi guys, just a little message and reminder of the steps we must all follow to protect ourselves and our loved ones. Please stay safe. #StayHome • Thank you to both CR7 and WHO for spreading the word on how to stop #coronavirus! • #SGUnited",1247854353991389184,NUSadmissions,
2020-04-08 09:46:58+00:00,#syedih #RabuTaubat #stayatpospolisioffice #COVID19 #coronavirus,1247823239016939523,27Manek,
2020-04-08 08:50:22+00:00,Anderson Cooper rips Trump for hijacking coronavirus briefing https://youtu.be/bbv_AitShqI via @YouTube @realDonaldTrump,1247808996146380800,DannyDuijs,
2020-04-08 06:28:55+00:00,Hahahaah tbh masa corona virus kluar pun org dah teringat pasal corona discharge ni hahahaha,1247773400392593408,ctajamohdtaha,
2020-04-08 04:18:08+00:00,The coffeeshop remain opened for business but open for takeaways #circuitbreaker #covid19 #coronavirus @Lengkok Bahru https://www.instagram.com/p/B-tMimIHEL9/?igshid=6yg1r99swoku,1247740484480577536,justintanwc,
2020-04-08 02:59:51+00:00,Kenapa ya CFRnya tinggi banget 🤔 Berarti yg katanya “kemungkinan sembuh dari coronavirus itu 97%” sudah nggak berlaku lagi dong?,1247720783998111744,kuaijishi17,
2020-04-08 00:50:43+00:00,3 months ago who would hate thought that US will become the epicentre of #coronavirus,1247688288355274752,amitmathur31,
2020-04-07 20:55:47+00:00,"musim corona virus ni duduklah diam diam dalam rumah . untuk yang diluar tu hati hati , untuk yang dalam hati jangan pergi .",1247629164561043456,Akmallroslii,
2020-04-07 18:00:30+00:00,The horror of coronavirus is all too real. Don't turn it into an imaginary war | Marina Hyde ,1247585052306714626,mitch_leow,
2020-04-07 17:42:56+00:00,Shorter version of why it is challenging to work from home. Why are we blaming the coronavirus instead of checking in with our bodies? Revealing why you find it hard... To listen to the longer version go to IGTV… https://www.instagram.com/p/B-sDyxCl_1X/?igshid=1kor513s4kugp,1247580633565728770,DanspireVy,
2020-04-07 17:19:08+00:00,Just watched an Infographics video on how someone contracted the coronavirus from giving CPR to a snake and I’m not having it ,1247574644552372226,thesiobak,
2020-04-07 14:28:09+00:00,"I'm gonna say this loudly. ""CCB~~~~~~!!!!"" Coronavirus Circuit Breaker",1247531615036641281,tutu22,
2020-04-07 14:27:27+00:00,"A reminder song from us😄 Hey YOU! Better stay at home All the things, gonna be okay Stay safe, always wash your hands Stay away, hey Corona Virus! Stay safe everyone! #music #musician… https://www.instagram.com/p/B-rs35_gPiyaDzbkhCRAhimlDwzNlUHr6F-nnI0/?igshid=1e8mm3sity0xm",1247531437890273286,siagusagus,
2020-04-07 12:21:17+00:00,https://www.channelnewsasia.com/news/singapore/covid-19-social-gatherings-of-any-size-in-both-private-and-12617800 #covid #coronavirus #StayAtHome #Singapore #LockdownNow,1247499686182670342,LarissaTan,
2020-04-07 12:09:21+00:00,"Diskusi keselamatan jurnalis bersama ajikotabatam . . . #pandemicorona #jurnalisbencana #coronavirus @Batam, Riau, Indonesia https://www.instagram.com/p/B-rdTPnHkWZ/?igshid=dyf89agmo862",1247496682985738240,Asliyogi,
2020-04-07 12:06:17+00:00,Will try tomorrow 😩 #Covid_19 #coronavirus #CIRCUITBREAKER #lockdown,1247495913452343297,debbiediscovers,
2020-04-07 11:59:29+00:00,@narendramodi @nsitharaman @dabi_tina Our heart goes out for the family of young doctors who die fighting COVID. I hope doctors and hospital staff are protected adequately. BBC News | Coronavirus: Cardiff surgeon Jitendra Rathod dies - ,1247494202016948226,Narasim20561265,
2020-04-07 10:44:48+00:00,India's @jswsteel fell just short of its 2019-20 production target because of the coronavirus outbreak but plans to restart all its ops when India's lockdown is scheduled to end on 15 April: https://okt.to/C7gmXE | #ArgusSteel #steel Coronavirus hub: https://okt.to/NTM9b6,1247475404753047553,argus_metals,
2020-04-07 10:06:03+00:00,Indian leaders hesitate to end world's biggest coronavirus lockdown ,1247465654522744833,Ullmkavarkalvan,
2020-04-07 08:11:03+00:00,AIIB Plans $5 Billion Coronavirus Recovery Facility ,1247436713934241792,analystabhishek,
2020-04-07 07:16:00+00:00,"Chicken hor fun at home today. Need to balance and toggle among health (instant noodles), home cooked and dabao. #wfh #stayhome #stayhomesg #workfromhome #Telecommuting #telecommute #covid_19 #covid19 #coronavirus… https://www.instagram.com/p/B-q7zFundHL/?igshid=iej9pb2i45v0",1247422861222064128,onefern,
2020-04-07 07:15:07+00:00,Day 1 - Circuit Breaker. Double Protection against this Corona Virus. Thanks to iskandarbashar for the Vogue Visor. @Singapore https://www.instagram.com/p/B-q8AAjJXte/?igshid=lv9ghph2owe0,1247422638986866689,Rafil_K,
2020-04-07 06:04:32+00:00,The coronavirus has cancelled so many things in 2020 but can it also cancel idiot politicians who talk this kind of shit.......... ,1247404873332580352,pauriahcarey,
2020-04-07 04:48:55+00:00,The reporter sounded disappointed with the news that the drugs are working well for those very illed coronavirus patients 😂😂😂,1247385847021711360,Firehorse77,
2020-04-07 04:12:59+00:00,Lock down possible or coronavirus Positive.... Poor Lodge management in karnji Lodge 1...@MOM_sg – at Bus Stop 46031 (Kranji Lodge 1),1247376802013564934,ksarath456,
2020-04-07 03:41:26+00:00,WATCH: We speak with @ASlavitt about the #COVID19 trajectory in the US and why cases are still growing: https://youtu.be/6Y1ps9MZGPQ @MartinSoong #coronavirus #usa,1247368862284251136,dan_murphy,
2020-04-06 22:10:16+00:00,Pretty shocking to hear British PM Boris Johnson is in intensive care with Corona virus. Hope he recovers soon.,1247285521392386051,Eric_J_Brooks,
2020-04-06 21:05:43+00:00,"Terrible. Encore plus quand il y a à peine 10 jours le mec déclarait tranquille que Coronavirus ou pas il allait continuer à serrer des mains comme si de rien n’était. Tu te demandes ce qui leur passe par la tête, pas grand chose malheureusement. ",1247269278732058624,sbdki,
2020-04-06 21:04:29+00:00,Opinion: The Next Coronavirus War ,1247268968181583872,JacquiAlexis,
2020-04-06 21:03:10+00:00,UK Prime Minister Boris Johnson in intensive care after coronavirus symptoms worsen - ,1247268636441501696,KimPiau,
2020-04-06 20:55:50+00:00,A team of coding experts built an AI-powered platform during a marathon 60-hour session to help this nonprofit supply medical equipment needs to fight coronavirus ,1247266790364688384,JacquiAlexis,
2020-04-06 19:26:36+00:00,Coronavirus: Boris Johnson moved to intensive care ,1247244335101489153,AuggieAnthuvan,
2020-04-06 16:56:51+00:00,"Our doctors and nurses at the treatment centers work 12-15hrs a day, 7 days a week, some of them haven't left the hospital for weeks, have elderly parents and kids waiting for them. #Coronavirus #COVID19",1247206647946076168,andrewhahalee,
