Datetime,Text,TweetID,username,geo
2020-04-06 16:44:26+00:00,"Latest news : Mexico has finally agreed to pay the the wall, in order to prevent American coronavirus to cross over their borders.",1247203525030842369,Cai65839481,
2020-04-06 14:43:01+00:00,Four Steps To Re-Think Customer Experience In The Coronavirus Crisis ,1247172968137908225,JacquiAlexis,
2020-04-06 13:29:26+00:00,"Attention all coronavirus things: do not get comfortable. Your welcome is officially worn out. In fact, I'm gonna see this guy Trump right now, and get you all off my land and back where you came from! . #dota2… https://www.instagram.com/p/B-pCCr4FXEg/?igshid=1bbkky5iv42vx",1247154449338060802,ashleyritawong,
2020-04-06 12:58:42+00:00,human : *wears pink mask* Covid19 : aight I’m outta here Corona Virus Cancelled ,1247146716228227072,BrandonxTan,
2020-04-06 11:27:21+00:00,Saluting the Heroes of the Coronavirus Pandumbic | The Daily Show https://youtu.be/NAh4uS4f78o via @YouTube,1247123728497930240,zhenghao1,
2020-04-06 09:14:01+00:00,"When there is no waterpolo competition because of the coronavirus, we create our own competition at home! #KFXMRW http://waterpolo30.com – at Singapore Botanic Gardens",1247090170597269505,waterpolo30,
2020-04-06 08:37:06+00:00,This person confirm will not get #covid_19 in the public! #coronavirus ,1247080880729776128,izreloaded,
2020-04-06 08:34:58+00:00,Throw a bottle full of corona virus on that thug,1247080343795953665,RajeshChakram,
2020-04-06 08:21:19+00:00,Meet the Medical Graduates On the Front Lines of Italy's Coronavirus Fight https://youtu.be/78TBmW0zC2w via @YouTube,1247076910938505216,ninakhong,
2020-04-06 07:01:00+00:00,And also in Singapore we have to shut down our labs... I feel like a captain leaving as last and closing the door behind me... see you again in one month ... stay safe #shutdown #coronavirus #ntu – at NTU School of Biological Sciences,1247056696691720192,chrisruedl,
2020-04-06 06:10:02+00:00,"Timeline w setelah mute keyword “covid-19”, “corona”, “virus” ",1247043871546073090,kuaijishi17,
2020-04-06 05:14:01+00:00,I think the fogging company is trying to kill viruses too this week... Might as well try while you're at it 😂 . . . . . #wfh #neverknew #djlife #coronavirus #ravenisleven #Singapore #staysafe #sgunited @Dempsey Hill https://www.instagram.com/p/B-oJWPuFcDH/?igshid=lgv21sd0nes9,1247029773848764417,DJ_IMX_OFFICIAL,
2020-04-06 04:19:52+00:00,PREPARE: Corona Virus and The Next Pandemic //Prophet Sadhu Sundar Selv... https://youtu.be/KTuM2KBKNUc via @YouTube,1247016148186443778,jeffkwt8879,
2020-04-06 02:59:42+00:00,"Poland bans the access to all urban green spaces beaches, #forests and national parks in fight with the #coronavirus. High fines are imposed for those breaching the law. Is there any other country or state with such controversial measures?#greenspaces #ugs #covid19 #forest",1246995972514664448,NeuroLandscape,
2020-04-05 17:43:10+00:00,Fuck Corona.. Corona Virus la kite takle staycay &amp; Corona tu la we can't go Out also 😭,1246855915958972421,_PutraMuhd,
2020-04-05 16:38:31+00:00,"#BattleAgainstCorona #9pm9minutes #COVID19 #StayHomeStaySafe We are with you to fight against Corona virus from Singapore. #JaiHind 🇮🇳 @TelanganaCMO @KTRTRS @narendramodi @MSaiKrishna92 @kottetivenkataprasad @raviteja @mdrafi – at Serangoon, Singapore",1246839646899687429,naveen_bulusu,
2020-04-05 16:36:20+00:00,"Record 120 new coronavirus cases in Singapore, 2 foreign worker dormitories gazetted as isolation areas. Over 20,000 people isolated in single cluster. Total cases 1309+ in Singapore. #coronavirus #covidsg",1246839096976130052,AquibIkubal,
2020-04-05 16:30:20+00:00,The plan for 2020 was to attempt exploring new festivals only and gardenbeatsfestival was definitely a good start! Despite the various artist cancellations and low turnout due to the coronavirus I’d have to give it… https://www.instagram.com/p/B-mvzkMpWbF/?igshid=1i93t168yiq1d,1246837587047833600,DonBran91,
2020-04-05 16:27:48+00:00,I was watching @NDTV Dhadkan- “Dad’s what’s going on?” I- “Everyone in India lighting diyas to pray God Corona virus goes away” Dhadkan “why aren’t we doing then?” I- “because we are in SG” ... “so what bhagwan toh dekh rae hai naa (God is watching right?)” my eyes wet “sure baby ,1246836950675283969,PracheerK,
2020-04-05 15:53:23+00:00,Our contribution from singapore! @narendramodi @IndiainSingapor #9pm9minute #coronavirus ,1246828287055163392,Bambaiyaa,
2020-04-05 15:52:31+00:00,So basically today was a dry run for #Diwali2020!? #21daysLockdownIndia #9PM9Min #9pm9minutes #India #GoCoronaCoronaGo #COVID2019 #coronavirus #Covid_19,1246828071195271168,anushreetj,
2020-04-05 15:37:50+00:00,I hope everyone will stay at home to fight corona virus away. 🙏🙏 #covidindia #coronavirus #LetsFightCorona,1246824376336433154,citizen2501,
2020-04-05 15:37:07+00:00,"Prakash-parv in Singapore for the global fight against Coronavirus. #fightcoronavirus💪 #positivevibes #weareunited #lightlampindia #narendramodi #covid19darkness #indianinsingapore #selfillumination @Woodleigh,… https://www.instagram.com/p/B-mro-iFbFS/?igshid=dpn4drkeel1s",1246824192848343042,atish_58,
2020-04-05 14:33:03+00:00,Before #coronavirus kills. Anyone #india will be killed by their hatred over religion and hatred #hinducorona and #muslimcorona talk is enough and will. Be fueled further by @BJP4India hate push. This is a sad reality,1246808070807646212,KassimARah,
2020-04-05 14:00:59+00:00,"Hey Donald trump, good news, Mexico is paying for the wall now. They don't want Americans coronavirus crossing their borders.",1246800002116009984,Cai65839481,
2020-04-05 13:55:45+00:00,👇 Good thread on why the billions Singapore has spent in coronavirus relief so far is not trickling down to the most needy ,1246798685125533696,geddiejdk,
2020-04-05 13:44:04+00:00,"Hey, Donald trump, Mexico is paying for the wall now. They don't want Americans coronavirus crossing their borders. ",1246795745774039045,Cai65839481,
2020-04-05 13:39:38+00:00,What are the clusters of novel coronavirus cases in Singapore? What are the links between patients? Explore CNA's interactive to find out https://infographics.channelnewsasia.com/covid-19/coronavirus-singapore-clusters.html 来自 @ChannelNewsAsia,1246794630839975937,ASHLEYAO10,
2020-04-05 13:35:05+00:00,"Hey, Good news! Mexico is paying for the wall now. They don't want Americans coronavirus crossing their borders.",1246793481994924034,Cai65839481,
2020-04-05 13:33:26+00:00,"Hey, Good news, Mexico is paying for the wall now. They don't want Americans coronavirus crossing their borders.",1246793069480951809,Cai65839481,
2020-04-05 13:32:27+00:00,Hey Mexico is paying for the wall now. They don't want Americans coronavirus crossing their borders.,1246792821815660545,Cai65839481,
2020-04-05 13:10:58+00:00,"Why do people want to hate Asians? When the first case of COVID-19 erupted, your governments can take actions such as prohibiting citizens from travelling abroad/ban foreigners from entering your countries to prevent coronavirus from spreading. Dah banyak kes baru menyesal 💁‍♂️💁‍♂️ ",1246787414149849088,cookiejimz,
2020-04-05 11:46:19+00:00,Will coronavirus signal the end of capitalism? @AJEnglish,1246766111850246144,rogerchuakt,
2020-04-05 11:27:30+00:00,Wait for food... #covid19 #coronavirus,1246761375398940672,anferneeck,
2020-04-05 11:24:41+00:00,Singapore reports 120 new coronavirus - new daily record and more than 50% higher than previous milestone. Just days before island-wide lockdown starts,1246760667647848448,geddiejdk,
2020-04-05 09:38:54+00:00,"I feel like I already added all people from ""People You May Know"" here on Facebook due to boredom. Next! 😂😂😂 #quarantinefeels #coronavirus #pandemic2020 #covid19 #ncov",1246734046345879554,iEmChiLL,
2020-04-05 08:00:11+00:00,"Wah like this ah, one month #CIRCUITBREAKER is not enough. #singapore #Covid_19 #coronavirus ",1246709203340677126,izreloaded,
2020-04-05 06:18:53+00:00,Saw a guy sitting at the coffeeshop with a mask. He takes it off to sneeze. And then puts the mask back on. #coronavirus #COVID19 @mrbrown @SGAG_SG,1246683712013496320,andrewhahalee,
2020-04-05 06:06:48+00:00,Mutton Soup 🥣#மட்டன்சூப் #coronavirus #Covid_19 #Singapore – at Playground At Jurong West Blk 823,1246680671436689409,Sathapillai,
2020-04-05 05:35:07+00:00,Proud to see the #medtech industry shifting into overdrive to help battle the #coronavirus. #covid19 #MedicalDevices #diagnostic #DigitalHealth #HealthTech,1246672695078473728,GabrielSim,
2020-04-05 04:50:37+00:00,Concerned for our friends and colleagues in #Jakarta. Exclusive: Jump in Jakarta funerals raises fears of unreported coronavirus deaths https://reut.rs/2X2V5nf @JakBerketahanan we are with you. @GlobalResCities,1246661497658302464,LaurenSorkin18,
2020-04-05 02:52:49+00:00,"beyond racism, easily saying tht africa should be a corona virus testing place, man that place isnt a testing lab. They had enough of struggling with ebola and such and now imagine a corona virus testing experiment for covid-19 vaccine in africa ",1246631852950958082,liltired2,
2020-04-05 02:44:52+00:00,"Two low-budget animated movies, one Norm sequel and one Logan Paul movie later... I wish the coronavirus gets eradicated soon so that we can return to the cinema to watch proper movies... ",1246629851441713154,FeelTheBlaziker,
2020-04-05 01:54:53+00:00,"Life in Singapore will hit a standstill for all of us for 4 weeks till 4th May from Tuesday, with the enhanced circuit breaker measures to stem the pre-empt increase of Covid-19 coronavirus infections. It’s also a… https://www.instagram.com/p/B-lNwtinAGk/?igshid=129ccq8sup901",1246617274070466563,bernardlim108,
2020-04-04 23:30:18+00:00,#singapore #coronavirus #4thapril #2020 update.. ✌🏼☺️ . #royaleclassbyrcs #singapore🇸🇬 #singapore_insta #singaporelife #coronavirusoutbreak⚠️ #coronaviruspandemic #covıd19 #southeastasia @Singapore https://www.instagram.com/p/B-k9N0QFRSG/?igshid=1pzoqal8mz6go,1246580885157302278,rosse_tdl,
2020-04-04 23:25:16+00:00,Coronavirus Circuit Breaker . In short is call CCB (@UOB Autolobby in Singapore) ,1246579618397724684,Jason_ZircaTan,
2020-04-04 14:39:55+00:00,Getting ahead of the next stage of the coronavirus crisis https://mck.co/2R3Vd1J. Good suggestions... what about companies that don’t have a bunch of “strategists” sitting around with nothing better to do than go through dozens of scenarios in this crisis?,1246447411980980224,whoiswen,
2020-04-04 14:38:37+00:00,"Social distancing to lock down happening around🌍, to see death no. rise &amp; mass killer still on d spree ; convict ‘Coronavirus’🦠 it does feel like d world coming to an end, but huger worries has humanity comes to an end?Time like this,even masked😷U see d ugliest side of peps😒",1246447083189456897,Rys5a_Gonzalez,
2020-04-04 12:05:43+00:00,"Bishop Barron on the Coronavirus, Catastrophe, and Contingency https://youtu.be/7tM3iDohF5o via @YouTube",1246408606255181826,ronhupa,
2020-04-04 10:49:10+00:00,This article is so spot on 👌 How to eat: takeaway while under coronavirus lockdown ,1246389343612092416,lulubellrunner,
2020-04-04 09:42:45+00:00,"Coronavirus, anche gli animali domestici possono essere contagiati: isolarli dai padroni positivi https://www.ilmessaggero.it/salute/focus/coronavirus_animali_domestici_contagiati_ultime_notizie_padroni_positivi_cosa_fare-5151359.html @ilmessaggeroit",1246372627637141505,mauro_crescenzo,
2020-04-04 09:22:04+00:00,#moneylaundering #2020 #editiom due to the #coronavirus #meme #timetolaughpeople @Singapore https://www.instagram.com/p/B-jcJJalKUa/?igshid=ks0ovr1dugub,1246367420685537280,mamb0jumb0,
2020-04-04 08:53:37+00:00,#criticalcare #intensivecare #ARDS #PedsICU Insightful observations for pulmonary mechanics in #covid19 #coronavirus patients A nice short read ,1246360261159579649,leejanhau,
2020-04-04 08:11:56+00:00,"A prestigious scientific panel told the White House Wednesday night that research shows coronavirus can be spread not just by sneezes or coughs, but also just by talking, or possibly even just breathing. https://cnn.it/2JF5q0M If it is airborne, we are doomed",1246349771566014464,KassimARah,
2020-04-04 06:13:09+00:00,No better time to reminisce and enjoy this master piece all over again #weareinthistogether #wearetheworld #covid19 #coronavirus ,1246319877968674816,zang_thio,
2020-04-04 06:04:19+00:00,@HonLiangTan @DavidKuICUMelb Can help spread the word around? Need your #criticalcare #intensivecare contacts in #Asia for this survey #covid19 #coronavirus ,1246317658795958272,leejanhau,
2020-04-04 05:10:09+00:00,国家厚道不厚道就看领导人表现： 我们领导人在悼烈士，种福田，展未来❤️ 而美国领导人现在在喷口水，甩他国锅子，抢盟友的医疗器材。😂😂😂😂😂 #TrumpMadness #COVID19 #coronavirus ,1246304027161198593,wngtm884,
2020-04-04 04:51:46+00:00,"Today Whole China mourns those who died from coronavirus. They are not only heroes to us Chinese, but for the whole world. ",1246299400059506689,Sophie54782115,
2020-04-04 04:43:32+00:00,"Coronavirus, KTM non sarà ad Eicma e a Intermot 2020 https://www.ilmattino.ithttps://motori.ilmattino.it/dueruote/coronavirus_ktm_non_sara_ad_eicma_intermot_2020-5148877.html @mattinodinapoli",1246297326290792448,mauro_crescenzo,
2020-04-04 04:40:56+00:00,"Coronavirus, Madonna posta il «panaro solidale» di Napoli: «Dio benedica l'Italia» https://www.ilmattino.it/societa/gossip/coronavirus_madonna_panaro_solidale_napoli_instagram-5150791.html @mattinodinapoli",1246296670830120960,mauro_crescenzo,
2020-04-04 03:18:08+00:00,"Dear GOD, please put an end to coronavirus🙏",1246275834786099200,IbtikhajYusni,
2020-04-04 01:48:45+00:00,"Himah di sebalik virus corona, bumi sedang pulih daripada pencemaran udara. #Repost @HashemGhaili (@get_repost) ・・・ It takes a pandemic to fix the planet temporarily. #Coronavirus #COVID_19 #COVID19… https://www.instagram.com/p/B-ioRASHF2Q/?igshid=4a9csi1s3iy8",1246253341061103623,edtvmalaysia,
2020-04-04 01:46:39+00:00,I was today years old when I learned how to pronounce obfuscation 👍 something good to come out of all this #lockdown #coronavirus,1246252811647500288,lulubellrunner,
2020-04-04 00:25:08+00:00,Cow urine to ward off corona virus. Really people?,1246232296727785472,dafugly_prince,
2020-04-04 00:23:01+00:00,@narendramodi The Corona Virus came to India like Alexander and finally lost to the Will power of the people of India and went back and died in Wuhan province. It lays buried there for posterity to come and See only.The Indian Will was lead by Narendramodiji.Jai Hind.,1246231766278365184,Narasim20561265,
2020-04-03 18:21:00+00:00,PM #LeeHsienLoong of #Singapore announced stringent “circuit breaker” measures to contain community spread of #coronavirus. Watching him effortlessly transition from English to Malay to Mandarin in his speech after taking sips of magic potion from a blue cup was fascinating 😄 ,1246140661864095745,gandhardesai,
2020-04-03 15:53:00+00:00,While me as a malaysian in singapore! #COVID19 #singapore #SingaporeTogether #coronavirus #ClapForCarers,1246103417677680643,itsmeamarboy,
2020-04-03 14:36:10+00:00,Imagine this: You wake up. There’s not a word about the Coronavirus. Everyone’s fine. No one’s sick or dying.. It’s April 1st 2019.,1246084078274637829,kimmhua,
2020-04-03 14:15:53+00:00,#Singapore is to impose new restrictions to curb the spread of the #coronavirus after a recent surge in cases undermined the country's early success in containing the outbreak: https://okt.to/EkxAjC | #ArgusOil Coronavirus hub: https://okt.to/2X9jwJ,1246078976696647683,argus_metals,
2020-04-03 14:11:13+00:00,"""Michigan State University researchers have found a way to re-sterilize N95 masks using commercial ovens, a method they say promises to help stave off protective mask shortages and save the lives of healthcare workers fighting the coronavirus outbreak."" ",1246077799808397314,dwallbank,
2020-04-03 14:06:21+00:00,‘Lawrence Wong gave me ASMR’: Singapore’s coronavirus response strikes chord with millennials ahead of election https://www.scmp.com/week-asia/politics/article/3077889/lawrence-wong-gave-me-asmr-singapores-coronavirus-response via @scmpnews,1246076577739231232,Joyce__Koh,
2020-04-03 13:24:06+00:00,Supporting NHS Cybersecurity During COVID-19 is Vital https://www.chathamhouse.org/expert/comment/supporting-nhs-cybersecurity-during-covid-19-vital?CMP=share_btn_tw via @ChathamHouse @JoyceHakmeh #COVID19 #coronavirus #cybersecurity,1246065944847249411,AuggieAnthuvan,
2020-04-03 13:16:09+00:00,"Life is changing so quickly here: Singapore will impose stricter measures, including closing schools and most workplaces, as the number of coronavirus cases rises https://www.bloomberg.com/news/articles/2020-04-03/singapore-pm-says-more-steps-coming-on-virus-lee-speaks-at-4pm via @business",1246063943174348805,Joyce__Koh,
2020-04-03 13:12:17+00:00,"#laughter in our lives is important ——&gt; Coronavirus: 'Laughter in a crisis can help you cope', says expert ",1246062969605128195,BhavnaNara85,
2020-04-03 11:53:02+00:00,Cheers to not being able to cheers for the next month😩 #notsofriyay #kualalumpur #GravyBaby #kl #malaysia #friday #FlashbackFriday #StaySafe #StayAtHomeAndStaySafe #singapore #Corona #coronavirus #COVID19 #Covid19Out #GoCorona #drinking #friyay #CoronaLockdown,1246043025555349509,anushreetj,
2020-04-03 11:08:23+00:00,Aiming to get more Asian participation in this important survey on challenges in #criticalcare #intensivecare #PedsICU research during #COVID19 #coronavirus Can help spread the word please? @paccman_asia @SICMSG @GraemeMacLaren @ongsoomay @CsGancs @PravinPICU @ChorYek https://twitter.com/M_Duffett/status/1245654376300994563,1246031791460192257,leejanhau,
2020-04-03 10:32:25+00:00,"#Singapore #Prime #Minister #Lee called on our #nation to #unite and #challenge the #COVID-19 #Coronavirus, don’t be the same as some people from our #neighboring #countries unite to #shame their country. http://www.mytipsntrips.com/scam/ #Indonesia https://m.facebook.com/leehsienloong",1246022740403879937,mytipsntrips,
2020-04-03 10:31:47+00:00,You know things are getting serious in #Singapore when... you can no longer go to Singapore Pools outlets to buy your 4D and Toto. #COVIDー19 #coronavirus,1246022579321589760,izreloaded,
2020-04-03 10:28:30+00:00,"#Perdana #Menteri #Lee memanggil negara kita untuk bersatu dan mencabar #COVID-19 #Coronavirus, jangan bersatu seperti sesetengah orang di negara jiran kita untuk memalukan negara #mereka. http://www.mytipsntrips.com/penipu/ #Singapura #Malaysia #Indonesia https://m.facebook.com/leehsienloong",1246021751768616960,mytipsntrips,
2020-04-03 10:10:46+00:00,"""The data offers real-time evidence of a divide laid bare by the coronavirus pandemic — one in which wealthier people not only have more job security and benefits but also may be better able to avoid becoming sick."" ",1246017288173576193,christiiineeee,
2020-04-03 08:19:42+00:00,"Our Prime Minister, announcing new tight measures in #Singapore to combat the spread of #covid19 —in #English, #Malay then #Mandarin. I liked his Chinese speech — “Buyao banlai banqu...” 🇸🇬🇸🇬 #majulahsingapura #sglife #coronavirus #pmlee – at Village Hotel at Sentosa",1245989337738514434,cheryltan88,
2020-04-03 08:06:31+00:00,#Singapore imposes “full home based learning” for schools starting from next Wednesday in order to halt spread of #Coronavirus,1245986021713547267,dan_murphy,
2020-04-03 08:05:54+00:00,Singapore PM @leehsienloong imposes one month “circuit breaker” measures to stop #coronavirus - most workplaces ordered to close except essential services with effect from next Tuesday. #Singapore,1245985867421843456,dan_murphy,
2020-04-03 08:04:32+00:00,Coronavirus Pauses U.K. Gender Pay Gap Reporting Ahead of April Deadline ,1245985520951283712,analystabhishek,
2020-04-03 06:37:40+00:00,Corona virus ,1245963662738616320,asyxaf,
2020-04-03 03:57:23+00:00,"mom asked me why I don't seem afraid of the coronavirus, then I looked at her and said ""because I've been raised in chaos""",1245923326087671810,sabrineong,
2020-04-03 03:34:27+00:00,Coronavirus: US Navy removes Captain Brett Crozier who raised alarm ,1245917554029121539,LattuRobert,
2020-04-03 02:27:41+00:00,"Fujifilm to release new #coronavirus test April 15, can shorten results time to about two hours ",1245900750263177217,NancyCNBC,
2020-04-03 01:00:12+00:00,"Whilst the communal virus grips India, the coronavirus has started gnawing through the medical workers at frontline who are given no proper PPE. ",1245878736005689346,msmsaifullah,
2020-04-02 17:51:32+00:00,Beyond coronavirus: The path to the next normal https://mck.co/2QECVnI via @McKinsey #coronavirus,1245770859567931392,AuggieAnthuvan,
2020-04-02 16:06:38+00:00,Shldn't this stop? Didn't learn Anytg? #COVID19 @WHO @potus #usa #coronavirus ,1245744457355374593,KassimARah,
2020-04-02 15:41:12+00:00,I think I’ll pass away first hahaha this coronavirus is worse than the Great Depression,1245738057388544002,thesiobak,
2020-04-02 15:10:42+00:00,I wonder how long it’ll take for the world to recover from the economic impact of coronavirus,1245730384635019267,thesiobak,
2020-04-02 14:26:39+00:00,"UIB is #openforbusiness! Read UIB #CEO @tobyruckert’s latest article on #LinkedIn. ""The best #people are everywhere. #DigitalTransformation is becoming a globally distributed team sport"" - https://www.linkedin.com/feed/update/urn:li:activity:6651228649678794752/! 👩🏿‍💻 #WorkFromHome #WFH #COVID19 #Coronavirus #Innovation #AI #IoT",1245719296430542852,uibglobal,
2020-04-02 14:19:47+00:00,"Sen. @MarthaMcSally says WHO chief @DrTedros should resign, criticizing the global body's moves vis a vis China during the Coronavirus outbreak. Says China needs to ""come clean and another piece of this is the WHO needs to stop covering for them"" ",1245717570239344640,dwallbank,
2020-04-02 13:29:43+00:00,we are all aware of the corona virus,1245704968998277126,SfSajibRana1,
2020-04-02 12:25:25+00:00,"Guidance can change based on evidence from research, of course. For example: Coronavirus: Expert panel to assess face mask use by public ",1245688789944733696,_PhilipRoberts,
2020-04-02 10:25:03+00:00,Finally... someone (something?) to talk to! Got a question? #AskMyPlant 🤣 #WorkFromHome #StayHome #coronavirus ,1245658494990090243,barb_lorenzo,
2020-04-02 10:04:57+00:00,"Held up as a role model for its battle against coronavirus, city-state Singapore is struggling with an infection spread that disease experts say bodes ill for global containment efforts. My latest with @RDchatters",1245653437028524034,geddiejdk,
2020-04-02 09:31:32+00:00,"I read a tweet saying that ""coronavirus is the chinese govt agenda to ruin economy of other nations"". Hmmm. I tak faham lah dengan melayu yang racist and anti-chinese ni. 🤦‍♂️🤦‍♂️🤦‍♂️",1245645028229173249,cookiejimz,
2020-04-02 09:09:00+00:00,"The Solemn occasion of Rama Navami is marred by Corona virus like Ravan and Kumbhkaran entering the Vanar Sena. May Lord Rama,Lakshmana and Hanuman protect our nation in this hour of crisis.",1245639358561923080,Narasim20561265,
2020-04-02 08:57:02+00:00,"#Sharing these #latest #COVIDー19 #updates from the #Philippines as of #today, April 2, 2020 at 16:30HRS. 🦠 322 🕯 11 👌🏻 1 #CoronavirusOutbreak #coronavirus #covid19 #COVID19PH #BreakingNews from @DOHgovph",1245636347445932032,MGNPunzalan,
2020-04-02 07:09:13+00:00,He’s like the coronavirus boss we’re trying defeat to save the world ,1245609215554514944,thesiobak,
2020-04-02 03:43:24+00:00,"I can’t brain statements like coronavirus is Gods punishment for our sins. No God wants to kill 50k people and take away food from the table of million others. If that is your view on this Almighty figure, then keep your imaginary daddy to yourself.",1245557418697691137,Sukhveer_Sandhu,
2020-04-02 02:09:59+00:00,CNN anchor presenter Chris Cuomo struck by Covid-19 but not down. Hosting his show live from his apartment basement at home. Admirable passionate journalism. #chriscuomo #cnn #coronavirus #covid19 #stayhome… https://www.instagram.com/p/B-dhGwRnx6t/?igshid=c9pogugl9q7n,1245533909938573313,bernardlim108,
2020-04-02 01:40:40+00:00,Coronavirus,1245526529590751233,jeevzxcy,
2020-04-02 01:36:05+00:00,El taxista y su particular visión sobre el coronavirus ya que él ‘ya comía murciélagos por allá en los 70’ de buena mañana 🦇,1245525377184743424,Marchavalecom,
2020-04-02 01:31:07+00:00,"Prevention is better than cure, when there is no cure! #CODVID19 #CoronavirusOutbreak #coronavirus ",1245524128431370240,AquibIkubal,
2020-04-02 01:26:56+00:00,UK Govt: Provide PPE to ALL frontline NHS to keep them safe #coronavirus - Sign the Petition! http://chng.it/2fKrYjRz via @UKChange,1245523076759998465,ScabbieDog,
2020-04-02 01:04:38+00:00,Seorang lagi warganegara Indonesia 🇮🇩 meninggal karena #COVID19 di Singapore 🇸🇬 menjadi yang ke-4 di SG Fourth coronavirus death in Singapore https://www.straitstimes.com/singapore/fourth-coronavirus-death-in-singapore?xtor=CS3-18&amp;utm_source=STiPhone&amp;utm_medium=share&amp;utm_term=2020-04-02%209%3A04%3A29,1245517464617639936,ainunnajib,
2020-04-02 00:31:09+00:00,#covıd19 #singapore #1stapril update.. ✌🏼☺️ . #royaleclassbyrcs #coronavirus #coronavirusoutbreak⚠️ #coronaviruspandemic #singapore🇸🇬 #singapore_insta #singaporelife #staysafe #socialresponsibility… https://www.instagram.com/p/B-dVy-uFfjD/?igshid=cily3o5fwi0j,1245509038265286656,rosse_tdl,
