Datetime,Text,TweetID,username,geo
2020-05-28 14:24:03+00:00,"We are proud to have The Tall ship in our fleet of yachts. Tonight in our show of support for the frontliners,, the icons of Singapore light up in blue #seeitblue movement to commemorate the efforts undertaken during this pandemic 🙏 #yachtbookingssg #FrontLineHeroes #covid19",1266012361913012230,yachtbookingssg,
2020-05-28 14:22:40+00:00,How do we convince flouters of safe distancing to be more considerate? SMU Prof David Chan delves into the science of encouraging socially responsible behaviour during the pandemic with 5 tips 🖐🏾 #SMUEngage #SMUInsights #COVID19,1266012014016524289,sgSMU,
2020-05-28 14:15:22+00:00,"Having said that, I can't say I'm impressed by the sh**show that is the US healthcare system or its political leadership in dealing so far with the pandemic. Hopefully,you can benefit from a working healthcare system a while longer before someone decides to cancel your work pass.",1266010179104989185,nadimvdr,
2020-05-28 14:13:49+00:00,"America's own underclass economically and punitively. Also, until the pandemic is over, I hardly think you, and the rest of the media, are qualified to determine which country had the best model of containment. We'll only know when we're through this.",1266009790255263745,nadimvdr,
2020-05-28 14:11:05+00:00,The 2020 Pandemic triggers human awakening and release of new energy tec... https://youtu.be/db27wBwsfGc via @YouTube,1266009099503730690,ClutchCPA,
2020-05-28 13:57:48+00:00,What is your take? join live webinar now! https://s.peoplehum.com/h3yb5 @debraruh @adriangostick @DorothyDalton @chesterelton #webinar #mondaythoughts #MondayMorning #Leadership #HR #pandemic #future #FutureOfWork #COVID19 #workingfromhome #ThursdayThoughts #WFH #lockdown #influencer,1266005758128209920,PeopleHum,
2020-05-28 13:57:47+00:00,OCP may be unsuitable or dangerous for some women who still have to get up and leave home to perform essential services in so many different settings while bleeding from their uteruses during this pandemic ! Respect !,1266005754978287616,afromedwoman,
2020-05-28 13:54:31+00:00,🚨 🚨 Poland unexpectedly lowers borrowing costs for the third time to stem the economic damage from the coronavirus pandemic ,1266004930243883008,BluePhoenixFin,
2020-05-28 13:52:48+00:00,"[UPCOMING! JUN 1, 6PM (GMT+8)] The new normal requires awareness & understanding of the pandemic's effects on the world today... Join us for this free informational webinar http://bit.ly/speaker-series-010620 #SportBusiness #JoinUs #NewNormal #Covid19 #Pandemic #SportPsychConsulting",1266004499862179841,SportPsychHQ,
2020-05-28 13:52:11+00:00,I will survive 53 days with my toilet roll in quarantine! @howmuchtp #howmuchtoiletpaper #toiletpaperpanic How long will you last? Try the calculator at http://howmuchtoiletpaper.com/ so you have enough during the pandemic,1266004344807190528,nyi81,
2020-05-28 13:50:52+00:00,"What is the perfect ratio of feedback? 1:1 or 5:1? Join now, and see what @chesterelton @debraruh thinks https://s.peoplehum.com/h3yb5 #webinar #mondaythoughts #MondayMorning #Leadership #HR #pandemic #future #FutureOfWork #COVID19 #workingfromhome #ThursdayThoughts #WFH #lockdown",1266004012639252480,PeopleHum,
2020-05-28 13:48:53+00:00,"Our Founder & CEO, Huub van Esbroeck joined @SGInnovate's panel on #DeepTech to talk about our response to the pandemic. It was great to see other #startups and #scaleups finding different ways to contribute during these trying times. #Structo #SGInnovate #COVID19 #SGunited",1266003515413061635,Structo3D,
2020-05-28 13:47:21+00:00,Konting tiis nlng magkasama na din yan matatapos na din yang lockdown. Intindihin muna sa ngayon sitwasyon dahil sa pandemic MAYWARD HappyAndBlessed,1266003126953275393,PrincilloVine,
2020-05-28 13:44:51+00:00,What’s the most important ingredient to being a better manager? Tune in now to see @adriangostick 's take on it! https://s.peoplehum.com/h3yb5 #webinar #mondaythoughts #MondayMorning #Leadership #HR #pandemic #future #FutureOfWork #COVID19 #workingfromhome #ThursdayThoughts,1266002496561876992,PeopleHum,
2020-05-28 13:31:37+00:00,"What do we go after? Man, woman, or talent? See what @adriangostick has to say. Tune in to the live discussion now- https://s.peoplehum.com/h3yb5 #webinar #mondaythoughts #MondayMorning #Leadership #HR #pandemic #future #FutureOfWork #COVID19 #workingfromhome #ThursdayThoughts #WFH",1265999167408812032,PeopleHum,
2020-05-28 13:27:46+00:00,The heroine every country wishes they have in the pandemic year of 2020. #COVID19 #JacindaArdern #NewZealand,1265998200793489408,LividEye,
2020-05-28 13:27:45+00:00,@debra has a unique perspective on inclusion at the workplace. Tune in to know more https://s.peoplehum.com/h3yb5 #webinar #mondaythoughts #MondayMorning #Leadership #HR #pandemic #future #FutureOfWork #COVID19 #workingfromhome #ThursdayThoughts #WFH #lockdown #influencer,1265998195718422529,PeopleHum,
2020-05-28 13:21:43+00:00,"@DorothyDalton recommends putting the H in HR, where are U in our live webinar? Join here: https://s.peoplehum.com/h3yb5 #webinar #mondaythoughts #MondayMorning #Leadership #HR #pandemic #future #FutureOfWork #COVID19 #workingfromhome #ThursdayThoughts #WFH #lockdown",1265996676235325442,PeopleHum,
2020-05-28 13:21:33+00:00,"US firms shield CEO pay as pandemic hits workers, investors https://cna.asia/3eqNTqj",1265996633080094720,ChannelNewsAsia,
2020-05-28 13:19:01+00:00,"@DorothyDalton recommends putting the H in HR, where are U in our live webinar? Join here: https://s.peoplehum.com/h3yb5 #webinar #mondaythoughts #MondayMorning #Leadership #HR #pandemic #future #FutureOfWork #COVID19 #workingfromhome #ThursdayThoughts #WFH #lockdown #influencer",1265995998397992962,PeopleHum,
2020-05-28 13:17:56+00:00,"@DorothyDalton recommends putting the H in HR, where are U in our live webinar? Join here: https://s.peoplehum.com/h3yb5 #webinar #mondaythoughts #MondayMorning #Leadership #HR #pandemic #future #FutureOfWork #COVID19 #workingfromhome #ThursdayThoughts #WFH #lockdown #influencer",1265995726330294274,PeopleHum,
2020-05-28 13:09:43+00:00,"""The question now arises whether ESG investing and its corporate equivalent, the integration of sustainability into business models, will become the new normal or whether the pandemic will eventually slow them down or derail them."" http://www.eco-business.com/opinion/covid-19-is-accelerating-esg-investing-and-corporate-sustainability-practices/ via @ecobusinesscom",1265993657326305281,TFIAsia,
2020-05-28 13:08:19+00:00,CEO of @Temenos Max Chuard outlines the importance of banks embracing new technology amid the Covid-19 pandemic ,1265993305357275136,cnbcipr,
2020-05-28 13:05:31+00:00,Thanks for the interview @DNewsAsia! Quick read on our approach during pandemic: https://www.digitalnewsasia.com/business/astrata-aims-boost-supply-chain-solutions-during-coronavirus-pandemic?fbclid=IwAR25vfOSz8ZkrLR5p5ZdmKhKg2p9VFukdW0NOk_sAM0sV1sQl52fOWR9h3g,1265992602043719684,Astrata_group,
2020-05-28 13:05:08+00:00,Workers' Party calls for ground rules on election campaigning during Covid-19 pandemic to be published promptly https://www.asiaone.com/singapore/workers-party-calls-ground-rules-election-campaigning-during-covid-19-pandemic-be?utm_term=Autofeed&amp;utm_medium=Social&amp;utm_source=Twitter&amp;Echobox=1590662196#xtor=CS2-4,1265992503515320320,asiaonecom,
2020-05-28 13:04:17+00:00,"So $TWTR called bullshit on this guy and he is now threatening to shut them down. Not as if we have a pandemic going on and USA is the worst hit country with highest numbers of Deaths. But NO, twitter is more important to him. #DumbestPresidentEver",1265992287881850881,vshark09,
2020-05-28 12:55:14+00:00,The European Commission has proposed a €750bn Recovery Fund to underpin the way out of the pandemic-induced recession experienced in H1 2020 ,1265990010832064514,ContinuumDaily,
2020-05-28 12:36:51+00:00,It’s soooo fuckin heartbreaking seeing people losing their jobs bec of this Covid-19 pandemic.,1265985384229396482,HermanSpears,
2020-05-28 12:26:51+00:00,"U.S. firms shield CEO pay as pandemic hits workers, investors ",1265982867529555969,TomLasseter,
2020-05-28 12:18:23+00:00,"Yes. understand tt this is e first time we encounter such pandemic and none of us wanted it to happen. So dun keep having that mentality tt we hv handled SARS b4 so we can do it. It is an obvious, we can't handle it the same as 13yrs ago. Period.",1265980737016041472,dextonstella,
2020-05-28 12:11:02+00:00,"UIB #CEO @tobyruckert joined the #Singapore @BusinessCircle_ yesterday for a Virtual Boardroom Briefing. “#Chatbots have been groundbreaking. Throughout this #Coronavirus #pandemic, #virtualassistants have ensured #businesscontinuity” - https://twitter.com/i/events/1265725808578121729! 💬🗣 #IoT #AIoT",1265978889794355202,uibglobal,
2020-05-28 11:59:38+00:00,Very useful advice for #Kidney Transplant patients during the Covid 19 Pandemic in #Punjabi by Dr. Aulakh of @aykaihospital with @kidney_warriors,1265976017908166657,PatientsEngage,
2020-05-28 11:59:20+00:00,Any company making additional pandemic profits should [complete this sentence...] ,1265975945459982336,timothy_mcd,
2020-05-28 11:55:20+00:00,"Its just weird for me. My main focus when I'm out the house is to get what i need and head home, so the fact that a man takes the time to do anything outside of that and see my beauty past a mask and shades during a whole pandemic. Sir, please. Woah.",1265974935794651137,True_Thando_,
2020-05-28 11:55:02+00:00,cant focus on the fucking pandemic for at least a few months before this shit again ,1265974860942983171,aaaarzx,
2020-05-28 11:47:03+00:00,The global pandemic has changed our work-culture. Have you wondered how to manage employees while Working From Home? Ichiban Payroll Guru is revolutionalising the resource management software industry. It's time to think #ForYourEmployees.,1265972853968474112,IchibanGuru,
2020-05-28 11:44:36+00:00,The global pandemic has changed our work-culture. Have you wondered how to manage employees while Working From Home? Ichiban Payroll Guru is revolutionalising the resource management software industry. It's time to think #ForYourEmployees.,1265972237875556357,FACTGroupERP,
2020-05-28 11:40:08+00:00,"trump didn't start the pandemic, trump didn't start racism, but it's b/c of him that we have 100,000 americans dead(majority minorities)- another innocent black man murdered in streets today. His level of evil, his level of incompetence is destroying this country in real time.",1265971111554093056,billrog46861867,
2020-05-28 11:19:04+00:00,Even during a pandemic? Wow,1265965811463643136,brokebrowngirl_,
2020-05-28 11:06:48+00:00,Sj go Malaysia? What abt this pandemic going on. Maybe the date is late.,1265962722673324032,_syiffiee,
2020-05-28 11:01:21+00:00,Playwright and former ST editor Tan Tarn How: Three proposals to address inequalities in Singapore after the pandemic - The Online Citizen ,1265961352331358213,Chinesepop,
2020-05-28 11:00:46+00:00,What will be the post-pandemic city look like? https://buff.ly/3ggPcK6,1265961206558449669,AbhasKJha,
2020-05-28 10:59:33+00:00,"Ways to Build Your Wealth: Types of Income Streams Anyone Can Have: The COVID-19 pandemic has sent the world into a frenzy, with the grim recession cloud looming over our heads. In Singapore, job losses are estimated to be 100,000 in 2020 alone. This… http://dlvr.it/RXWCy1",1265960900265033730,TheFinance_sg,
2020-05-28 10:56:07+00:00,So far the pandemic has reportedly claimed a lot of mid-class lives relatively sparring the poor and the young and black.,1265960037039702019,BookerMaseti,
2020-05-28 10:55:04+00:00,"Trump continues to claim broad powers experts say he doesn't have As he battles the coronavirus pandemic, President Donald Trump has been claiming extraordinarily sweeping powers that legal scholars say the president simply doesn't have. ",1265959769480859648,billm9,
2020-05-28 10:47:36+00:00,GSK to make one billion doses of pandemic vaccine booster - The Edge Markets ,1265957891095306240,enghou,
2020-05-28 10:44:20+00:00,How important is #5G in ensuring the sustainability of businesses in the wake of the #COVID19 pandemic? https://bit.ly/2yE80lC #coronavirus #covid_19 #IoT #IIoT #technology #industry4_0 #industry4 #automation #industrialautomation,1265957068990640129,IAA_Asia,
2020-05-28 10:37:57+00:00,"OVER 100,000 U.S. DEATHS: It's reports as the U.S. #death toll hits a staggering milestone three months into the #pandemic, as the country cautiously reopens with hopes for a #vaccine by year’s end but concerns about a possible #secondwave.",1265955462572204032,tezuma75,
2020-05-28 10:33:29+00:00,Your insights matters! How is the #manufacturing environment with the ongoing #pandemic? How are you recovering? https://bit.ly/2XvuOwc #covid19 #covid_19 #machineshop #manfacturing #metalworking #automotive #aerospace #MRO #singapore #thailand #vietnam #indonesia #malaysia,1265954338066714625,APMEN_Asia,
2020-05-28 10:28:50+00:00,Hahahaha oh how i wish! I think it's pandemic stress.,1265953171043729408,thatbongette,
2020-05-28 10:20:48+00:00,Workers' Party calls for ground rules on election campaigning during Covid-19 pandemic to be published promptly ,1265951146251714560,STcom,
2020-05-28 10:20:24+00:00,"Next on #ManagingAsia, I talk to Filipino business tycoon Jaime Zobel de Ayala heading #AyalaCorp about leadership in the #Philippines fighting #COVID19 &amp; how the 7th generation leader is steering the country’s oldest and largest conglomerate during this pandemic. @cnbcipr",1265951047270318080,ChristineCNBC,
2020-05-28 10:20:12+00:00,"@jk_rowling Thank you so much for livening up this pandemic with generous gesture of having Harry Potter book read by the famous people in it! xx Thank you from a single parent family in Singapore, Barbara and Jasper and Hermione (yes I named my girl after Miss Granger)",1265950997567860736,barbaralinalei,
2020-05-28 10:15:36+00:00,How does an event-based company continue operating during a pandemic? A pivot to 24/7 content. Watch Episode 3 of #UnbreakableCEO now: https://youtu.be/Yui9I2uuVb4 Presented by @YokohamaTC #BeUnbreakable #SpartanSG #Spartan,1265949840527114242,SpartanRaceSG,
2020-05-28 10:14:33+00:00,Coronavirus: How the pandemic in US compares with rest of world ,1265949574063099904,billm9,
2020-05-28 10:10:52+00:00,Safe distancing measures in a pandemic?,1265948648501702656,AtiyaahDollfie,
2020-05-28 09:56:26+00:00,Everyone has gotten more toxic during this pandemic. ,1265945015156531201,_BGJack,
2020-05-28 09:52:49+00:00,I cried listening to the cover of Spring Day🥺 This brings up the mood especially during this pandemic and with everything that's happening in the world. Hope the world will heal 🙏 @BTS_twt,1265944107161022464,cherry900b,
2020-05-28 09:51:59+00:00,"The central focus of the #FortitudeBudget is jobs. Many businesses have taken a hard hit by the sudden emergence of the COVID-19 pandemic. To help firms get back on their feet &amp; protect our workers, the Govt has further enhanced the Jobs Support Scheme [http://go.gov.sg/jss].",1265943894589505537,MOFsg,
2020-05-28 09:51:39+00:00,Motor racing: Dutch F1 Grand Prix postponed to 2021 due to pandemic ,1265943810007326721,STsportsdesk,
2020-05-28 09:48:12+00:00,Motor racing: Dutch F1 Grand Prix postponed to 2021 due to pandemic https://www.straitstimes.com/sport/formula-one/motor-racing-dutch-f1-grand-prix-postponed-to-2021-due-to-pandemic?utm_term=Autofeed&amp;utm_campaign=sttw&amp;utm_medium=social&amp;utm_source=Twitter#Echobox=1590659292,1265942944239976449,STcom,
2020-05-28 09:46:23+00:00,"At #ANSAC, we stand to support you, now and always! Upkeep your workplace safety with these amazing offers from our ‘Back to Work – Best Sellers’! For more info and direct purchase - https://tinyurl.com/btwbspromo #ANSACCares #BacktoWork #Phase1 #StayConnected #COVID19 #pandemic ",1265942485383016448,AnsacTechnology,
2020-05-28 09:41:46+00:00,"The kids pjs that I got the refund for because it was stuck at the airport in China since March, finally arrived. And payed the seller for the amount I got refunded, because it wasn't their fault that the shipment was delayed due to the pandemic.",1265941323393073154,mintea,
2020-05-28 09:37:51+00:00,"How the pandemic gave a woman the chance to strike out into the world, confront danger and make a difference, and how her husband stayed home to care for their daughters: ",1265940340671836160,TSWestbrook,
2020-05-28 09:35:13+00:00,We have quite a few characters serving as health minister in both past and present times. Not sure how these are related to the way we've handled the pandemic so far 😑😑,1265939675761397761,DrAlexArifianto,
2020-05-28 09:32:04+00:00,Pandemic worsens pain of periods for women across the world: NGO https://cna.asia/2TMM6Uz,1265938882207428609,ChannelNewsAsia,
2020-05-28 09:30:12+00:00,"""Today, I’m very proud of everyone who is #graduating this year in the midst of the #pandemic, and we should certainly celebrate them. But with #May being #MECFS #Awareness Month, I want you also to remember all of us who are missing"": https://buff.ly/3cw3tRb @DreamingPanda1",1265938414798614528,AChVoice,
2020-05-28 09:24:07+00:00,Mediacom's Anush Prabhu on why the pandemic might actually be an opportunity http://dlvr.it/RXVxGK,1265936880882745344,CMO_Forum,
2020-05-28 09:20:01+00:00,ASEF's work in risk communications and pandemic preparedness is acknowledged by @WHO. Follow @ASEF_PHN for specialised updates on #publichealth!,1265935849834729472,aseforg,
2020-05-28 09:19:32+00:00,"@KrASIAofficial Q&amp;A interview with @NikoLindholm, Program Director of @EduSpaze to find out what will happen to #education tech when the #COVID19 pandemic fades and the state of #edtech in #SoutheastAsia. #nordicmade 📚🌏",1265935730922029058,nihsingapore,
2020-05-28 09:17:57+00:00,"“To date, there has been a distinct lack of clarity as to precisely how campaigning will be modified in view of the COVID-19 pandemic.” Read the full statement here: https://www.wp.sg/wp-calls-on-government-to-publish-election-campaign-rules-forthwith/",1265935329418043392,wpsg,
2020-05-28 09:17:37+00:00,"Thanks Juseong. Definitely something to look into! Will have to get through the tech complexity. Due to the pandemic recently all classes went online via Microsoft Teams. I guess we'll have to explore more new options under this ""new normal"".",1265935247016783872,CollinSLKoh,
2020-05-28 09:13:57+00:00,contagion movie tu untuk spread awareness pandemic covid 19 ni ha!!,1265934324932571136,annatasyoo,
2020-05-28 02:17:33+00:00,This pandemic making me fatter only..,1265829531971055616,miraclistbadru,
2020-05-28 01:08:52+00:00,Thailand 🇹🇭 still closed for travel #Coronavirus pandemic @cnni,1265812250989756417,lococapricorn,
2020-05-27 17:28:55+00:00,It's probably the pandemic tho not ordering stuff anymore,1265696500408913922,0athmeal,
2020-05-27 14:25:46+00:00,#NewZealand is the gold std for #COVID19 pandemic management now and we shld learn and adapt with them. #Singapore,1265650409642708992,KassimARah,
2020-05-27 12:50:37+00:00,This pandemic is making everything uncertain 🤕😓,1265626462121426944,mariel_agnas,
2020-05-27 11:10:48+00:00,"Good read, as always. Factual, not opinionated. Nothing in policies will change. When even a pandemic couldn't force change? Pay and pay fer lyfe 🤘🏼 ",1265601341394694148,FarieRose,
2020-05-27 10:52:53+00:00,"Find decent, humane and clean environments for them to stay and work. This should hve been a priority from start vs onky now it has been realised and too late with the pandemic.",1265596833394384896,KassimARah,
2020-05-27 01:30:11+00:00,"Death toll from #Covid_19 exceeds 100,000 people in the USA (May 26) - top country hit with no sign of slowdown... #coronavirus #pandemic https://www.worldometers.info/coronavirus/",1265455226619695105,lococapricorn,
2020-05-26 22:28:53+00:00,The incentive of racist attitude is loosing job in a pandemic. https://www.bbc.co.uk/news/world-us-canada-52759502,1265409599651241985,msmsaifullah,
2020-05-26 12:51:27+00:00,"700 research and development paid traineeship positions will be open for application to this year’s graduating cohort during the pandemic. As part of the #COVID19 Relief Package, @NTUsg traineeships positions will be available at several joint labs. ",1265264285623611392,NTUsg,
2020-05-26 12:49:35+00:00,The #Covid19 pandemic has forced governments around the world to rethink radically their approach to #telemedicine. #telehealth #DigitalHealth #HealthTech,1265263813185568771,GabrielSim,
2020-05-26 11:33:00+00:00,Shld chk if covid free first at borders. So no repeat of pandemic across the world again and into countries,1265244540002131969,KassimARah,
2020-05-26 11:27:18+00:00,Can’t wait for the pandemic situation to be over soon! Right now I can only stay at home and test out the different outfits that could go possibly go well with this new bagpack from @gustonluga (here’s one of the… https://www.instagram.com/p/CApjzwVhWib/?igshid=1gn9kr87b2axu,1265243106993192960,AwesomeChoo,
2020-05-26 11:19:51+00:00,one thing positive about the pandemic is it’s been quite civilised so far @Tanglin Park https://www.instagram.com/p/CApi9atnewb/?igshid=842jptk4a4ya,1265241232755867648,thebendingone,
2020-05-26 10:20:39+00:00,"Same guys who covered up on #COVID19 outbreak from start in Dec 2019 and still avoid investigations, and had the pandemic spread all over the world with Infections and deaths as huge as the last Plague. Seriously nobody believes Anytg thy say except fake news @cnn. #usa",1265226332998270977,KassimARah,
2020-05-26 09:03:16+00:00,i hope they get to write one for you after this whole pandemic blows over ♥️,1265206860140830723,unhhhhwonder,
2020-05-26 06:27:40+00:00,What Are people looking for in a Recession? ✅ Money for Financial Security 🌟Solution = Online Social Media Marketing Biz ✅ Health Immune system during Pandemic 🌟Solution Wellness Nutrition to Improve Immune… https://www.instagram.com/p/CApBhUaABPQ/?igshid=13auwa4hllqwn,1265167700483018752,TinaJGoh,
2020-05-26 03:22:09+00:00,"Yea la, just introducing an opt-out option for those who don’t need it what, that money can be used to spend on the many groups of people who are suffering because of the recession caused by the pandemic ever thought about that?",1265121014507134976,THELEGENDRAPH,
2020-05-26 01:46:08+00:00,"I totally understand if they’re slacking due to the pandemic. But dude, re-assurance is part of customer service?!?? No?!?! You know you left shit halfway, you expect me to come to you and keep bugging you, “Hi Morning, any news if the works can be resumed after 1st June?” Eh.",1265096851130212353,nasrulljarlani,
2020-05-25 18:33:14+00:00,i miss going on and taking pictures i really do........ when this pandemic fuckery is done @Flyingwizardx we iz going owt Idc,1264987909741899776,sadlyzai,
2020-05-25 15:38:34+00:00,"Friendships While Social Distancing 💓 During this pandemic period, some of us might feel being isolated. Sometimes, a text message or giving a buzz to your friends or business associates just to say hello or take… https://www.instagram.com/p/CAnbxPNHYrE/?igshid=1wl69dc1vkb16",1264943952089747457,jennylee_2012,
2020-05-25 15:06:31+00:00,Wondering if it’s a good time to buy a property during a pandemic? Here are our thoughts! https://www.howtoupgradetocondo.com/post/does-covid-19-make-a-good-time-to-buy-a-property,1264935886812110849,weepropertySG,
2020-05-25 14:59:05+00:00,All I fcking do is worry about work. I can’t believe I hate what I’m doing so fcking much right about now in the midst of this pandemic. UGHHHH,1264934016299307009,chenzelness,
2020-05-25 12:40:52+00:00,Nama 2 anak harimau di Brazil Di beri nama Pandemic &amp; quarantine 😂,1264899232592351232,MayaSafitri_08,
2020-05-25 11:25:52+00:00,1st time @gohmingsiu and @scottchillyard do audio spotting remotely! Working on our lockdown short film with Golden Horse winner Teo Wei Yong! #MonkeyAndBoar #sgfilm #madeinsg #filmmaking #indiefilm #asianhorror #asianfilm #lockdown #shortfilm #pandemic #covid19 #TheShapeOfYou,1264880356861243392,RepossessionSG,
2020-05-25 09:04:10+00:00,Eid visiting during pandemic is a bad (if not worse) idea. I’ve thought wrong. ,1264844699275104256,HighThe,
2020-05-25 06:07:13+00:00,Wondering where would I ever be if pandemic hasn’t happened. 🤝 #myfirstoufofthecountrytrip #WhenInSingapore #me #throwback #tbt #photooftheday #smile #instagood #instamood @Singapore https://www.instagram.com/p/CAmPOb1l62a/?igshid=18s30co3arzy0,1264800168270069761,JuanderPalaboy,
2020-05-25 06:01:45+00:00,Contemplating whether to buy AirPods Pro in this pandemic.. hmmph. 🤔,1264798791061790724,khrlrfan,
2020-05-24 20:01:09+00:00,"Existential nausea comes from feeling trapped, or locked down if you will. But it is also an affect state resulting from the feeling that the future has only bad options, like opening up in a #coronavirus #pandemic",1264647646393716736,Gambariste,
2020-05-24 15:29:54+00:00,"ahhh, was able to see and hear fr. charlie’s homily yesterday & today online. many thanks to all the fil community out there for your efforts amidst this pandemic. 👍",1264579385316700165,leny_lizardo,
2020-05-24 14:53:22+00:00,"Covid19 is a pandemic, not a politics pls have humanity",1264570189871329282,chef_sathya,
2020-05-24 12:59:28+00:00,"if it wasn’t for the pandemic, our house would be packed right now... :”)",1264541526018846724,rayhanburhan,
2020-05-24 07:42:54+00:00,"Best way to #fight the concurrent #PANDEMIC is staying home, touching and holding are NO NOs!!! So kapit bisig? Think of another gullible ideas, I’m pretty sure people will buy that! NOT THIS!!! ",1264461860935368706,Cocinero_1228,
