Datetime,Text,TweetID,username,geo
2020-03-24 23:43:31+00:00,Grateful in a way that she will not be around to see our current pandemic go from bad to worse. Small mercy.,1242597947675512832,PatchouliW,
2020-03-24 19:38:28+00:00,Sound like Singapore. #pandemic #dontbeselfish,1242536278895120385,srisamri,
2020-03-24 16:45:46+00:00,"Yes. A close look at the responsibilities of Emergency Management Australia would be a good start point. Used to include pandemic/epidemic response. Civil defence Mission of Govt in Australia died years ago, except for fire and flood. Cyber civil defence almost as bad. ",1242492815004712964,GregDAustin,
2020-03-24 16:28:53+00:00,"This pandemic gives rise to live streaming with good beneficial content! Keep it up, creators!",1242488566766133251,theartofmezame,
2020-03-24 15:37:00+00:00,Still working on believing ... pandemic preparedness by Economist Intelligence Unit on 25th October 2019. ,1242475510455619588,PRO_FITS,
2020-03-24 15:27:26+00:00,"Singapore prepared for such a pandemic after learning their lesson from SARS. Since dumating ako dito 5 years ago, every year kami may pandemic drill. Sana when this is all over, our DOH can think of something like that.",1242473101977247744,JLrocks05,
2020-03-24 12:22:38+00:00,Call it an unexpected upside of global pandemic. Have had daily conversations with extended family around the world on daily basis for the past week+. Background worry is don’t know when / if will see them all again 😢,1242426597799387137,shaunnorris,
2020-03-24 12:08:16+00:00,Release it quicker for sake of your fans during this pandemic... ,1242422982221299712,CheekyAmin,
2020-03-24 11:06:45+00:00,"“To care, to cure, to comfort.” Wise words on practising *care* as a way of handling uncertainty in the time of the pandemic from @deziluzija &amp; @zzkt of @_foam: https://fo.am/blog/2020/03/24/care-cure-comfort-pandemic-remix/ #COVID19",1242407498562162688,honorharger,
2020-03-24 10:55:29+00:00,"The #COVID19 pandemic is accelerating. It took 67 days from the 1st reported case to reach the first 100K cases, 11 days for the second 100K cases &amp; just 4 days for the third 100K cases. These numbers matter, these are people, whose lives &amp; families have been turned upside down ",1242404664865361922,Suriya_Fanboyy,
2020-03-24 08:38:54+00:00,"Privacy is apparently an issue in the face of a pandemic, but not when requiring people to login with their Facebook accounts to read the article. Hmm.... ",1242370290690056192,basilyeo,
2020-03-24 04:54:04+00:00,Teaching in the eye of a hurricane - while countries around the world go into lockdown life in Singapore ticks along albeit with some restrictions to manage the pandemic that started back in early January . ,1242313710489628673,traintheteacher,
2020-03-24 04:53:23+00:00,"I guess at this point, its a losing battle. No one seems to want to cooperate at isantabi ang too much political indifferences despite the pandemic issue. I rest my case. Goodluck Pinas. May you all learn that in times of emergency, instead of loathing one another, just help.",1242313537243906048,michellefrani,
2020-03-24 04:45:26+00:00,"Illustration by Dimitrios Hantzopoulos, published in the Greek newspaper ""Ekathimerini"" on March 22, 2020. #COVIDー19 #pandemic ",1242311539241013251,homiliai,
2020-03-24 04:41:30+00:00,"These #ellenmean tweets are wrong on so many levels. At a time when the entire world is gripped by a #pandemic causing monumental distress and sadness, we want to add more grief than bring relief. Let’s rise above to help, not hurt others @KevinTPorter @TheEllenShow #Ellen",1242310549792116736,getlinkked,
2020-03-24 02:43:18+00:00,Spring is here. This “pandemic coronavius” winter is ending soon. Stay hopeful! @Singapore Botanic Gardens https://www.instagram.com/p/B-GZw3ElOyc/?igshid=1kf79xnikfuc,1242280800864870402,ncrystalicious,
2020-03-24 00:00:36+00:00,Not to mentioned other gatherings n congregations that took place even after #WHO declared it a pandemic #COVIDー19 #COVID19,1242239860045275136,oscarjoshua69,
2020-03-23 23:58:01+00:00,"Tabligh gathering? When was it? 27th february, b4 WHO declared a pandemic. The Piala Sumbangsih #JDT vs #kedahfa new #stadiumsultanibrahim In JB full like double than the tabligh, n many more large gatherings happen before 29th feb. Why must u only emphasized tabligh?",1242239208225308672,oscarjoshua69,
2020-03-23 21:10:03+00:00,Getting ready for pandemic – at Khoo Teck Puat Hospital (KTPH),1242196939447259136,nangka1,
2020-03-23 17:59:53+00:00,This is accurate during this pandemic #COVID19PH,1242149082690281473,ErosLomboy,
2020-03-23 16:21:12+00:00,My grandfather died alone because the hospital restricted all visitors in order to contain the outbreak. There’s a lot we can numb ourselves to survive this pandemic situation but I’m not sure we can numb to the idea that we can no longer come together for funerals.,1242124244617555968,danibogo,
2020-03-23 15:07:18+00:00,"Talk without sense in nonsense, covid19 appear not because of Malaysia politicals situation. So please seperate the 2 matters. Are u saying that if PH still govern, there will be no covid19 pandemic n China was so unfortunate that covid19 mistakenly landed in China n infect them.",1242105649506312192,oscarjoshua69,
2020-03-23 14:59:24+00:00,"Fyi the tabligh gathering is on the 28th of Feb. On the same day piala sumbangsih.(JDTvsKEDAH) Tabligh 16000, stadium spectators? Full, new stadium like what 30000? And 28th was before WHO declare pandemic. I suggest all of us shd act rationally on this situation be fair.",1242103661116809216,oscarjoshua69,
2020-03-23 14:01:58+00:00,"After all is said and done, we will realize this pandemic just turbo charged the digitalization of our life.",1242089206085595139,benjiminu,
2020-03-23 13:46:54+00:00,"This is a great video, demonstrating what it takes to bring a pandemic under control. ",1242085413495304192,alvinjhchang,
2020-03-23 13:19:36+00:00,"With coronavirus pandemic, it has caused great damage to Europe, thus causing one of the greatest depreciation that we have lived to witness. Right now, the market double bottomed with RSI Divergence on EURUSD at… https://www.instagram.com/p/B-E9yJvgdQx/?igshid=17lz590twar21",1242078546211864576,raynlim,
2020-03-23 12:13:57+00:00,"And yes, this Pandemic will soon pass and i will be back on the road.. hopefully! 🙏🏻",1242062024248418307,GenesitKUN,
2020-03-23 10:31:24+00:00,Why tf do people KNOW they’re sick and coughing to fuck and still REFUSE to wear masks??!?!?!? HELLO????? GLOBAL PANDEMIC?!???,1242036218063253505,kimmhua,
2020-03-23 07:44:02+00:00,How Power and Gas Utilities Keep Energy Flowing in the Pandemic ,1241994095586725888,analystabhishek,
2020-03-23 07:12:05+00:00,"I always had a gut feeling that despite all the panic(We have to), India will come relatively unscathed in this pandemic. One of the reasons is the % of Indian origin people in the number of #COVIDー19 cases in Singapore. Is there some form of genetic immunity?",1241986056515252224,RajeshChakram,
2020-03-23 06:20:06+00:00,Dessert pandemic times... – at Swensen's,1241972974556557312,ReyvenG,
2020-03-23 04:23:44+00:00,"United We Will Win - So, Hampir semua kapal pesiar diseluruh dunia berhenti berlayar karna pandemic #COVID19 Disini perusahaan tempat gw kerja mau kasih pesan #UnitedWeWillWin , kita bisa menang kalau kita bersatu. Stop spread the virus, we can do it! #SetorFoto @piokharisma",1241943689670406144,BaganSisworo,
2020-03-23 01:09:14+00:00,"The new Wealth is when you are Financially Independent, Healthy and having an Amazing Relationship. With Covid19 pandemic, many countries include Singapore has shut-down its border. With that, many people would be… https://www.instagram.com/p/B-DqMy7A5eS/?igshid=bppq4b855sn6",1241894742637641728,raynlim,
2020-03-23 00:03:16+00:00,if we really have to vote in the midst of the corona19 pandemic let's vote opposition!😂🤣😂🤣😂,1241878139963228160,omnitaufoo,
2020-03-22 23:21:08+00:00,"Have you been keeping yourself healthy? As the #covid19 disease goes pandemic around the world, it is important for us to have a regular exercise routine, eat healthily, sleep well and follow social distancing… https://www.instagram.com/p/B-Dd1WSJa5e/?igshid=1iji42kdkgjbq",1241867539631620096,coolinsights,
2020-03-22 17:53:16+00:00,World of Warcraft: Classic. We gotta beat the COVID-19 pandemic and Blood of Hakkar plague in-game!,1241785029019103232,theartofmezame,
2020-03-22 16:49:00+00:00,Wanted to give a shout-out to a group of heroes who have quietly working in the background throughout this pandemic: the IT teams keeping us online. Despite the huge surge in traffic as people self-isolate we haven’t seen mass outages. Throughout it all governments have been 1/2,1241768855287955456,skilllevel7,
2020-03-22 14:58:58+00:00,A Wird During A Pandemic https://sandala.org/wird-during-a-pandemic/,1241741164589416450,rayhanburhan,
2020-03-22 14:21:29+00:00,"Every body on my TL is now a pandemic expert advising the man,who handled one of the worst earth quake in Indian history &amp; made that region thriving again,what to do next and how to handle the #ChinaVirus",1241731731440291840,RajeshChakram,
2020-03-22 13:43:35+00:00,Wondering when we will start seeing light in the end of the tunnel with the pandemic? And what windows of opportunities will this bring #Singapore @Punggol Bayview https://www.instagram.com/p/B-CbvIzBfCP8mYUsHQl2RBAkimvgvm5SmUwgsU0/?igshid=7wv0f70xdeeg,1241722193966325762,s_nummelin,
2020-03-22 11:47:44+00:00,Life in isolation. Drawing series #2. #pandemonium #pandemic #drawing #art #mixedmedia #jaqsonatastudio #emilyhillstudio #klubkaki5 @Emily Hill https://www.instagram.com/p/B-CN4GUh7mI/?igshid=gicfhm4udoyv,1241693037706784769,adiyadoni,
2020-03-22 11:40:01+00:00,"#healthsystems should start embracing the hospital-at-home model, which has seen an upward swing in 2019. #HospitalatHome programs will play a critical role during a #pandemic like #COVID19. #publichealth #healthcare #health #coronavirus",1241691096716955649,GabrielSim,
2020-03-22 11:31:44+00:00,We can play again when the pandemic is over!,1241689010461757442,eviltofu,
2020-03-22 10:13:12+00:00,"“In this Year of the Nurse and Midwife the eyes of the world are on our profession in a way that we could not have anticipated. Nurses are in the spotlight, and all around the planet this tragic pandemic is revealing the irreplaceable work of nursing for all to see” @ICNurses",1241669249858277377,Brigitte_Woo,
2020-03-22 04:14:45+00:00,"@rachshabi During this time of virus pandemic, you should focus on offering help and guidance rather than political point scoring! Your negative journalism is really unfortunate!",1241579040349147136,GordonL59975168,
2020-03-22 02:48:00+00:00,Urge everyone to read and watch this. People who are conplacent about the #COVID19 #pandemic need to see what it’s like to basically suffocate. Seniors are so vulnerable. ,1241557211110752261,ArishKhajotia,
2020-03-22 00:52:31+00:00,"We elected a president without casting a single vote, are we to cast 2.6 million votes for a pandemic election? https://www.theonlinecitizen.com/2020/03/20/we-elected-a-president-without-casting-a-single-vote-are-we-to-cast-2-6-million-votes-for-a-pandemic-election/ yes this self serving govt serves the greeds of its members. We must vote them out should it happens.",1241528147163484160,poortan,
2020-03-21 14:55:32+00:00,You know what’s gonna be gone after #Covid_19 ? -The FOMO pandemic,1241377913250840581,MelikaAlipour,
2020-03-21 13:24:13+00:00,Wild that we’re still able to watch performances in Singapore but what’s even wilder is that a tribute to AIDS was coincidentally scheduled in the heart of the COVID pandemic. – at WILD RICE,1241354931421859843,pauriahcarey,
2020-03-21 12:29:33+00:00,OMGOSH. This stupid pandemic is causing a ruckus especially in a third world country where jobs are being affected badly. People I know are in hunger. 😔😔 No tourists = No income. 😬😬,1241341171949019136,9d9m,
2020-03-21 09:54:08+00:00,Saudi Arabia unveils SR120bn business support war chest to fight virus pandemic https://www.arabnews.com/node/1644326#.XnXkCntodOR.twitter #SaudiArabia #coronavirus #COVID19,1241302064002560000,AuggieAnthuvan,
2020-03-21 09:29:17+00:00,"But since the pandemic, sourdough has totally been a thing.",1241295807342469120,honorharger,
2020-03-21 07:12:41+00:00,She survived cancer. But not this wretched pandemic. Goddammit.,1241261429870587909,PatchouliW,
2020-03-21 06:52:45+00:00,Back when things were normal. #freedom is something I’ve always valued even when I was younger; this pandemic just magnifies it’s utmost importance. 💯✔️ . . . #singapore #travel #travelgram #cityvacations… https://www.instagram.com/p/B9_H7MtjFMY/?igshid=uoafg5opoxn8,1241256416423194624,i_FemmeFatale,
2020-03-21 06:21:51+00:00,Italian style sportscars are wonderful. Italian style pandemic NOT SO MUCH.,1241248640145985538,PatchouliW,
2020-03-21 05:57:33+00:00,This administration is about got go under this pandemic when people realise what they're getting angry about,1241242524720566273,PatchouliW,
2020-03-21 01:15:00+00:00,"For those working from home and complaining about the back ache or choppy internet, we should be grateful to still have a job and health insurance, there are many others who don’t and are suffering during this pandemic. #tippedworkers",1241171417594392576,benjiminu,
2020-03-20 15:29:43+00:00,@HillaryClinton pse shut up and let the elected @potus and real. Pple. Managing the pandemic do their work. Thank u. #USA,1241024127663661056,KassimARah,
2020-03-20 14:04:50+00:00,Yeh hai so called Public Leaders !! When the Whole World is in pandemic despite of knowing travel history of Confirmed case now they are engaging in Holi Party !! Sab ki Pant dheeli hain !!! #coronavirusindia,1241002764815065088,rajeevmusic007,
2020-03-20 11:03:24+00:00,@FlyRwandAir @flysaa and @emirates not flying to #Zambia during the #pandemic. Are @proflightzambia @flyethiopian and @KenyaAirways still flying?,1240957107148427264,Muloongo,
2020-03-20 10:29:15+00:00,"""If you need to be a rapacious landlord in a major pandemic crisis, go get yourself bent into a pretzel and then lost"" is my more succinct response to this bullshit.",1240948509471211521,PatchouliW,
2020-03-20 10:27:49+00:00,They were supposed to be a family heirloom. To be passed down across generations until it explodes one fine day in the 25th century and causes a massive botulism pandemic. Or was that the Christmas rum fruitcake?,1240948149931233280,PatchouliW,
2020-03-20 09:40:13+00:00,lmao don't send me linkedin requests asking me to attend a physical conference in the middle of a global pandemic,1240936173289127936,christiiineeee,
2020-03-20 09:13:40+00:00,Evictions leading to infection in a pandemic is bodily harm. Evictions leading to death by infection in a pandemic is murder. Persecute accordingly!!,1240929489141415937,AtiyaahDollfie,
2020-03-20 08:46:16+00:00,"As part of Currie & Brown ‘s priority to keep all staff👷🏻‍♂️👷🏻‍♀️, family members 👨‍👩‍👦 and clients 👨🏻‍💻👩🏻‍💻 healthy and safe in dealing with the current Coronavirus pandemic; Pure Water Wipes and Hand Sanitisers are… https://www.instagram.com/p/B98wHsQnfrL/?igshid=nrl3cghnjxzu",1240922593202507776,zidaneong,
2020-03-20 08:10:56+00:00,Secara Mereka Udah sesumbar ke dunia bahwa Mereka sukses mengatasi pandemic Tiba2 ada lagi kan malu,1240913704956219392,AbiellaThania,
2020-03-20 05:49:00+00:00,I actually wasn’t on board with the healthcare tech at #CES2020 in Jan that will greatly made a huge impact on today’s pandemic outbreak. #healthcare,1240877986108207104,faixosman,
2020-03-20 03:27:12+00:00,Please dont be a racist. We are in the midst of a pandemic. Its not a time to spread hatred. ,1240842297601744903,cookiejimz,
2020-03-20 03:01:29+00:00,Watching the @netflix docuseries ‘#Pandemic: How to Prevent an Outbreak’ while I’m staying home. Is that ironical? #SocialDistancing,1240835828999270400,JKannanR,
2020-03-20 01:56:57+00:00,Join us for our first-ever virtual briefing for insurance professionals on Survival Skills in the Era of Pandemics. Register here: https://www.asiainsurancereview.com/Events/Register/Asia/airvs #virtual #survival #pandemic #coronavirus #covid19 #covid_19 #onlineevents,1240819586104057856,slogaa,
2020-03-20 00:56:29+00:00,The situation due to this Pandemic reminds me of Blaise Pascal's Quote - “All of humanity's problems stem from man' inability to sit quietly in a room alone.” #COVID19 #solitude,1240804371564118018,vinos25,
2020-03-19 23:30:21+00:00,Dear @zakatselangor do you have any initiative to help small hawkers /penjaja during this Covid 19 pandemic? I heard the collection for 2019 itself already RM 850 millions. Even zakat Pulau pinang had done so. Kindly clarify. #zakatpayer,1240782695732400128,ebnu_amin,
2020-03-19 17:50:04+00:00,OK American Swine Flu H1N1 Pandemic lasted Jan09-Aug10.. hmmm,1240697060669550593,RedSevensJane,
2020-03-19 16:05:19+00:00,we stan mf moe for choosing to keep schools open and exams going despite us facing a fucking pandemic! LMAO fuck jc im ab to declare a self-quarantine idc,1240670698386817025,omqchristel,
2020-03-19 14:50:52+00:00,@MUISingapore @SgGoverment #Singapore @STcom @BeritaHarianSG there must be a way to track those leaving for such gathering or planning to Laws must be strict to punish them iat the height of an pandemic which affects all #Singaporeans. Irresponsibility has no place in Islam.,1240651961826828288,KassimARah,
2020-03-19 13:29:26+00:00,"Singapore lags behind Thailand and Malaysia in #pandemic preparedness, says Economist Intelligence Unit. Time to update your Global Health Security Index @TheEIU? #COVID19",1240631468516237312,GabrielSim,
2020-03-19 13:13:06+00:00,These are mere platitudes from a leader whose first reaction to this pandemic was to cover it up... like a provincial functionary in Wuhan. Sounding strong now is too late for him. ,1240627356772864000,PatchouliW,
2020-03-19 10:29:21+00:00,"Will service with a smile suffice when everyone is masked up, or will it bring loyalty down? #covid19 #pandemic #airlines #hospitality",1240586150156197889,SiminNgai,
2020-03-19 08:34:38+00:00,"I recalled during first wave that hit Temasek. 'You' both still chill.. Pandemic now, we all worry... 🙏🏽",1240557279058915336,yazbanz,
2020-03-19 07:16:27+00:00,For those people... 😂😅😝 • #lego #toys #pandemic #covid_19 #yoloswag #epic #nofilter #randomthings #onfleek @Singapore https://www.instagram.com/p/B96BDC8BY4f/?igshid=16f5mnst9zpxg,1240537602685415425,ryo741,
2020-03-19 06:30:23+00:00,Sweets after lunch... a moment to escape from this pandemic situation ,1240526012699426817,eggmilk,
2020-03-19 05:37:15+00:00,#singaporeairlines is such an icon for the #Singapore brand that the government ought to see how they can keep them afloat after this pandemic,1240512637584080896,brandedSin,
2020-03-19 04:09:50+00:00,"// choose #POETRYOVERPANIC Amidst the worldwide panic and pandemic, we hope everyone is looking after, and out, for one another's health! More than ever, we believe that unity will tide us through challenging… https://www.instagram.com/p/B95rsIul8L5/?igshid=1t390wd64brew",1240490642092036096,writing_through,
2020-03-19 03:45:32+00:00,"good story on workers sleeping rough in Singapore due to Malaysia's #COVID19 lockdown. the pandemic is exposing the invisible lives of those who perform essential services for a pittance, and are most vulnerable from economic and health perspective ",1240484525810962433,LinetteLimCNA,
2020-03-19 01:06:12+00:00,"The only way to fight this pandemic, besides having simple common sense and being considerate, is to continue to stay fit and healthy, and keep your spirits up. 📸 @singaporemaven #fitnessgoals #fitforlife… https://www.instagram.com/p/B95WrO8nAmD/?igshid=1kyrtzgs7y4et",1240444426276790272,SunGoddessTarot,
2020-03-18 17:03:25+00:00,@ShekharGupta Jokes apart indeed its a China inflicted virus 🦠!! Look how rattled is world 🌍 today !! Look at Global Indices which is down by 35% and China epicenter of pandemic just 7-8 % YTD !! Any comments @1shankarsharma @porinju,1240322931672006662,rajeevmusic007,
2020-03-18 16:34:40+00:00,INITIATIVE: Starting a thread on photographers who are willing to start streaming lessons for others during covid-19 pandemic so more photographers can pick up new skills. Just reply in the format below: Mezame: http://www.twitch.tv/the_art_of_mezame Capture One and lighting basics,1240315694958297089,theartofmezame,
2020-03-18 13:44:34+00:00,The pandemic had the world's busiest international land crossing come to a halt. It's an amazing sight seeing how empty the causeway is.,1240272889451966467,kyzermutt,
2020-03-18 13:29:20+00:00,"Believe it or not the thing that is scaring me most in this pandemic is whatsapp. Dear discerning internet users, if you have friends, family members sharing things without sources and it sounds fishy, please fact check and help them? Especially family members.",1240269053551202304,sezairi,
2020-03-18 12:00:12+00:00,"Pelik betul orang flex pi travelling time pandemic 🤣 then bila positif salahkan kerajaan la, pembangkang la, jiran la, kucing la ",1240246623868841988,JustSafwan,
2020-03-18 07:19:52+00:00,"legit I have folks who don’t give two shits about the pandemic and this not only frustrates me, but honestly sending me chills.",1240176076048887809,UdiBenson,
2020-03-18 07:18:47+00:00,"I’m living in a movie-like reality, the pandemic",1240175803377188864,dafugly_prince,
2020-03-18 06:24:41+00:00,This bitch is taking advantage of the current situation of COVID-19 pandemic. Please report her to KPDNHEP. ,1240162188662210560,cookiejimz,
2020-03-18 04:32:41+00:00,"India's efforts to restrict pandemic. 🙏 Thank you @drharshvardhan ji, @narendramodi ji and all frontline and health care workers across India for all efforts you took and going to take in coming days. #भारतकेरक्षक #SavioursOfIndia – at Singapore Pools (Clementi N7)",1240134003216261120,KAPILBHATE,
2020-03-18 04:03:54+00:00,A custom-made library project~enjoy reading after the pandemic #officefurniture #officespace #libraryfurniture #officechair #officetable,1240126757648379905,FurnitureUnity,
2020-03-18 03:08:03+00:00,My bank account is pandemic!! - by ルンバ課長,1240112704997584897,yasuisg,
2020-03-18 01:02:16+00:00,"In two weeks, the death toll in America will make Italy's look like the inevitable progress of living rather than a deadly pandemic",1240081049633173504,PatchouliW,
2020-03-17 18:13:14+00:00,"But you can rearrange ‘pandemic’ into “Medic, nap!”",1239978113448030214,_PhilipRoberts,
2020-03-17 14:28:19+00:00,And this is how the pandemic can worsen. Crowds are perfect for spreading of any infection. ,1239921512041177088,theartofmezame,
2020-03-17 13:01:41+00:00,Praying for everyone’s safety. Praying for a loved one who’s trying to survive in the midst of a pandemic.😢🙏🏻🙏🏻🙏🏻,1239899711072391168,mrbranch,
2020-03-17 12:13:32+00:00,@who has become. A spectator throughout the crisis. They shld hve imposed a world wide pandemic way in early feb Mths late and the result of wide spread is the outcome of their lame actions,1239887590867619841,KassimARah,
2020-03-17 12:07:23+00:00,You must be out of your mind to think that I’m brainwashed. To say China is completely responsible for this pandemic is just pure rubbish.,1239886043962195968,privacyhalt,
2020-03-17 11:44:25+00:00,Because he read a few books on pandemic? 🤔 ,1239880263238209536,AliIsBk1,
2020-03-17 11:44:14+00:00,Not a fan of the CCP but blaming China for this pandemic thoroughly demonstrates how dumb people are. ,1239880218745036804,privacyhalt,
2020-03-17 10:12:32+00:00,"All of us have families. All of us need to eat and/or feed. If the entire country decided to think only about themselves, we wouldn't survive this pandemic.",1239857143026778112,bavaaneh,
2020-03-17 08:56:16+00:00,The thread #covid19 #Symptoms #virus #pandemic #Information #SelfIsolation,1239837947110674432,dr_ashok0124,
2020-03-17 03:25:39+00:00,I already know the entire Asian community is gon get shit on by white people after this pandemic,1239754744219832320,i_sell_shoelace,
2020-03-17 02:25:06+00:00,"Woah, the queue at the supermarket is longer than the one at the lottery booth. #covid19 #singaporepools #panicbuying #singapore #pandemic #sg",1239739509274624000,1mpzz,
2020-03-17 02:13:01+00:00,Hahaha..😂😂😂😘😘☠️👽🤘🙏👍💪✍ Kalau Problem PERANG! Captain COVID 19 PANDEMIC Lah...Ahli NUJUM Nya...Hahaha😂😂😂 😘😘🙏🙏🙏🙏🙏👍🙌👏☝✍💪💃💃🏎🚀 ⚽🏹⛳🙏Prancis Lockdown karena Corona: 'Kami Sedang Perang' ,1239736467737305088,AsiahAh12603321,
2020-03-16 23:59:02+00:00,"Stimulus for the economy (low interest rate, money injection, income tax reduction, etc.) doesn't help when people are fearful to consume due to the pandemic. Treat the disease, not the symptoms ",1239702750327230464,Foochau,
2020-03-16 22:47:11+00:00,"Hey, check out this post. https://www.undercurrentnews.com/2020/03/16/grocers-under-pressure-globally-as-pandemic-hits-restaurant-sales/ #seafood #pandemic @GAA_Aquaculture @undercur",1239684667730608129,venturefarms,
2020-03-16 17:26:49+00:00,Here he talks about the economical impact lasting atleast for a year amr the economical reasons behind not shutting down Singapore and the delicate dance we are doing between managing pandemic and economy 😢 ,1239604042201956354,RajeshChakram,
