Datetime,Text,TweetID,username,geo
2020-03-16 15:41:56+00:00,Hahaha.. Ini Dia PENAMPAKAN!! TV Channels KESOHOR Captain COVID 19 PANDEMIC dlm TUGAS news Checked Di Sebuah HOTELGoodsud passed Amazing hahaha.. 🤣🤣😘😘😍🙂🙏🙏👍🙌👏⚽🏹 ,1239577649707536385,AsiahAh12603321,
2020-03-16 15:39:14+00:00,"Let's not get started on the Olympics. If this pandemic is not curtailed by June, the Tokyo Olympics may be cancelled. The last time we cancelled this apolitical world showcase was when we went to war with the Axis Powers.",1239576970112815104,PatchouliW,
2020-03-16 15:22:55+00:00,My eyes are right now practicing social distancing. I look and I see any chance of this pandemic staying contained in America running far away anti socially.,1239572864321220608,AtiyaahDollfie,
2020-03-16 15:00:43+00:00,"But at least you didn't hatchet your pandemic response team totally, literally or otherwise.",1239567278779150336,AtiyaahDollfie,
2020-03-16 12:11:51+00:00,"We’re witnessing a forced ‘paradigm shift’ which, thanks to the sustained duration of this pandemic, will bring about real change.",1239524778353897474,homiliai,
2020-03-16 10:15:39+00:00,Not having a pandemic run rampant through it would help a lot. ,1239495539076427776,PatchouliW,
2020-03-16 09:17:03+00:00,"I am Sorry all: Yuppp!!! Itu yg SEBENARNYA.. hrs KITA Semua PIHAK Lakukan Jika MENGINGAT BAHAYA Nya, Groups Virus CORONA Itu, but JIKA Kita MENILAI Dari SEGI Rasa KEMANUSIAN Dan Sesama UMAT Beragama..MENURUT Captain COVID 19 PANDEMIC Lebih BAIK Kita Beri KESEMPATAN! &amp; di TES✍ ",1239480789735075841,AsiahAh12603321,
2020-03-16 07:10:27+00:00,"Yes masks are sold out. However people did receive masks at the beginning of the pandemic and the government advised that only those who are sick should wear it. Furthermore, when I visited polyclinics anyone who showed symptoms wear given masks.",1239448929994854401,TheScarletTiger,
2020-03-16 04:20:28+00:00,like people buying 28374 toilet paper rolls and milk wyd???????? ig that theres a pandemic gg on but please.......use that autonomous brain god has given u to thi n k,1239406152670040065,omqchristel,
2020-03-16 01:46:08+00:00,"Considering the conditions of this pandemic, especially around Europe. It make senses. Over here in Singapore, there’s no death reported from the following case.",1239367311632424961,wrath5_s,
2020-03-16 00:50:07+00:00,"I was about to make a comment about Presidents who fire pandemic teams, then I remember Trudeau had the Canadian pandemic team's back since he signed in.",1239353215130296320,AtiyaahDollfie,
2020-03-16 00:07:07+00:00,"Vintage Photos Of People Wearing Masks During The 1918 Influenza Pandemic, One Of The Deadliest Natural Disasters In Human History ",1239342394622930944,HeartBali,
2020-03-15 22:57:31+00:00,"Important thread. In the shock and awe of a pandemic, the equity implications get no bandwidth. Yet inseparable. Most critically, prognosis for the global south totally missing from the narrative. ",1239324877636526080,ben_rolfe,
2020-03-15 21:52:06+00:00,Some terms being used during this Covid 19 pandemic that will be useful to remember : 1) Social Distancing - placing a physical distance between yourself and others as a means of protection 2) Flatten the Curve -… https://www.instagram.com/p/B9xSEiBgac-/?igshid=483k0dw80nyc,1239308414888611841,AartiOlivia,
2020-03-15 18:24:42+00:00,This is for return flights not outgoing. Many people were caught outside the country when the pandemic was declared.,1239256223515414529,eviltofu,
2020-03-15 14:15:21+00:00,"Goodbye 👋 Batam ! A Well Deserved 2 Days 1 Night Holiday !.. Despite the COVID-19 Pandemic , I Really Need This Short Break To Get Away From My Current Stressful Work Schedule ! Till We… https://www.instagram.com/p/B9wdzhlBhFXCwPyN-geC5JmIA3QeTM4QgU7skc0/?igshid=ewl0g6m4vjdn",1239193472659308547,FadlyAbdulJalil,
2020-03-15 07:29:00+00:00,"Apapun umpatanmu buat pemerintah ya silahkan, tp mulai dari kondisi pandemic ini, hanya SATU pedoman, ikuti arahan komando presiden, banyak komando malah lebih chaos",1239091210255339527,VerryDDarta,
2020-03-15 04:05:07+00:00,Why we need social distancing during the virus pandemic. ,1239039901233893378,mbspinks,
2020-03-15 04:02:16+00:00,We’re Americans living in Singapore. We’ve had a lot of practice in social distancing and hand washing in the last six weeks or so. The difference between the pandemic response in Singapore and the US is glaring. Hope things get better when we return stateside in June.,1239039184783863808,Tarzia_nabi,
2020-03-15 01:54:51+00:00,@slhamlet it is as we've suspected: the pandemic is driving up demand for VR equipment. ,1239007118327308288,PatchouliW,
2020-03-14 23:59:35+00:00,Let there be sunny day and fresh air. It's in nature of NATURE to heal. Two of key issues in current treatment perhaps be lack of natural environmemt and overmedication. “Coronavirus and the Sun: a Lesson from the 1918 Influenza Pandemic” by Richard Hobday ,1238978111145775104,SanjeevSolanki_,
2020-03-14 23:36:53+00:00,praying for this #covid19 pandemic to end TOILETPAPER forever and we have bidet spray at all public toilets.,1238972397060894721,izuanv,
2020-03-14 17:17:34+00:00,I just donated to the #COVID19Fund to support @WHO's response efforts to the global #COVID19 pandemic. Join me to help combat this growing global threat to people's health and well-being: ,1238876939923918848,PrisLee1307,
2020-03-14 17:09:13+00:00,WHY THERE IS A NEED FOR MILITARY ENFORCEMENT AT A TIME OF A PANDEMIC IN THE PHILIPPINES: This FB post gives an excellent commentary https://bit.ly/3cY1vJR TL;DR It is mandated by PH law under EO 201 of 2003: The military is called to assist DOH in enforcing quarantine. #covid19,1238874841110872064,vitamincyyy,
2020-03-14 16:11:47+00:00,"Singapore has been battling with this now pandemic COVID-19 since January. They are eyeing this issue seriously. And everyday, we are being informed on the latest numbers thru WhatsApp directly from the MOH site to prevent false data. ",1238860385802842113,joccaaa17,
2020-03-14 15:51:53+00:00,"Asia has given the west three months to get ready for this pandemic, but they squandered it. #COVIDー19 #coronavirus 🤦🏻‍♀️😒",1238855376272908289,jazreeltan_,
2020-03-14 12:59:31+00:00,Everyone in my TL is a Pandemic expert .. Throwing advice to Modi a plenty at one tweet at a time!,1238811999162621953,RajeshChakram,
2020-03-14 10:27:52+00:00,"As of 03 March 2020: 65,541 patients discharged out of 80,824 Covid-19 confirmed cases! China is healing up. Let's pray and help each other out in this time of pandemic crisis so the whole world may follow suit. ",1238773835219865600,vitamincyyy,
2020-03-14 09:51:36+00:00,"White supremacy, nothing else! Haha. In fact it was only noticed and declared as a pandemic when Europe was already badly hit. Lol lol lol it’s just reality. ",1238764709391659008,fafuierice,
2020-03-14 09:27:17+00:00,India is the largest and first to evacuate its citizens from the pandemic hit countries . Much lesser cases than UK ,1238758589377835008,Abi62468908Abi,
2020-03-14 08:24:26+00:00,So glad I got my parents and myself health insurance coverages right before this insane viral crisis happened. I can rest assured my family is medically and financially covered in a time of a pandemic outbreak 🙏🏼 #healthinsurance #hospitaization #covid #philamlife #prudential,1238742774184202240,vitamincyyy,
2020-03-14 07:57:58+00:00,I'd get @KawalCOVID19 to meet @jokowi in person and slap him with the gravity and the urgency of #COVID19 pandemic reality. PS: none can help us do so. ,1238736112333381632,ainunnajib,
2020-03-14 07:22:05+00:00,It wasn’t a nasty question it was a necessary question. Trump cut the Pandemic Response Team in 2018. This is short-sighted. With increased globalisation it is inevitable that risk of pandemic increases. ,1238727081027989506,AliIsBk1,
2020-03-14 05:21:20+00:00,How to find hope during the COVID-19 pandemic. https://youtu.be/9_4u7sUenLc via @YouTube,1238696694671265792,dinxcarin,
2020-03-14 05:07:50+00:00,"Gone viral: Tfw you receive an email from every company you have ever interacted with, ever, to update you on their pandemic strategy.",1238693296982986754,champion23,
2020-03-14 03:13:02+00:00,“Pandemic” is usually excluded from insurance cover,1238664405694349313,thebendingone,
2020-03-14 02:47:17+00:00,What will happen if every country of every nation in the world begins locking down it's own territory for two weeks? Would it solve the whole pandemic problem? #Covid_19,1238657926727979009,9d9m,
2020-03-13 17:41:04+00:00,Are those pandemic cubes?,1238520466932785153,eviltofu,
2020-03-13 14:39:16+00:00,The thing about a pandemic planning and response team is that when they're busy they're REALLY busy!,1238474716685328393,AtiyaahDollfie,
2020-03-13 12:41:00+00:00,It's Friday the Thirteenth and we're in the middle of a pandemic. Let's throw a party! What could possibly go wrong? So.... see you later! 😉😁 . . . . . #djlife #pioneerdj #ravenisleven #singapore #weekend #nightlife… https://www.instagram.com/p/B9rJa-yFkws/?igshid=155yr74at48o6,1238444954168561671,DJ_IMX_OFFICIAL,
2020-03-13 12:27:59+00:00,Lmao they need a Corona virus pandemic to start cleaning the subway station lol ,1238441677284507648,qaycudi,
2020-03-13 12:02:17+00:00,So I guess its really a balance of serious consequences to instill discipline and more effort from the government to take care of its people. Mix of both to make it work. Sigh!! I hope this nCov pandemic ends soon 😭,1238435209231478784,fafuierice,
2020-03-13 11:40:33+00:00,The late LKY death anniversary and media plitz to remind of past struggles can boost campaign too as a reminder for Singaporeans during current #COVID19 crisis as anthr major global pandemic and sg impacted,1238429737610907648,KassimARah,
2020-03-13 11:31:01+00:00,"@obama @JoeBiden and how Many deaths by #H1N1, #usa and Mismanaged pandemic. No?",1238427342143279104,KassimARah,
2020-03-13 10:27:03+00:00,"FYI...due to Convid-19 declared as a pandemic by the WHO, all outdoor and sports activities has been cancel or postponed, but Sport Toto still can be proceed as usual.. stay healthy and safe gaisss...",1238411243846643717,mademiyunos,
2020-03-13 08:08:46+00:00,"Also, the West hasn’t suffered a recent pandemic the way we have. Centralised bureaucratic efforts on epidemiology instead of allowing agencies with their own agendas to run amok.",1238376443169533952,homiliai,
2020-03-13 08:06:57+00:00,So many people and businesses forced to work from home and avoid ‘close contact with people’ during this #Covid_19 pandemic. What if your job requires you to work with people closely ? #AskingForAFriend,1238375985747120133,_Balata_,
2020-03-13 07:23:59+00:00,"I am not sure if its a good timing to have an election in Singapore considering the current Covid-19 pandemic, despite the release of the new electoral boundaries today.",1238365172642615296,zeligdhilee,
2020-03-13 06:43:32+00:00,"I cannot get over that the PM of Great Britain and Northern Ireland thinks this is acceptable. Many other countries have tackled this pandemic very well and haven't given up on their most vulnerable. What, and I can't stress this enough, the actual fuck? #COVID19",1238354992626462723,DanOgunshakin,
2020-03-13 06:16:12+00:00,Isolated becuase of this pandemic. All countries are in lockdown. #WhereAreWeGoingNext #CoronavirusPandemic,1238348115591213056,ThankJed,
2020-03-13 05:11:38+00:00,"Dear G7 countries, How are your “superior health care systems” coping with #coronavirus? Sincerely, G77 countries ✌🏾 #firstworldfail #pandemic",1238331864659582976,Muloongo,
2020-03-13 02:42:43+00:00,Containment and cure has always been the game when any pandemic hits the human race as a whole. Ignoring the costs till later has always been part of the math.,1238294388930834433,PatchouliW,
2020-03-13 02:41:39+00:00,All my podcasts mention or are about the COVID-19 pandemic.,1238294122059849728,eviltofu,
2020-03-13 01:36:03+00:00,"That was before the WHO pandemic announcement, and also the curve has flattened in these two areas, so a calculated risk. It will be my last trip in a good number of months that’s for sure.",1238277612494970881,homiliai,
2020-03-13 00:59:12+00:00,If you have any mutant powers that will save the world from this pandemic now would be a great time for them to manifest.,1238268339698327552,AtiyaahDollfie,
2020-03-13 00:19:40+00:00,तयारी त Pandemic हुनैपर्थ्यो सुरुदेखी । भाइरस चै Covid-19 नै होस् बरु । स्यालको शिकार को लागि बाघ मार्ने घजाना बोक्नु ठिक ।,1238258389701914624,SantoshAKA,
2020-03-12 23:44:16+00:00,Oh SOUTH KOREA 안영 I hope @WHO adopts what South korea is doing. The new model for addressing a pandemic situation in a modern world. Grabe ang IT develoment and utilization sa SoKor. #COVID19,1238249479746306054,nasseramparna,
2020-03-12 15:52:12+00:00,Coronavirus declared as pandemic. It spreads faster like fire siah.. 🔥 ,1238130681848291333,eugeeniegaga,
2020-03-12 15:46:29+00:00,"I wholeheartedly thank you, PM Lee, your Cabinet colleagues, the Government and all the Front Line Warriors for keeping Singapore and all Singaporeans safe during this pandemic crisis. My highest salutations to you all and God bless everyone.",1238129241880842240,eelianseng,
2020-03-12 15:10:57+00:00,"Blocking paid sick leave. This is not going to help contain the pandemic. Some countries like Singapore, the government pays the companies “paid leave” while the workers serve their 14 day Stay At Home notices. ",1238120301017190401,AliIsBk1,
2020-03-12 14:56:06+00:00,A month ago it was something asian. I guess it’s a pandemic when white people are involved? especially celebrities.,1238116565591060481,lelaibulelai,
2020-03-12 14:33:31+00:00,"In situations like this,know that we have God who is in control of everything!Panicking won’t help you survive in times of Pandemic!Be calm, follow rules and be in constant prayer not just for yourself but for the rest of the world!God Bless us all🙏#COVID19 #covid19philippines",1238110881013067776,rovingsole,
2020-03-12 11:07:12+00:00,"Heard good news about China and Wuhan starting to open up and getting back to their lives, but at the same time it's been declared a world's pandemic, Italy on a lock down and USA tighten up their entrance *sigh* i… https://www.instagram.com/p/B9oZ4-Elwn2/?igshid=15hgovd1xd78e",1238058959933771776,MGirl83,
2020-03-12 10:56:19+00:00,Covid-19 needs people to practice restraint. Know that it is pandemic; so anyone can be a carrier. Practice the basics WASH HANDS before any meal. Or when you reach home. Shower.,1238056219585081345,aograi,
2020-03-12 10:22:00+00:00,"Our top priority remains the health and safety of our Tweeps, and we also have a responsibility to support our communities, those who are vulnerable, and the healthcare providers who are on the front lines of this pandemic. This is Twitter. ",1238047583706050560,danibogo,
2020-03-12 09:16:58+00:00,"Sounds great! I’m camping inSingapore now, hoping things start leveling off with the whole zombie pandemic thing.",1238031216361627651,stevenagata,
2020-03-12 08:26:11+00:00,I’m sure they earn quite a bit from this virus pandemic ,1238018436019568640,averynkh,
2020-03-12 07:38:24+00:00,@antonioguterres wonder how many institutions were mobilised by @WHO and the likes in the period leading to today to produce more ventilators more test kits. Mobilised SOP which countries need to follow once pandemic has been declared. Saddened the way reactions took place,1238006412074037249,curiousbalance,
2020-03-12 07:29:49+00:00,"How many #GBM Consultants does it take to answer your question? When we don’t know, we share our knowledge! #Mercermarshbenefits #MMB @lifeatmercer #Pandemic – at Mercer Singapore",1238004252779229184,HannahProctor14,
2020-03-12 06:36:16+00:00,Don’t even get me started on the Indonesian government’s approach to the pandemic. I strongly question anyone’s common sense who thinks there are only 34 cases in the world’s second largest city. :-/,1237990774714724352,awws,
2020-03-12 06:29:03+00:00,"If today's WHO pandemic announcement doesn't have orgs declaring stuff cancelled, I'm going to have serious moral questions for many people. That or build quarantine facilities next to seaports and airports. (not holding my breath bc people are selfish asses)",1237988962175598592,homiliai,
2020-03-12 06:00:16+00:00,"Btw, if you want to do a little bit of amateur epidemiology and (*fascinating*) data spelunking to get a grip on the COVID-19 pandemic, John Hopkins’ datasets (most authoritative imho) are right here: https://github.com/CSSEGISandData/COVID-19 Bon appetit. (Note: underreporting/undertesting bias)",1237981716108566528,awws,
2020-03-12 05:18:15+00:00,ISA Conference 2020 in Hawai’i is officially cancelled due to the global pandemic of coronavirus. A wise call. ,1237971144428244998,anindadewayanti,
2020-03-12 02:57:27+00:00,Hello @CebuPacificAir #Covid19 is considered Pandemic na. Can you just give your patrons the choice to cancel flights and convert it to travel fund instead? Or Better full refund? Rebooking is of no use now dahil pinapashoulder nyo pa rin yung fare changes. Double whammy! 😔,1237935710662848514,nasseramparna,
2020-03-12 02:04:44+00:00,COVID-19 is now a PANDEMIC??!! It should have been so A MONTH AGO!!!! 🤦🏽‍♂️🤦🏽‍♂️🤦🏽‍♂️,1237922440774377475,9d9m,
2020-03-12 01:59:24+00:00,Do note that the pre-order goods will only be available to be shipped out somewhere around mid-May 2020. This is due to the current COVID-19 pandemic. Do bear in mind that there may be further delays because of that.,1237921100865998850,HERESY_SG,
2020-03-12 01:36:34+00:00,He's just using the pandemic as an excuse to destroy the government's obligations to the American people.,1237915353868451842,AtiyaahDollfie,
2020-03-12 00:17:29+00:00,"I tweeted this yesterday morning said we’re already in Pandemic, then last night WHO confirmed CoronaVirus as a Pandemic, do you guys know what it means. This is the consequence you said it’s just a common flu!! You put the world into danger.. ",1237895454039265280,solomusafir,
2020-03-11 23:37:30+00:00,"💁‍♀️So the World Health Organisation had declared that it's now a pandemic due to the Covid-19.⠀ ⠀ I heard this on the news this morning. Strangely, I'm feeling extremely calm - not just because I'm taking care of… https://www.instagram.com/p/B9nK9bmpHtJ/?igshid=7gjcun7v0s2g",1237885389504786433,TheWofInfluence,
2020-03-11 23:28:55+00:00,Pandemic yer ,1237883230512005120,maliqueariff,
2020-03-11 23:22:32+00:00,Mongolia 🇲🇳 langsung lockdown negaranya begitu ada kasus positif pertama. Beginilah respon yang tepat menghadapi exponential growth dari #COVID19 pandemic. Pak @jokowi mohon setidaknya himbau seluruh Indonesia untuk tidak kumpul-kumpul dulu. Sebisanya di rumah saja seminggu.,1237881625221840897,ainunnajib,
2020-03-11 23:18:38+00:00,"Ayo pak @jokowi , it's never too early for drastic response to this exponential pandemic. @KawalCOVID19",1237880640269201409,ainunnajib,
2020-03-11 21:19:43+00:00,"There’s been so much attention on one word. Let me give you some other words that matter much more, and that are much more actionable. Prevention. Preparedness. Public health. Political leadership. And most of all, people. #xovid #pandemic",1237850716380614663,Pak_Liam,
2020-03-11 16:52:58+00:00,"Then what the heck does it mean ? ""Describing the situation as a pandemic does not change WHO’s assessment of the threat posed by this coronavirus. It doesn’t change what WHO is doing, and it doesn’t change what countries should do,"" ",1237783588159930368,RajeshChakram,
2020-03-11 16:43:36+00:00,Coronavirus #COVID19 is now characterized as a PANDEMIC! ,1237781229300109312,nasseramparna,
2020-03-11 15:39:06+00:00,#fear #panic #coronavirus #pandemic #travellers #airportscreening #COVID19,1237764998392250368,dr_ashok0124,
2020-03-09 14:22:01+00:00,"Okay so this is actually kinda funny. And maybe a little true. I’m not even a millennial. But let’s be real, if we’re all going to die of a global pandemic anyway, I’d just as soon do so at a 5-star hotel on the Riviera. Right? ",1237020822545420294,BernieTheBard,
2020-03-09 11:54:51+00:00,Trump is less worried about pandemic as Dem panic,1236983785452797952,Gambariste,
2020-03-09 09:55:54+00:00,"""I don't have a pandemic"" Gold. ",1236953852974264320,dogeggnoodles,
2020-03-09 01:28:10+00:00,Ultimately will the CCP model work if there are continuous imported cases from outside? Maybe lesser of evils is to have pandemic + freedom.,1236826076644397056,dan_at_unicity,
2020-03-08 17:08:12+00:00,This looks like a foregone conclusion. #COVID19 .@tansueechieh Singapore minister says coronavirus outbreak emerging as pandemic ,1236700258077294592,tansueechieh,
2020-03-08 16:46:49+00:00,"COVID-19. We are likely to see 1 million cases of COVID-19 worldwide in the next 18-24 days. Today's number is 108,000. The data coming out from Europe, Korea and Iran suggest that pandemic is very likely..@tansueechieh #COVID19 @ActuaryByDay",1236694876818821126,tansueechieh,
2020-03-08 00:51:57+00:00,"European should change their living style during this period, we know Europeans are more affectionate, they do hugging, hand shaking, cheek kiss: don’t do that now. & I still see Greta’s demonstrations event a few weeks ago, carnivals in the NL, it will lead to global pandemic",1236454576271679490,solomusafir,
2020-03-08 00:45:54+00:00,"Tragic yes, but precautionary measure against coronavirus pandemic. I think 700 series may end up running as slow service in JR West between Shin-Ōsaka and Hakata.",1236453051063390209,msmsaifullah,
2020-03-06 23:06:14+00:00,It’s hard to coordinate and implement pandemic preparedness without a well supported CDC and a Whole of Government approach to tackling the issue. ,1236065580983021568,yihyng,
2020-03-06 14:16:42+00:00,“We project that recurrent wintertime outbreaks of SARS-CoV-2 will probably occur after an initial pandemic wave.” ,1235932321716383749,spwells,
2020-03-06 09:26:51+00:00,Qn: what do you call going ahead with the olympics despite a pandemic? #kamikaze,1235859377770250252,astrosem,
2020-03-06 05:00:34+00:00,What a shitshow...this is what a once-a-century zoonotic pandemic looks like. ,1235792366016974848,spwells,
2020-03-05 14:14:20+00:00,And right now. Sweden and many Swedes are maddeningly complacent about the pandemic.,1235569337609510913,ehn,
2020-03-04 02:38:01+00:00,This on for Minister #ChanChunSing who decried our locals as a disgrace. All countries the same as normal human reaction during pandemic.,1235031717938782208,KassimARah,
2020-03-02 12:22:55+00:00,Pandemic,1234454135212134400,KassimARah,
2020-03-02 06:19:43+00:00,"Seriously, though - I don’t know of anyone else in ATX who seems to have a handle on this. I would love to do it - this pandemic is a game-changer - but the time difference means even Skyping in would be tough.",1234362731043516416,spwells,
2020-03-01 16:09:52+00:00,"Prof. Lawler, formerly of the security council, n other public health experts, this is a pandemic n cases will spike with the growing availability of test kits. He also thinks that as many as 30 to 40% of Americans will be infected. Govt should b transparent to fight the outbreak ",1234148861926498304,taro_taylor,
2020-03-01 07:44:16+00:00,WHO has insured world wide propagation by failing to alert world that a pandemic was on door step. He needed China funding.,1234021624585670658,renewableworks,
2020-03-01 04:26:06+00:00,What a Horrible people or Indonesian government shows their incompetency .. don’t you know the world is in the early stage of PANDEMIC now? I can’t believe why our people care much about money than humanity and public health #COVID19 #COVID19indonesia #coronaindonesia,1233971750926340096,solomusafir,
2020-03-01 01:23:01+00:00,"it was my turn to pick our spot for our monthly communion & fellowship, nvm the covid19 pandemic, we're getting ourselves loaded with turmeric &amp; cumin💢💥 established since 1908, it's been around longer than my great… https://www.instagram.com/p/B9LCShwnUnf/?igshid=1ehdduqxfm752",1233925676866113538,3rdeye_blind,
