Datetime,Text,TweetID,username,geo
2020-05-29 11:37:29+00:00,"Dagdag bawas modus to the highest level! Walang pinapalampas, pati panahon ng pandemic umiiral pa rin!🤪🙄😜 ",1266332833368256522,kcgarcia11,
2020-05-29 11:35:44+00:00,"#US #mortgage #rates have again slumped to a new record low for the third time since March, when the #coronavirus #pandemic began to whiplash #globalmarkets. #peermagic #magic #privateequity #VC #USmortgage",1266332391783780352,peermagic,
2020-05-29 11:29:52+00:00,"Chaos, death by pandemic, and civil war! How can one butt head do so much harm in less than 4 years? OK there's been an underlying problem but such a shit show! It's almost like it's 1830 again! ",1266330916365824002,chav_ez,
2020-05-29 11:21:03+00:00,"gotta say, missing the times where we can be freely out & about. we took advantage of that and now this pandemic shows how restricted things are.",1266328696773697541,TengkuNas_,
2020-05-29 11:13:56+00:00,"I missed eating snacks from Japan , every year my brother and sister-in-law would travel to Japan and got me a big bags of assorted snacks . This year , with this pandemic going on , travelling don’t seems like an… https://www.instagram.com/p/CAxQqF5Hpns/?igshid=1dvetwrdqmffh",1266326908687593473,chewyjas,
2020-05-29 11:01:04+00:00,"New York Fed chief John Williams said he expects inflation to run below where it’s been the past year or two, even with Fed moves to support the economy during the pandemic https://www.wsj.com/articles/williams-doesnt-see-feds-support-of-economy-causing-inflation-surge-11590687824 via @WSJ",1266323667786428416,lxvresearch,
2020-05-29 11:01:03+00:00,"We'll support in the best way we can! The global pandemic seems to be affecting their regulatory registration timelines, but hopefully it will ease soon.",1266323665991405569,FujimaruNichols,
2020-05-29 10:57:34+00:00,"Don't be busy, be productive! with #trumkart make the most out of this pandemic &amp; earn money from your home through the combination of #blockchain &amp; #affiliatemarketing. 👉https://bit.ly/2VlRcaB #earnings #earnmoneyonline #onlinemoney #MLM #WFH #cryptocurrency #financialfreedom",1266322789415284736,trumkartpvtltd,
2020-05-29 10:47:32+00:00,*slowly crawling out from my den once the pandemic subsides* https://www.instagram.com/p/CAxNpP6l9Ut/?igshid=19c3z0zcm0fyo,1266320262489952262,Alexxyonq,
2020-05-29 10:46:50+00:00,Visit http://ggtspl.com to see a full list of our services and portfolio. Comment below if you would like us to take your business into the next level. #pandemic #portfolio #sales #ecommerce #blockchain #AI #virtualreality #datascience #technology #solutions,1266320085750292480,ggtspl,
2020-05-29 10:40:09+00:00,Pandemic has been managed exceptionally sell in Taiwan but there is no way Taiwan can ignore China - let’s hope for peaceful talks rather than a permanent US messing around the world,1266318407059664896,nickts68,
2020-05-29 10:29:03+00:00,"Respect uski ki jati hai jo resepect ke qabil hota hai, ye is qabil hai hi nahi Sonu Sood, Akbar owaisi deserve respect along with those Muslims who distributed food to Poor's and help them in pandemic",1266315610142564355,Hkinayti,
2020-05-29 10:27:58+00:00,"@UIFBenefits Good day, how does one get assistance or feedback regarding a UIF claim that was submitted before the covid-19 pandemic, I have emailed 2 representatives regarding this issue and i’m still not getting feedback regarding my claim. Please help.",1266315337714278400,mkhizeD,
2020-05-29 10:27:30+00:00,"i cant decide if i enjoy being so detached from my friends during this pandemic. i spend hours on youtube , tiktok&amp;netflix, not replying to texts &amp; not picking up calls. it's so nice to just do my own thing in my own bubble. it's comforting yet when i think about it i feel uneasy",1266315219942268930,_ambzr,
2020-05-29 10:27:29+00:00,Dia release trailer time pandemic maybe dorang confident. Tapi arc marley ni memang panjang maybe dia pecah dua part.,1266315216247066624,realfahan,
2020-05-29 10:26:48+00:00,Seriously sudah2la tu. Negara kita tengah alami pandemic covid ni hang nak sibuk buat kacau bilau. Ketepikanlah agenda politik tu fokus bantu rakyat. Biarlah Muhyiddin jadi PM sampai habis penggal lepas tu buatla pilihanraya. Kau yang letak jawatan lepas tu sibuk nak jd PM balik,1266315046449147905,umierosely,
2020-05-29 10:21:26+00:00,Companies strive to assemble ad messages in response to the pandemic https://www.wsj.com/articles/in-these-uncertain-times-coronavirus-ads-strike-some-repetitive-notes-11587355261 via @WSJ,1266313695828705280,rchewgum,
2020-05-29 10:16:22+00:00,Bird Nests For The Family ❤️ During this pandemic period plus hot and humid weather. It is good to double-boil bird nests for your loved ones. Bird’s Nest not just a beauty food but also has high glycoprotein… https://www.instagram.com/p/CAxKFB2nKHG/?igshid=1kdgizxnft8ln,1266312420416503809,jennylee_2012,
2020-05-29 10:07:10+00:00,#Airbus develops solution for #airlines to use their widebody aircraft for pure #cargo operations during the #COVID19 pandemic: https://airbus.com/newsroom/press-releases/en/2020/04/airbus-develops-solution-for-airlines-to-use-their-widebody-aircraft-for-pure-cargo-operations-during-the-covid19-pandemic.html via @Airbus @AirbusPRESS #Aerospace #Logistics #CovidResponse #Solutions,1266310104351006720,Lochoffs,
2020-05-29 10:04:18+00:00,A comparison of COVID with cybersecurity shows how we can learn from the response to the COVID pandemic lessons about #cybersecurity. #Security https://okt.to/pQFLP4,1266309382146527232,GlobalSignAPAC,
2020-05-29 10:01:34+00:00,"Poised for leap before pandemic, women's cricket limps into future https://cna.asia/2ZLonbi",1266308693613662209,ChannelNewsAsia,
2020-05-29 09:57:15+00:00,Sekarang dah jadi career yg high demand !! Boleh PM saya untuk maklumat lanjut Shah E Yong 0167228574 11 Jobs That Will Be High In Demand In Malaysia After The COVID-19 Pandemic |,1266307610929577985,shahyong,
2020-05-29 09:46:01+00:00,Big businesses that used the opportunity to buyback their own stocks due to reduced taxes earlier in the trump presidency instead of preparing for a pandemic do not deserve a bailout. ,1266304781703757824,_ahxiang,
2020-05-29 09:40:56+00:00,"Great to be part of a @ciscoapac panel celebrating our service to the public sector during the pandemic. The topic? Acceleration to digital and cloud from government, healthcare, education and justice departments. Thanks @caroachcisco @clarencebarboza for including me.",1266303501367250944,RumaBala,
2020-05-29 09:39:59+00:00,"COPING 19: Tip #19 SHARE YOUR THOUGHTS Getting through a pandemic like this can be hard, and for some of us facing this for the first time, it can be harder. Always remember to reach out to your family, a friend or a trusted colleague if you are stressed or anxious.",1266303265244712960,HavasAPAC,
2020-05-29 09:38:11+00:00,Thank you @TechCollectiv3 for featuring @MoovazNow as one of the four emerging logistics tech start-ups in Southeast Asia! Check out how emerging logistics tech start-ups innovate to keep up with the demands of the customers during the pandemic. ,1266302809676247042,MoovazNow,
2020-05-29 09:30:19+00:00,"During your FDW’s employment, you are responsible to send her for a medical screening every six months. Especially now that there is a global pandemic like COVID-19. Read more: https://buff.ly/2OaND6r #FDW #maidinsurance #insurancemarketSG #healthcare",1266300831957041157,InsuranceMktSG,
2020-05-29 09:16:52+00:00,"When the whole world is locked down because of a pandemic, we can only travel through photographs or videos, smiling to ourselves re-imagining the situation at that time. Oh, how beautiful. ",1266297447380168704,FebyEmani,
2020-05-29 09:12:21+00:00,"Was reading few article regarding covid 19 pandemic for my assignment. Then i found this on Straits http://Times.com for asia. ""pls abide by the gov SOP, avoid crowded places, last but not least ONLY GO OUT WHEN NECESSARY"" -PM Malaysia.",1266296311218728963,Nrflzhh_,
2020-05-29 09:09:32+00:00,"How we're turning disruption into innovation at UAB Curt Carver, CIO of the University of Alabama at Birmingham, shares how his IT organization is using the disruption caused by the COVID-19 pandemic to speed up innovation ",1266295601232097281,anirbanmukh,
2020-05-29 09:03:51+00:00,"India: A Post-Pandemic Take. India’s pain from and response to COVID-19 have been severe and the effects will likely last for months. Here, we analyze the medium-term changes to the Indian economy from the pandemic outbreak. Full Article: https://bit.ly/3cfsBdG",1266294169644879873,ContinuumDaily,
2020-05-29 09:00:36+00:00,"Are YOU up for the challenge? On May 30-31, join @NASA, @JAXA_en, @ESA, and @CNES for the global #SpaceApps virtual hackathon using Earth observation data to develop solutions to issues related to the COVID-19 pandemic. Sign up here: https://covid19.spaceappschallenge.org/",1266293353768816641,RedWhiteBlueDot,
2020-05-29 08:43:25+00:00,Hey #WritingCommunity I just wrote a new #medium #post detailing how florists in the local scene are supporting one another through this #pandemic. Give it a read if you're interested and hopefully you'll feel as #inspired as I am! #writerslift,1266289030200610820,mingqianwrites,
2020-05-29 08:40:03+00:00,"Hey #WritingCommunity I noticed something peculiar about the way #florists in the local scene here are supporting one another through the pandemic. Read my latest #medium article and hopefully, you'll be as inspired as I am! Have a great day! :) https://link.medium.com/7YdxRwKvS6",1266288181806108672,mingqianwrites,
2020-05-29 08:38:04+00:00,"Doubt that the people that were effected with the pandemic that suffered from job losses, business were forced to shut down can wait. The government need to pass laws for the people asap. Not just by ""seru"" lol. They're the government after all",1266287680393842689,FractalCap,
2020-05-29 08:37:47+00:00,"Way to be racist about it. ""If the western press doesn't report it, it didn't happen""? Do you have problems with the concept of object permanence? Just because you can't see the moon at noon, means it doesn't exist? Ah, so that's why you lot botched the pandemic response",1266287608616767493,dumplings_r_yum,
2020-05-29 08:30:05+00:00,Imagine in the middle of a pandemic someone worried about which side of the fence people were born. This faceless catfish,1266285673322954754,Protymes,
2020-05-29 08:19:27+00:00,"The #COVID19 shock eroded resistance to change. The #pandemic has raised awareness on the need for #agility, and the need to respond to changing events fast. https://itknowledgezone.com/how-covid-19-will-change-business-culture-forever/?utm_source=Twitter&amp;utm_medium=Social%20Media&amp;utm_campaign=itkz%20social #IT #ITduringCovid #ITleadership #cios #cxo #enterprises #businessagility #agiletransformation",1266282995532435456,ITKnowledgeZone,
2020-05-29 08:16:24+00:00,"Bukalapak, Grab team up to support Indonesian kiosks amid pandemic ",1266282227257585668,williswee,
2020-05-29 08:14:03+00:00,78% feels more stress in working during a pandemic http://dlvr.it/RXZT88 #singapore #business #italy,1266281638092107776,italiasingapore,
2020-05-29 08:06:03+00:00,The @TechBurstAsia podcast spoke to @asiatechpod host @GrahamDBrown abt how #Tech vendors must transform their Marketing &amp; Comms in the post #pandemic world. leverage marketing and comms. . It’s about turning your employees from assets into advocates. https://buff.ly/2VukOnh,1266279622880051205,CRASingapore,
2020-05-29 07:59:42+00:00,"This is cheering from @EdwardGLuce ""there are unmistakable signs that older voters are turned off by Mr Trump’s pandemic record. In late February, Mr Trump had a double-digit lead over Mr Biden among voters aged over 65. Average recent polls showed Mr Biden 10 points ahead."" ",1266278025500352514,jamescrabtree,
2020-05-29 07:35:05+00:00,"WRO Egypt has trained children and youth online since last summer: Virtual training is not just a tool during a pandemic, but a way to give more kids access to robotics: https://wro-association.org/news/detail/wro-egypt-using-virtual-robotics-toolkit-to-reach-more-kids #WRO2020 #legoeducation #junipernetworks #VRT @IdeasGym",1266271830244945920,WROOfficial,
2020-05-29 07:26:34+00:00,"""Telecommuting has opened the door to opportunities that would have been unthinkable to me before."" For some, the pandemic is forcing societal changes that are making their lives much easier: ",1266269687295270913,sapsonicinc,
2020-05-29 07:26:32+00:00,14 books to help you picture life after the pandemic: ,1266269678227189761,sapsonicinc,
2020-05-29 07:24:26+00:00,"Kenapa la Songket Macam Tu ,🤦‍♂️ takpelah simpan buat moment Pandemic Eid2020 🌙 ",1266269149375852544,zulhalimramli,
2020-05-29 07:10:58+00:00,Having gathering with your friends and then posting it online during this pandemic doesn’t make you cooler or braver.,1266265760814383110,naadds,
2020-05-29 07:09:37+00:00,"A personal essay with powerful, raw emotions that I highly recommend to my #writingcommunity “It’s ok to feel anger during a global pandemic. Do you know why? Because a global pandemic is a pretty hard core trigger for unresolved trauma.” — @drkylieharris",1266265421503557633,mingqianwrites,
2020-05-29 06:57:55+00:00,the first month in there was a covid 19 issue and Australia wildfire with Trump going to a ww3 and then we were stuck t home because of the pandemic and black people are being killed for ALLEGEDLY having drugs or sumn like that I'm sick and tired of all of this 2020 is disgusting,1266262477391581184,imsitinurula,
2020-05-29 06:57:33+00:00,"As India battles the pandemic coupled with an economic crisis that has its roots in the Modi 1.0 government, it is clear that the next few months will shape the country’s future. At this critical time, all Indians need to be part of a collective effort directed towards recovery.",1266262388099002368,varunnahar,
2020-05-29 06:55:26+00:00,So appalled that they did this to you - as an adult woman I was exceptionally snarky everytime this happened to me and it’s always the first thing they assume at A&E even in these pandemic times. I hate them for saying such horrible unprofessional things to young girls. Hugs.,1266261853518192643,tash_aam,
2020-05-29 06:51:15+00:00,Techstars community leader on how to save yourself from the gloominess of a pandemic ,1266260801360293891,mohanbelani,
2020-05-29 06:44:40+00:00,"The pandemic has affected absolutely the whole world, the economy, small business and startups have not been left behind. Coronavirus startups: who lost and who gained? Check out our social networks! ",1266259145117757444,BloomzedInfo,
2020-05-29 06:43:16+00:00,"What about the frontliners who have been working tirelessly round the clock, especially those working at hospitals? Some even have to sacrifice their rest days to support the manpower crunch to cope with this pandemic while the rest of us are task with one thing - Stay At Home.",1266258790736789512,itzdjman,
2020-05-29 06:39:14+00:00,Bit late in replying. Nature blooming during the pandemic is my theme. ,1266257775174139905,FogartyClimate,
2020-05-29 06:36:09+00:00,What are folk devils and moral entrepreneurs? Our IPS researchers Mathew Mathews and Shamil Zainuddin write about the need to guard against certain groups being demonised and stigmatised during the #COVID19 pandemic. Read more here: https://nus.edu/36FGUXP,1266256999597043714,IPS_sg,
2020-05-29 06:33:27+00:00,Easier access to funds for young people planning community projects during Covid-19 pandemic ,1266256319654146048,STcom,
2020-05-29 06:28:51+00:00,Truly dreadful. Even Private Eye (MD's pandemic update) finds it no joking matter.,1266255162932256768,ecn_staples,
2020-05-29 06:27:01+00:00,covid19 impact : As per Mckinsey the pandemic has accelerated the shift to digital banking by two years. ,1266254700522827781,agrawalamit,
2020-05-29 06:22:34+00:00,Setuju. Mau sampai kapan kita terus di kurung di rumah. Yg ada malah mati kelaparan. Penerapan kebijakan new normal mencegah PHK dan resesi. Kita semua gk tahu sampai kapan pandemic ini berakhir. Mau gk mau kita harus menyesuaikan dengan keadaan,1266253583529332736,Fandy_Harun95,
2020-05-29 06:18:49+00:00,@BontlefeelaB r we getting our next inks after this pandemic?,1266252637243990016,JackyMangs,
2020-05-29 06:18:15+00:00,"Jennifer Yang Hui, wrote that crowdsourcing during the COVID-19 pandemic not only encourages innovation but could potentially build public trust, enabling leaders to demonstrate that they value and desire citizen input. ",1266252496671961090,RSIS_NTU,
2020-05-29 06:13:22+00:00,#Covid19: Preparing a robust #cashflow forecast in uncertain times #Businesses currently find themselves in unchartered waters as the Covid-19 #pandemic situation continues to persist. Review existing #businessplans and cash flow forecasts in a #crisis: https://www.bakertilly.sg/english/insights,1266251267782832129,BakerTillySG,
2020-05-29 06:00:02+00:00,"“I was moderately stressed before the pandemic,” she said in a recent interview. “Then when the pandemic hit, it was almost more because we had no outside sources to rely on.” ",1266247911861444609,nsoffe,
2020-05-29 06:00:00+00:00,"The COVID-19 pandemic has meant this year's festivals cannot go ahead – so instead, they are teaming up for a 10-day online celebration. ",1266247901946056711,YahooSG,
2020-05-29 05:59:02+00:00,"#LV has officially lost it with the price increase in the middle of a pandemic, and this bag too... Bernard, Delphine, or Michael, Louis Vuitton is not Chanel and will never be; it will always be utilitarian so why not work on it instead of chasing for smthng it’s not?? #Pont9",1266247660819771394,faradisation,
2020-05-29 05:58:41+00:00,"On 26 May 2020, Deputy Prime Minister and Minister for Finance Mr Heng Swee Keat announced another supplementary Budget named Fortitude Budget to further help businesses and workers tackle the challenges brought by COVID-19 pandemic. https://bit.ly/3etI0IV",1266247573485940741,BDO_Singapore,
2020-05-29 05:50:38+00:00,"If we can go through and adapt this Pandemic, we can go through anything. Repeat x1000",1266245544055205889,FareedRamli,
2020-05-29 05:45:28+00:00,"*looks at TL* Racial violence, burning buildings, political nut jobs and more pandemic doom and gloom. Yeah I’m just gonna continue staying in my fandom tags.",1266244246584979458,Clear_Liqueur,
2020-05-29 05:44:57+00:00,"Seafood industry relies on Restaurant and Food service. The pandemic and lockdown, with restaurants struggling has crippling effects on the Seafood industry. #agtech #agx360 #seafood #mrx https://politi.co/3eiDcpM via @politico",1266244115789840385,PAgx360,
2020-05-29 05:44:56+00:00,IMF says pandemic may skew economic data and cause them to be less accurate @yennee_lee,1266244110337232896,TedKempCNBC,
2020-05-29 05:37:29+00:00,"The pandemic reinforces the importance on sustainability in the ag sectors. However, it takes supply chain overhaul and evolution to improve food and produce sustainability. Efforts are underway. #meat #agtech #agx360 #mrx",1266242234904506378,PAgx360,
2020-05-29 05:30:22+00:00,imagine being madison beer and complaining about her pretty privilege in the middle of a PANDEMIC and a crisis of RACIST POLICE BRUTALITY,1266240445996097538,sapphicnez,
2020-05-29 05:27:43+00:00,ya allah pls give me the motivation to go through all the challenges that I have to face during this pandemic especially with school. Let me graduate with a good gpa and hopefully I can go poly,1266239779022106625,dianumairaA,
2020-05-29 05:16:28+00:00,This pandemic has me taking vits seriously.,1266236946042335237,K_RhysM,
2020-05-29 05:06:19+00:00,Understanding VC cycles for post-pandemic success https://bit.ly/2TC0nDr #FinanceCommunity #VentureCapitalist,1266234394248790017,MichaelZimmel,
2020-05-29 05:03:27+00:00,How will businesses emerge triumphant #post-pandemic? By going digital. The Singapore Government has allocated S$500 million to support businesses to kickstart and accelerate #DX journeys. http://ow.ly/6Kxu50zTb7n,1266233670748082176,CommvaultAPJ,
2020-05-29 05:00:07+00:00,Nobody was interested in so-called “pandemic insurance” before 2020. Will coronavirus lead it to become the new norm? - ITA- #business #corporateinsurance #pandemicinsurance,1266232832315273216,skyhigh_vip,
2020-05-29 04:58:54+00:00,"ISEAS Commentary by Ian Storey - The Thai military has been affected by the Covid-19 pandemic. Thanks to Chinese largesse, however, it will be able to secure the military kit it wants. #thailand #thaimilitary #china #covid19",1266232525887700992,ISEAS,
2020-05-29 04:57:28+00:00,"We live in a time where even when there’s a pandemic happening, instead of showing kindness and love we show violence and hate.",1266232165366329344,princesslunz,
2020-05-29 04:54:46+00:00,"You think they can find another job easily? No, not in this pandemic. They have mouth to feed.",1266231485704450048,npanggagas,
2020-05-29 04:38:08+00:00,Thank u son no we can’t be rich during a pandemic when others are not ok,1266227299961106433,pozcandy,
2020-05-29 04:30:01+00:00,After 3 months of lockdown... it baffles me that people still do not understand what a pandemic is and the outcome of social interactions.,1266225258815557634,chillilemonwine,
2020-05-29 04:30:00+00:00,An estimated 15 billion doses of the vaccine would be needed to halt the pandemic. ,1266225252671148032,YahooSG,
2020-05-29 04:25:00+00:00,America has been proven to be a failed police state. - a genocidal pandemic control - relentlessly looting of the poor and enrich the rich during lockdown - rampant police brutality - refusal of arresting murderers is causing popular uprisings ,1266223995851952128,Gam38274493,
2020-05-29 04:24:52+00:00,"Taking advantage of a pandemic and holding an election in the midst of chaos and uncertainty. Credit where its due, the white men know the game well. ",1266223961580306433,FbombGoesBoom,
2020-05-29 04:21:14+00:00,"Blue Impulse (The 11th squadron), the aerobatic demonstration team of the Japanese Air Self-Defence Force (JASDF) flew over Tokyo to show appreciation for healthcare workers amid the COVID19 pandemic. ",1266223047490428929,ayaelectro,
2020-05-29 04:20:40+00:00,Will ageism get worse in the post-pandemic workplace? https://str.sg/Jdec,1266222907111297027,STopinion,
2020-05-29 04:19:34+00:00,"Los Angeles union, joined by 'Pandemic Pig', demands meatpacking plant closure https://cna.asia/3ceTIFK",1266222629637111809,ChannelNewsAsia,
2020-05-29 04:12:03+00:00,"Finally. Come Mon 1/6/20 Singapore's Circuit Breaker+Lockdown will be Officially Unlocked !! Everyone goes back to Work, Schools are re-opened and everything will be back 2normal. Singapore, we've done ourselves proud, we United+Conquered the Pandemic Challenge. We Did it !👍👏🇸🇬 ",1266220737292939266,MichelleNg2502,
2020-05-29 04:10:43+00:00,"The government is formulating a system of accreditation that would allow barber shops to reopen even amid the community quarantine being implemented due to the COVID-19 pandemic, presidential spokesperson Harry Roque said Friday. ",1266220400364580866,iskonglasalista,
2020-05-29 04:05:00+00:00,"India tops China in fintech funding as pandemic, US trade war dim prospects ",1266218962968358912,alyosha19,
2020-05-29 04:00:04+00:00,"The pandemic’s toll can easily overwhelm people, but emotional intelligence expert Daniel Goleman suggests a way to overcome it. #KFCOVID19 #leadership #emotionalintelligence #stress #wellbeing https://lnkd.in/gzaZQgk",1266217722892832768,torbjorngk,
2020-05-29 04:00:03+00:00,Effective governance is Auckland's strong suit - one it and New Zealand at large have played to contain the coronavirus pandemic. There's a lesson here for other citites. ,1266217716790071296,Whedrich,
2020-05-29 04:00:03+00:00,"In our current world, the pandemic has shifted how the world functions in business. How does maintaining one's mental health link to sustaining a business? #selfcare #mindfulness #mentalhealth",1266217716400058368,Shima__A,
2020-05-29 04:00:03+00:00,Effective governance is Auckland's strong suit - one it and New Zealand at large have played to contain the coronavirus pandemic. There's a lesson here for other citites. https://lnkd.in/g-Jdbcw,1266217716165169153,Whedrich,
2020-05-29 04:00:01+00:00,In my heart when the mosque is close due to the pandemic ,1266217708733050882,irfad28,
2020-05-29 03:56:02+00:00,"educated enough to get into the police force, not enough to remember their place. just because they’re police, doesn’t give them the right to end anybody’s lives. these people are more deadly than this fucking pandemic. ",1266216703966408704,nadzirawrh,
2020-05-29 03:45:01+00:00,Navigating business through chaotic times in Singapore: five ways to evolve in a post-pandemic world https://buff.ly/3dWM04w,1266213934203392000,PeterJustinYu,
2020-05-29 03:23:45+00:00,Artis blm mapan sudah pindah berbisbis ..semua bisnis punya masalah ... mereka harus belajar dari mana Rafi Ahmad dan Ruben Onsu...meskipun sudah punya bisnis besar tapi masih trima job Artis b..bukti nya saat pandemic ini perusahaan bisa survive karna masih Ada job artis.,1266208583483445254,GrithaF,
2020-05-29 03:22:19+00:00,Workers' Party calls for ground rules on election campaigning during Covid-19 pandemic to be published promptly ,1266208221816958978,Chinesepop,
2020-05-29 03:12:27+00:00,"I’m just an asian not living in the US. But from what i’ve seen, plus what i’ve experienced here, this is the worst possible time. We’re in the middle of a recession and a pandemic, and people are burning places and using the same kinds of brutality that they’re speaking against.",1266205737136484354,TheMostenire,
