Datetime,Text,TweetID,username,geo
2020-03-24 11:52:52+00:00,https://www.straitstimes.com/singapore/health/all-entertainment-venues-in-singapore-to-close-gatherings-outside-work-and-school?xtor=CS3-18&amp;utm_source=STiPhone&amp;utm_medium=share&amp;utm_term=2020-03-24%2019%3A03%3A50 #COVID19 #SocialDistancing #CoronavirusPandemic #StayHealthy,1242419104947916800,LarissaTan,
2020-03-24 10:39:37+00:00,"During this Covid-19, we practice social distancing. Someone tell @theandstatement pls. #SocialDistancing #COVID19 #beachquarantine #bashatthebeach #wrestlelife – at Siloso Beach",1242400669811634176,AlexisLeeXY,
2020-03-24 10:13:54+00:00,Social distancing #flowershot @Botanic Gardens MRT Station https://www.instagram.com/p/B-HNVGsHYUo/?igshid=qgjp7rv4n6b8,1242394199598804992,reviveramesh,
2020-03-24 09:55:54+00:00,Semoga postingan ini bisa memberikan informasi dan penjelasan yang berguna buat kita semua. Credit by : diadiawidia . #stayhome #stayhealthy #dirumahaja #dirumahsaja #socialdistancing… https://www.instagram.com/p/B-HLRUkFx_N8tm3S_8gpSjCM7qLSKUdppNEpsQ0/?igshid=zy6csyxruzvs,1242389671151194112,reretuit,
2020-03-24 07:22:27+00:00,Dapat may social distancing. Minimum contact.,1242351053737095168,DorrisRivero,
2020-03-24 06:08:03+00:00,Take a run through the jungle - CCR #exercise #wellness #nature #mentalhealth #bewell #socialdistancing @Singapore Quarry https://www.instagram.com/p/B-Gw9GdA65_/?igshid=wferirv062a6,1242332327969198081,PeterGCuthbert,
2020-03-24 05:10:39+00:00,"i really don't understand how they want us to do social distancing in preschools/childcare - specifically those that share bays. sure, we can do it during assembly or lunchtime but what about the rest of the days",1242317884673511424,ttaekoyaki,
2020-03-24 04:55:13+00:00,The elevators practice #socialdistancing #singapore🇸🇬 @Orchard Road https://www.instagram.com/p/B-Go3QIF-1zJltQ_sGCC08YocUVGQ2f9YTX3Hg0/?igshid=btqc9hhj9981,1242314002757230593,Ms_JNo,
2020-03-24 04:23:22+00:00,In case there were any lingering doubts about what #SocialDistancing means https://www.facebook.com/523656092/posts/10157990813236093/?d=n,1242305987161149441,homiliai,
2020-03-24 04:18:58+00:00,Social distancing bird. 📸 @singaporemaven . . . #singapore #naturephotogeaphy #wildlifephotography #wildlifeconservation #sungeibulohwetlandreserve #seeninsingapore #scenesofsingapore #singaporemaven… https://www.instagram.com/p/B-GktjMHMNw/?igshid=1sep1bh0u62xn,1242304876056641537,SunGoddessTarot,
2020-03-24 03:54:08+00:00,"I live for this social distancing, I can finally spread my legs.",1242298629378822145,ItsJustHadi,
2020-03-24 03:38:28+00:00,I’m so mad that I didn’t bring my switch with me to kill time during social distancing. RIP.,1242294686078734337,AleyaGoomba,
2020-03-24 03:29:41+00:00,Social distancing day 4 #geylangtakeover @The Panic Room SG https://www.instagram.com/p/B-GfEnxHuds/?igshid=1lhy49z13m7xq,1242292473554223105,ThePanicRoom_SG,
2020-03-24 03:17:38+00:00,Some are not taking social distancing seriously.... even in the hospital awaiting consultations. 😥,1242289443442233344,AliIsBk1,
2020-03-24 01:16:24+00:00,"Although it's the right message, the varacity with which some celebrities and sportspeople criticise ordinary folks re staying at home / social distancing, they seem unable to grasp that not everyone had a stash of cash to fall back on while luxuriating in a gated mansion.",1242258934989119489,Gulasahi,
2020-03-24 01:09:11+00:00,"Yang bikin ini utk social distancing, ngerti desain 👌🏼. Sekali lihat, langsung ngerti apa maksudnya, dan sesuai peruntukkannya. – at Red Ginger",1242257116796051457,borryshasian,
2020-03-24 01:06:04+00:00,Life goes on - with some changes. #Singapore #COVIDー19 #COVID19 #SocialDistancing #streetphotography @sporeMOH #coronavirus – at Chong Boon Market &amp; Food Centre,1242256331806928897,LimWuiLiang,
2020-03-24 00:44:24+00:00,"Social distancing measures are steps we can all take to reduce social interaction between all people. This will help to reduce the transmission of Covid-19 coronavirus. Stay home, avoid large gatherings, wash hands… https://www.instagram.com/p/B-GMKHpHh07/?igshid=19wfedmazu3jt",1242250881640189954,bernardlim108,
2020-03-24 00:34:20+00:00,"How do you practice social distancing on a train that is still full? The more that companies lack foresight, the more the general public will pay for it. There is (tenuous) causation there I think. Or maybe strong, far but strong.",1242248348460957697,AchingVimes,
2020-03-23 23:59:03+00:00,"This is brilliant communication. If you are still unclear why social distancing is critical, please watch this 1m interview and then stay home, even though it's difficult and annoying. #SocialDistancingNow",1242239467651387393,bkealey,
2020-03-23 22:32:09+00:00,"Sooooo. The govt were saying stuff about social distancing, not to have gathering more than 250 people. Okay, so.... Do ya'll limit 250 people in the mrt as well or what?",1242217600097988608,theshowoff20,
2020-03-23 22:32:08+00:00,Social Distancing is not enforced in #Singapore,1242217594616070144,amitmathur31,
2020-03-23 15:42:00+00:00,"This is so surreal. While the Maxwell Food Centre had put markers on seats (like some other makan places) for the purpose #SocialDistancing, with no tourists and people working from home… https://www.instagram.com/p/B-FOFVZls4SIfwPBKDNuR01bU2PkIRUOmmkPVc0/?igshid=1f7k6r3a128e0",1242114379111378946,kapitan809,
2020-03-23 15:12:26+00:00,I’m single because of social distancing.,1242106939313516544,ItsJustHadi,
2020-03-23 14:54:35+00:00,"Because when you are #SocialDistancing, you make granola! ",1242102450242215936,ngogirldiaries,
2020-03-23 14:27:30+00:00,Bahasa Jawa untuk: VIRUS = Krumo LOCKDOWN = Ndhekem SOCIAL DISTANCING = Ngadoh / Minggat PANDEMIK = Pageblug HAND SANITIZER = Nggo Wijik WORK FROM HOME = Nguplek,1242095632828907520,tasikshyadu,
2020-03-23 12:55:41+00:00,Social distancing made easy in Singapore shops. #coronavirussingapore,1242072524248068102,lulubellrunner,
2020-03-23 12:55:10+00:00,"No one is denying the impact and your intention as well Just a request not to make country panic for future assumptions, instead tweet some information, advises thst will help people to stay at home and follow social distancing This will add value 👌",1242072395638116352,stalathi,
2020-03-23 11:15:28+00:00,"Did you know? We also offer mailing ✉️📦📬 For those who are practicing #socialdistancing right now, you can shop right in the comfort of your own home! Simply browse our pics here on IG, our Carousell shops @… https://www.instagram.com/p/B-EulLIFGm6/?igshid=56reivq9gea7",1242047304632340483,happypinshop,
2020-03-23 11:08:08+00:00,Social distancing for tahu telor. ,1242045461881475072,thegrumpytez,
2020-03-23 10:02:21+00:00,❎ SOCIAL DISTANCING ✅ S O C I A L D I S T A N C I N G,1242028903507431426,kyzermutt,
2020-03-23 10:02:01+00:00,Does anyone who hasn’t arrived from Mars yesterday really not understand #SocialDistancing ??? If you don’t your carer can explain it to you....@rachelshabi stop scoring pathetic political points,1242028819881623552,degsy380,
2020-03-23 08:59:31+00:00,It’s not just the government response. I called my boyfriend today in Oregon and he had gone for a walk in his village and has standing talking to the local bar man from outside the bar. They need to be explicit social distancing = don’t got out except for groceries!,1242013094173233153,traintheteacher,
2020-03-23 08:19:51+00:00,"Banished and imprisoned in my room, so that the war room has enough room for social distancing... 😅 – at Msc Law",1242003109917810688,MichaelSChia,
2020-03-23 08:18:42+00:00,"teachers be telling us to practice social distancing, but i just can't social distance myself away from you",1242002820250750976,danialmahadii,
2020-03-23 07:11:08+00:00,"Here in Singapore, we’ve been told 1 meter (just over 3ft). Why isn’t there a global standard for social distancing @WHO @sporeMOH ?",1241985819079929856,NancyCNBC,
2020-03-23 06:12:08+00:00,Stil no social.distancing.. good luck wherever this jam gathering at,1241970971231154183,mixdblood69,
2020-03-23 05:22:31+00:00,Balik office pon social distancing ke ?? Table mates nya turn amek leave and MC lel . ,1241958481550135297,SMALLER_thanyou,
2020-03-23 05:06:40+00:00,The new normal #SocialDistancing #coronavirus #COVIDー19 #singapore #WashYourHands #StayAtHome #StayHealthyEveryone,1241954493215830016,jasondlp,
2020-03-23 05:06:09+00:00,Social distancing in Singapore 🇸🇬 ,1241954363288907776,SantoshAKA,
2020-03-23 02:29:01+00:00,"We are practicing social distancing. As we strive to keep our classes small, we are able to spread the students out so they have plenty of room and distance between each participant. Keep safe and bake on!… https://www.instagram.com/p/B-DzVexHZdO/?igshid=bqzwqc9khyec",1241914822477873152,PalateSingapore,
2020-03-23 02:24:51+00:00,#SocialDistancing ,1241913771758514182,Z_Ayyaz,
2020-03-23 02:21:32+00:00,Social distancing takyah cerita lah. Kelaaaaut dalam. Agaknya aku patut bersin kuat² je semalam dalam kedai tu baru semua ada akal.,1241912936127287297,marrkarim,
2020-03-23 00:48:06+00:00,"It’s #Monday morning in #Singapore. Don’t get complacent just because we don’t have a full lockdown. Be grateful you still live a relatively normal life, and keep the #covid19 spread at bay in our awesome #citystate. #SocialDistancing",1241889424784248833,ArishKhajotia,
2020-03-23 00:47:31+00:00,When it’s social distancing at church #jesus #church #planetshakerssg #planetshakers #COVIDー19 #COVID19 #coronavirus #,1241889277216079872,renaisaac_,
2020-03-22 23:24:33+00:00,Social distancing in transport network is almost impossible due to the large amount of passenger traffics. This apply to supermarket also as cashiers will be unable to handle the work load.,1241868396913807360,richardjang,
2020-03-22 23:21:08+00:00,"Have you been keeping yourself healthy? As the #covid19 disease goes pandemic around the world, it is important for us to have a regular exercise routine, eat healthily, sleep well and follow social distancing… https://www.instagram.com/p/B-Dd1WSJa5e/?igshid=1iji42kdkgjbq",1241867539631620096,coolinsights,
2020-03-22 22:49:36+00:00,"#staypositive #fingercrossed #glimerofhope You need to take all precautions , stay hole , self quarantine, wash hands etc etc and make sure social distancing is key part of you routine and then “humanity will survive.” ",1241859600418320385,rohitdadwal,
2020-03-22 21:30:47+00:00,Video on COVID-19: Why social distancing is important ,1241839769123819520,GregDAustin,
2020-03-22 16:36:40+00:00,"Ppl be like social distancing.... then somewhere out there, also got ppl b planning orgies and making out with each other. Got temp taking and contact tracing n travel declaration b4 that not? Dangerous leh...... ",1241765749506498560,enzoticaaa,
2020-03-22 15:17:22+00:00,14; 5 days MC routine. Social distancing = My actual life. ,1241745794178269186,SMALLER_thanyou,
2020-03-22 15:09:09+00:00,Twitter took a weird time to turn socialist Ya'll should be social distancing instead lmao,1241743725392474113,Freakofnaytur,
2020-03-22 14:37:44+00:00,Oriental pied hornbill on a lamppost. #Orientalpiedhornbill #Singapore #SocialDistance #SocialDistancing ,1241735819984924672,BandiRao,
2020-03-22 14:24:13+00:00,social distancing one more time..,1241732420577030149,ecownomics,
2020-03-22 14:22:38+00:00,#socialdistancing is the word all over the world now. #covid_19 is fast changing on how people interact with each other. @McDonald's https://www.instagram.com/p/B-CgNKEjCh6/?igshid=11hz7lpxngbrr,1241732020314812417,arthurfoongwk,
2020-03-22 13:43:23+00:00,Sakura Matsuri Event @Gardens by the Bay. Day 2 playing tourist in MY own country. Social distancing is practised and hands were disinfected every now &amp; then🤘🏻✌🏻 – at Bay East (Gardens by the Bay),1241722141625552899,SyaidaRahman,
2020-03-22 13:32:51+00:00,"Singapore is not on lockdown but we have begun to enforce social distancing aside from the other Musts during this period. It’s been a blessing to visit the folks over the weekend, but of course while staying safe… https://www.instagram.com/p/B-Cagfyg7zS/?igshid=1gu8jrn3nqj9r",1241719489881833472,AartiOlivia,
2020-03-22 13:25:24+00:00,Alternate? 😂 difficult enough without social distancing. ,1241717615845715969,martintan,
2020-03-22 13:22:16+00:00,Hallo police? How to #socialdistancing in this toilet? ,1241716827891224577,miyagi,
2020-03-22 13:16:52+00:00,Pawer kagabi parang walang pag announcr ng social distancing sa orchard. ,1241715470715113474,kvronquillo,
2020-03-22 13:15:18+00:00,Social distancing is an opportunity to get closer to nature. #running #runner #runnersofinstagram #corona #covid_19 #covıd19 @The Green Corridor https://www.instagram.com/p/B-CYf-4B6zQ/?igshid=16jxrqxyvq5cq,1241715073569247235,jugandomeeltuch,
2020-03-22 12:13:31+00:00,Kopitiam mulai menerapkan social distancing. Tapi biasanya wa kalau makan juga sendirian sih 😂😭 ,1241699528614408192,daprodit,
2020-03-22 11:38:12+00:00,Social Distancing set up at Iibrary@Orchard #COVID19 #ChineseVirus #MadeinChina – at library@orchard,1241690640569663490,ronhupa,
2020-03-22 11:33:26+00:00,Losing One day wage vs Loosing lives (plural - they also stopped thespread by submitting to the social distancing for 1 day),1241689439107043328,munivinayk,
2020-03-22 11:22:34+00:00,Social distancing in practice with @Gyrowoof @Texadaeus and @Adaoz_Artz,1241686703921696769,KradoTheLion,
2020-03-22 11:22:24+00:00,"Not really surprised Japan was able to suppress the virus spread, having a culture of wearing mask, sanitizer and extreme (mental) social distancing as a norm is paying off. A Coronavirus Explosion Was Expected in Japan. Where Is It? ",1241686662394122241,benjiminu,
2020-03-22 10:36:33+00:00,In the age of social distancing should Juan Mata do the responsible thing &amp; sign off his blog post with ‘elbow bumps’ instead of hugs? #nqatpod,1241675123515518978,LeFalseNumber12,
2020-03-22 10:34:23+00:00,Pegi mydin. Aku da elok social distancing masa nak beli bawang. Eh yg lain dtg mcm pirahna. Bebal gilaaa. Apa guna kau pakai face mask kalau kau berpusu langgar orang sana sini?!!!! Bodohnya 😫😫😫,1241674577341591553,anakencikhasan,
2020-03-22 10:12:59+00:00,Cute balloons on social distancing @Bukit Batok Central West Mall https://www.instagram.com/p/B-CDk8nn-v4/?igshid=xk71re9frwq3,1241669191972687872,jimmytst,
2020-03-22 08:43:50+00:00,Sehubungan dengan #socialdistancing sebaiknya kita tidak bergerombol di kerumunan banyak orang . Jadi disarankan lebih baik banyakin berdua an aja 🤣😂 . Keep healthy everyone 💪 . #singapore #visitsingapore… https://www.instagram.com/p/B-B5bw6lC1N/?igshid=1e3y4463u9dzq,1241646760000466945,aldoadela,
2020-03-22 08:41:29+00:00,मेरा देश बदल रहा है आज पूरे दिन सिंगापुर से ही अपने देश की खबर सुनी ...#JantaCurfewDay @mygovindia #MyJantaCurfewMoment #StayAtHomeChallenge #Covid_19india #JantaCurfewMarch22 #Social_Distancing ,1241646165398970369,yogmani001,
2020-03-22 07:06:35+00:00,"Me not exactly practicing social distancing – at The Ritz-Carlton, Millenia Singapore",1241622285867298817,theViscountBP,
2020-03-22 06:13:00+00:00,Singapore buat social distancing mcm ni pun kena kutuk. We wil NOT execute such plan klw govt. tak kasi green light ye☝🏻. We won’t be stupidly executing this order w/o any advice from the Govt. &amp; MOH. We did our part by curbing as well as flattening the curve of this virus. 😊 ,1241608801263874049,SyaidaRahman,
2020-03-22 06:02:36+00:00,"Don’t stand so. Don’t stand so. Don’t stand so close to me. - The Police (the band, that is) #sungaibuloh #singapore #nature #wellness #exercise #socialdistancing #besafe @Sungei Buloh Wetland Reserve https://www.instagram.com/p/B-Bm-olgNTf/?igshid=1huxk9tyrvswp",1241606182466392064,PeterGCuthbert,
2020-03-22 05:57:46+00:00,"Look, if a monkey can follow the health advisories so can you! #socialdistancing #health #wellness #nogroups #singapore @Sungei Buloh Wetland Reserve https://www.instagram.com/p/B-BmbiYAaxL/?igshid=1vmk71asemlh2",1241604967422623744,PeterGCuthbert,
2020-03-22 05:57:08+00:00,Gondrong nih rambut gegara social distancing. Hahaha,1241604807506317314,kuahrendang_,
2020-03-22 04:42:12+00:00,Social Distancing Hope everyone stay safe and healthy – at Sungei Buloh Wetland Reserve,1241585951022829568,HarryC_Realtor,
2020-03-22 04:15:39+00:00,"Social Distancing at Saizeriya, Orchard Gateway. #Covid19",1241579267982364672,dquickwhitefox,
2020-03-22 03:48:28+00:00,Practice social distancing. Stay at home. #STREAMParangKailanLang #MaineMendoza,1241572424795054082,DorrisRivero,
2020-03-22 02:13:09+00:00,Nandito PM Lee sa hawker centre sa baba namin. Di uso social distancing 😬 – at Teck Ghee Market &amp; Food Centre,1241548439537586176,dailydoseofcare,
2020-03-22 02:11:08+00:00,Nandito pala sa baba namin si PM Lee. Di uso social distancing 😬 – at Teck Ghee Market &amp; Food Centre,1241547933817778176,OTWOLheart,
2020-03-22 01:54:18+00:00,Don’t just so-so distancing. Take #SocialDistancing seriously please #COVID19,1241543695293239296,miyagi,
2020-03-22 01:45:06+00:00,Bukas pala ang LRT1? Sana strict yung social distancing,1241541378879795205,pinipinas2020,
2020-03-21 23:47:39+00:00,Social Distancing ,1241511823578247168,vicgatch,
2020-03-21 16:02:54+00:00,⏳➖⏳ #2016 #wip #socialdistancing #literally #itwasnothingaboutcorvid19 #but #anotherkindofpandemic @Singapore https://www.instagram.com/p/B-AG4ocn9Qf/?igshid=17cdae2imbl18,1241394863578460160,wong_kelwin,
2020-03-21 14:34:17+00:00,Solo buffet. 🍽😋 #socialdistancing 😁 @Yi Qian Ling Yi Ye Steamboat Buffet https://www.instagram.com/p/B9_8uWXB1Bx4jYBhF6ikIy36Y6HI4L4auCnqls0/?igshid=1frznl9bdpzsi,1241372564708081664,_pa1ets,
2020-03-21 14:29:24+00:00,He’s onto something here. #slow #slowdown #socialdistancing #stayhome #socialresponsibility @The Odd Bottle Wine Cave https://www.instagram.com/p/B9_8L16gHW3/?igshid=16f8e9wy899el,1241371335110144001,PeterGCuthbert,
2020-03-21 13:30:02+00:00,Then party all night because Saturday. Social distancing? Well the room can be a club too.,1241356394638348288,hafanzeee,
2020-03-21 13:13:02+00:00,"Modi jee :Mitron , Please practice Social distancing on Sunday! Tweeps: Modi jee, What do you think we have been doing since we joined Twitter ??",1241352115307462656,RajeshChakram,
2020-03-21 13:11:05+00:00,"CCB will only come bc got 1-1 promo, no wonder all stupid, don’t even know what is social distancing.",1241351624745836546,maaaatildaaaa,
2020-03-21 12:35:55+00:00,"Social distancing! Home grilled wagyu sirloin steak, fries and some veggies with steam fresh corn for dinner. Wife’s magic in the kitchen is as good as any restaurant! @The Raintree https://www.instagram.com/p/B9_vMsiHvrV/?igshid=ef13sgnt45nj",1241342778019381249,ctlalan,
2020-03-21 12:03:33+00:00,So with much social distancing and many precautions #fossasia makes it happen online in spite of challenges with help from the offline few that were at the event. Let’s get through this. Together. A few reflections of sorts from the ground https://link.medium.com/L5e8r8Rd24,1241334630151630853,saadcaffeine,
2020-03-21 11:33:48+00:00,Let’s practice social distancing says the totoros as they settle down for some pork rib old cucumber soup on this cold Saturday evening :)))) @The Silver Chef Bistro https://www.instagram.com/p/B9_oFnTBUm5/?igshid=1tlbz18z599qe,1241327145420345344,ianlow32,
2020-03-21 11:05:43+00:00,Social distancing now implemented here in SG. Ganito na eksena sa mga mall. Paano kaya eksena sa train ska bus? ,1241320077401583616,kvronquillo,
2020-03-21 09:08:58+00:00,"Social distancing is perfect application for our lockers! If you do require door delivery, please note that we have asked our couriers to implement “No Contact Delivery” so that there is no direct physical… https://www.instagram.com/p/B9_Xg_NnbCt/?igshid=1uoqghk7fpdqt",1241290696264273921,ParcelSanta,
2020-03-21 09:04:13+00:00,"At nung nag bibigay ng quarantine pass pinapunta lahat ng tao sa barangay hall, nasan yung social distancing dun? Mas malala pa nga tong nangyayaring to, pinag papanic ang mga tao.",1241289500237520896,ObnoxiousUsher,
2020-03-21 08:49:37+00:00,The feeling of being squeezed in. Tight. But there is light in the gap. Bright and bursting. Nevermind the wet drops. It is just rain. And #socialdistancing is crucial. Remember that. Buses in the times of… https://www.instagram.com/p/B9_VTGvnShC/?igshid=10r3ur3h8klki,1241285826463531008,reviveramesh,
2020-03-21 07:28:08+00:00,Seharusnya social distancing dalam hal ngantri atau duduk ditempat umum diberlakukan selamanya. Supaya orang yg kalo ngantri suka nempel deket2 kita plus bau ketek itu bisa jauh2. Hushhh...,1241265317906509824,Yeklin,
2020-03-21 07:27:27+00:00,"Had a cracker of a social ride today with these cool kids. Discovered a new bike cafe in Seletar, 140km outside (social distancing rules) while we still can. @Soek Seng 1954 Bike Art Gallery https://www.instagram.com/p/B9_L5iCFpL3/?igshid=16164vfx6zlpz",1241265146237984769,TwitSchtef,
2020-03-21 06:48:33+00:00,u may regret ever wanting it to be red.. Cos Lockdown is no joke.. even at Dorscon Orange we are still practising some Dorscon Red measures if you havent noticed.. Practise social distancing and avoid crowded areas..,1241255360456847362,LizWoodyBoBeep,
2020-03-21 06:35:38+00:00,"I agree. It works both ways. Social distancing is for all. Those people at that party, have to ask themselves what they were doing there. And the reason we need social distancing is because people can't tell if they infected or not.",1241252109829341186,rishabhm,
2020-03-21 05:43:20+00:00,#SocialDistancing ,1241238945830035456,HeartBali,
2020-03-21 05:18:45+00:00,Zoo Audience Check this out We can make it Lets make Social Distancing @101.6 Zoo Fm https://www.instagram.com/p/B9-9K8OFtim/?igshid=jxe456rgdv6y,1241232758141333504,zoofmbatam,
2020-03-21 05:16:17+00:00,"世事分秒变换 政策的推出赶不上变化 人们的社交距离意识要快快觉醒 ，因为我们会面对更多的不确定。 请保护自己和家人以及身边的朋友、人们.... Be healthy, don’t fall sick . #sgunited #socialdistancing #waisee2020 #morningwalks @Singapore https://www.instagram.com/p/B9-84xhnlFx/?igshid=kn9873sa0640",1241232140576186373,WaiSee11,
2020-03-21 05:12:14+00:00,Social Distancing... #StopCoronaVirus #coronavirusprevention #SGUnited #SGTogether #Singapore #shotoniphone,1241231119711789057,javanng,
2020-03-21 04:46:16+00:00,The power of social distancing. #COVID2019,1241224586391216128,MikeRiskDJ,
2020-03-21 04:42:11+00:00,"Be responsible!!! There is so much we can do, just staying at home!#socialdistancing #covid19 @Singapore https://www.instagram.com/p/B9-4-1SJLiq/?igshid=1ahv2s8zz8l1i",1241223555720896513,Gauribee,
2020-03-21 04:36:37+00:00,Social Distancing ,1241222158207946754,jackeychong,
2020-03-21 03:27:39+00:00,Stay at home. Practice social distancing. Be responsible. Ingat everyone sa covid-19. Visit @WHOPhilippines @DOHgovph for updates.,1241204802102554625,DorrisRivero,
2020-03-21 02:58:51+00:00,Have a great weekend everyone! Let’s bring the numbers down TOGETHER! #glennongsg #letsmakecovidkaput #socialdistancing #singapore @Singapore https://www.instagram.com/p/B9-tKPJgjL-/?igshid=1x56x1tnyv2ar,1241197553993089030,GlennEgoman,
2020-03-21 01:47:09+00:00,Since #socialdistancing is the order of the day Don’t forget to have #funathome #weekend #weekendvibes #weekendmood #nature #naturephotography #naturephoto #nature_perfection #natureshooters #wildlife… https://www.instagram.com/p/B9-k9EunKr4/?igshid=2cyfurpplj1h,1241179508629217281,SingaporeBong,
2020-03-21 01:47:01+00:00,Sepasang suami istri melakukan social distancing dengan tiduran seharian Emang cocok begini,1241179476479729665,dudidit,
2020-03-21 00:35:57+00:00,"Sekarang gak kemana-mana, lagi social distancing 😂",1241161591317381120,PangeranEnsfil3,
2020-03-21 00:15:18+00:00,"@narendramodi ji , please publicly reprimand BJP leaders who broke all the social distancing norms laid out . You need to shame them publicly so that others think twice before they attempt such stupidity !",1241156392754372608,manoharnshetty,
2020-03-20 23:57:15+00:00,"Please note the surge in yesterday's (20th Mar 2020) #COVID19 cases. Now to protect yourself and everyone, personal hygiene should be your key and social distancing should be your password. #SocialResponsibility – at Sengkang East Way, Singapore",1241151851908587520,silvergupta,
2020-03-20 20:02:26+00:00,Digi Towers are practicing social distancing so data transfer will be slow. Experiencing the same problem here. #digitelco apo nih? 😩 https://twitter.com/iamtashaaa_/status/1240984582960316418,1241092756736315392,PuvenTirren,
2020-03-20 16:18:03+00:00,"Selamat malam menjelang pagi,#SocialDistancing ,#dirumahaja tetap #StayHealthy",1241036287806586893,ntalya14,
2020-03-20 16:15:30+00:00,"idk if its called social distancing but its high time i start distancing myself from people....people who’s closest to me. toxic ones. i need a detox, but for my life.",1241035649370583040,n4tzzzzzz,
2020-03-20 15:06:15+00:00,"Im practicing Social Distancing on @MulticoinPoker dApp on @MidasProtocol everyday. No money touching, no card touching, more than 2000km distance. Self quarantine with joy. :))",1241018220749811713,dr_davidnguyen,
2020-03-20 14:57:00+00:00,"gonna need everyone whose trying to connect with me to step back. Im practicing social distancing darls, fuck off.",1241015893053841409,nardygyal,
