Datetime,Text,TweetID,username,geo
2020-03-20 13:18:21+00:00,How to do a proper baris sedia. Swipe fast back and forth to see it. #socialdistancing @The Malayan Council https://www.instagram.com/p/B99PQeUBPMj/?igshid=1cnevacatktef,1240991065152217094,heriyadikoh,
2020-03-20 12:48:10+00:00,Social distancing - the in word for 2020. Do it... For the love of us.,1240983471927037953,Anis_Ashraff,
2020-03-20 12:46:11+00:00,"while we're in quarantine/participating in social distancing please for the love of god take some time to step back and evaluate: can you tell the difference between you and you're????? if you cant, please take this time to unlearn being a dumbass it's 2020",1240982972733390848,parinzoia,
2020-03-20 12:31:53+00:00,Saar social distancing ?,1240979373823528960,RajeshChakram,
2020-03-20 12:04:53+00:00,#行动管制 D-03 I miss milk tea in SG so machi... . . #SocialDistancing #XanneInSG #Friday #March #Year2020 @麥吉machi machi Singapore https://www.instagram.com/p/B99G2hFHnjP/?igshid=hn1a68j3d5jm,1240972578748919809,RoxanneJY,
2020-03-20 11:49:15+00:00,Shoutout lang jan sa Maestra ko ka High School nga ga reklamo nga gn pataasan pliti nya sa Tricycle. Ma'am pila nalang masakay ka Tricycle kay ma social distancing. Pila gd gintaas haw? Lihog lang konsidirar man sa ila nd nga ang imo lang ya kaugalingun imo nga isipun. Panilag mn,1240968645548707841,IamKhenthuy,
2020-03-20 11:15:27+00:00,This takes #SocialDistancing to a whole other level! ,1240960138422308864,GemmaLEdwards1,
2020-03-20 10:52:12+00:00,When situations are not conducive to being Social then #socialdistancing but make sure u keep having fun #homefood #homefoodie #homefoodbuzz by @juthikab The #yummyinmytummy #paprichaat was out of the world… https://www.instagram.com/p/B98-iJZHmtK/?igshid=cqqba18r5d5i,1240954285078315009,SingaporeBong,
2020-03-20 10:33:46+00:00,"If this is social distancing, wagyu steak is a great vegan dish.",1240949648845443072,PatchouliW,
2020-03-20 09:07:42+00:00,"Met an old friend I'd heard nothing from for a decade but who'd showed up on a channel I hang on, thanks to social distancing in RL.",1240927988645908481,PatchouliW,
2020-03-20 08:55:07+00:00,"Hey, movie freaks. Lagi #socialdistancing #dirumahaja mending yuk nonton film film baru di @klikfilm ,sudah bisa ditonton di HP kamu dan hanya ada di KlikFilm! . . Semua hanya di KlikFilm. Buruan download… https://www.instagram.com/p/B98xIurFctH/?igshid=16m8u9czkueea",1240924823871774722,zoofmbatam,
2020-03-20 07:23:53+00:00,Social distancing pun kena school,1240901862192222211,mixdblood69,
2020-03-20 06:46:07+00:00,Singapore International Foundation Coffee Appreciation (with social distancing!) https://www.highlandercoffee.com/coffee-academy/gourmet-coffee-appreciation/ @Highlander Coffee https://www.instagram.com/p/B98iFcZhIxU/?igshid=19d952407udq9,1240892360143171584,highlandercoff,
2020-03-20 05:14:23+00:00,A great explanation on why Social Distancing is important to #FlattenTheCurve - pls watch and re-share 🙏🏼 Why fighting the coronavirus depends on you https://youtu.be/dSQztKXR6k0 via @YouTube,1240869274526158848,chrissbell,
2020-03-20 04:52:16+00:00,#SocialDistancing #CoronaVirus#covid19#corona ,1240863708290510849,HeartBali,
2020-03-20 04:14:54+00:00,do you think the mufti will cancel raya like what if he says no raya gatherings bc social distancing ???,1240854301284564993,dktnlfkvm,
2020-03-20 03:05:18+00:00,"TIPS JITU SOCIAL DISTANCING Social distancing atau jarak sosial adalah mengambil jarak dengan menghindari kerumunan, pertemuan publik, dan tak mendatangi pertemuan dengan kelompok besar. 1. Kurangi aktivitas dan… https://www.instagram.com/p/B98JGfnhk1n/?igshid=sswf1uaa0wjj",1240836787905474563,protokolbtm,
2020-03-20 03:01:29+00:00,Watching the @netflix docuseries ‘#Pandemic: How to Prevent an Outbreak’ while I’m staying home. Is that ironical? #SocialDistancing,1240835828999270400,JKannanR,
2020-03-20 03:01:21+00:00,#wtf #SocialDistancing don’t they understand the meaning ? Highly irresponsible . @GoNews_India you should not be be making this as a positive story : instead call it out as the thing not to do . #beprofessional #journalism,1240835793586778112,rohitdadwal,
2020-03-20 02:43:44+00:00,Would explain all the social distancing going on in there too. Well other than the survivors and blood 🤔,1240831359771217920,Zikrayrus,
2020-03-20 02:34:42+00:00,Dogs are happy about the social distancing. Cats on the other hand....... 😾🗯 @Rivergate Condominium https://www.instagram.com/p/B98FmhgltiG/?igshid=1i36d64iun49v,1240829088580984832,furrealsg,
2020-03-20 00:50:45+00:00,Social distancing. . . . . 📸 @ifcpt gregep . . . #fitnessgoals #fitforlife #fightingfit #fitnessjourney #fitnessmotivation #SgFitness #FitnessSG #sgfitspo #StrengthandConditioning #WeightTraining #IFCPT… https://www.instagram.com/p/B975k6uH1kc/?igshid=ltojk3bi92nw,1240802926739759104,SunGoddessTarot,
2020-03-20 00:42:31+00:00,"I'd say ""everybody all together now"" but #socialdistancing. #covid19",1240800855042867200,PatchouliW,
2020-03-20 00:32:08+00:00,JESUS WANTS A HUG! ... sadly given the social distancing thing it looks like he'll have to keep waiting.,1240798240095612928,PatchouliW,
2020-03-19 23:20:51+00:00,Observe social distancing. Stay at home at makinig na lang. #ParangKailanLang #MaineMendoza,1240780303301373952,lili_eyebags,
2020-03-19 22:30:23+00:00,"Gaano kami ka-Strong dito sa Singapore?? No Community Quarantine, No Lock Down, No Travel Ban, No Work at Home, No Social Distancing, higit sa lahat, NO DEATH CASE. 😉",1240767602697199617,Onlyrhika1004,
2020-03-19 14:48:39+00:00,seems like you're missing the point of social distancing ,1240651404349280261,lifeistolepak,
2020-03-19 13:59:04+00:00,"I don’t see sufficient awareness in Australia. It needs, right now: - aggressive case detection - contact tracing, with prompt isolation & treatment - quarantining of close contacts; - strict social distancing",1240638926798241793,maximos62,
2020-03-19 13:11:41+00:00,Stay safe 🥺. Always wash your hands and practice social distancing.,1240627000068337664,cookiejimz,
2020-03-19 13:06:09+00:00,Bad kerning is not social distancing,1240625606737268736,miyagi,
2020-03-19 12:44:08+00:00,https://co.vid19.sg/clusters . Very interesting data mapping .Shows the connects &amp; infections. majority of first 100 odd cases all discharged . If the infections reduce ( social distancing &amp; quarantine ) it’s matter of time things will get better. #covid19 ##sgunited #sgcovidupdates,1240620068213420032,rohitdadwal,
2020-03-19 11:23:37+00:00,Social Distancing Measures at the cinemas.. – at Shaw Theatres,1240599803651747840,ZupHomeez,
2020-03-19 11:14:36+00:00,You know it’s 2020 when your kid comes home from preschool and wants to talk about “social distancing”,1240597537481871363,ehn,
2020-03-19 10:55:59+00:00,When you need #socialdistancing but you have to manage a 4 yr old at home #burger #chickenburger #burgersofinstagram #homemadefood #homemadeburgers #burgergram #makeitathome #homefood #homefoodbuzz #homefoodie… https://www.instagram.com/p/B96aLBjnrg0/?igshid=12dgmtradpew4,1240592851446034433,SingaporeBong,
2020-03-19 10:47:20+00:00,"Soup tonight at him is fish maw and homemade pork meatballs, and some Chinese dried mushrooms. Remember to practice social distancing wherever and whenever possible during this time and stay safe :))))) @The Silver… https://www.instagram.com/p/B96ZLnxhyfK/?igshid=k363t0nyg2i5",1240590674795388929,ianlow32,
2020-03-19 10:09:14+00:00,"Attending ExCo Meeting 3 of 2020, followed by Council Meeting, with social distancing measures in place. 😅 – at Maxwell Chambers",1240581084359745536,MichaelSChia,
2020-03-19 10:03:15+00:00,"Am besten Hände immer schön gründlich waschen. Den Rest aber nicht- wenn man fies stinkt, geht social distancing ganz von selbst.",1240579581674831877,Thomas_Ehinger,
2020-03-19 08:32:23+00:00,Went on a little walk. #socialdistancing #sunshine🌞 #stayactive #itisgoingtobefine #hotafternoon #sweatymess💦 @Henderson Waves https://www.instagram.com/p/B96JvF5BQ1G/?igshid=iew2aczqotbf,1240556713801068544,Wicked3659,
2020-03-19 07:37:20+00:00,"Birding is an ideal hobby to pursue during this troubled period of #SocialDistancing, with its early morning starts &amp; telephoto lens/binoculars. #SGBiodiversity Mangrove Pitta (Pitta megarhyncha) Barn Owl (Tyto alba)",1240542860497182721,JKannanR,
2020-03-19 07:14:47+00:00,"#Repost wokfunk with make_repost ・・・ 2 DAYS TO THE SHOW!⁣ ⁣ Huge shoutout to our muso friends who’ve agreed to partake in our silliness ❤️ ⁣ ⁣ If you're concerned about social distancing, esplanadesingapore has… https://www.instagram.com/p/B96A2tHBdaQ/?igshid=1mxk040evklen",1240537184589012993,PantheonPercuss,
2020-03-19 06:45:25+00:00,"#Singapore is NOT back to normal. Massive controls are in place now to limit the spread of the virus, and we have just seen the largest single day spike ever. #socialdistancing is being strongly implemented and has helped to not enable a greater spread.",1240529796179742726,ArishKhajotia,
2020-03-19 05:55:08+00:00,Social distancing is very crucial right now and you guys want to do this smack in the middle of current situation? This is not the filming of Die Harder 5: the COVID-19 🙄 I think Allah would understand if we pray to him at home.,1240517141683732481,Anis_Ashraff,
2020-03-19 04:32:53+00:00,One commuter I’m definitely social distancing from - never seen them so close to the city!? 🙈🙊🐒 #Singapore – at Riverplace Condo,1240496441799278592,NancyCNBC,
2020-03-19 02:44:25+00:00,Day 2 of social distancing. Teruskan membaca agar tidak bengap terus di hari terakhir 😅 everything suddenly becomes unfamiliar lulz ,1240469144916525056,haqxtanz,
2020-03-19 01:52:56+00:00,social distancing ,1240456186576506885,hereisjoey,
2020-03-19 01:23:16+00:00,Taking social distancing to a whole new level. Now is the time to workout to stay healthy. Be safe. Be sensible. Be positive. 💪 #workoutstyle #workoutmotivation #workoutempire #workoutdaily #workoutgoals… https://www.instagram.com/p/B95YoSvHpUs/?igshid=13etbk5b3otty,1240448722229694464,AngelaLoh,
2020-03-19 00:19:58+00:00,"Cumon people... ""Social Distancing"" Does NOT mean ""Self Isolation"" So Please get a grip, get outta the House &amp; most importantly...Keep Exercising! ⚠️ ⚠️ ⚠️ #covid_19 #corona #NOTairborn… https://www.instagram.com/p/B95RYrlH51wEoPzBGQRBOY4MmZI2Gy5yOJE3K80/?igshid=1dd2d1olk4q9e",1240432793881997312,JayMcr,
2020-03-19 00:08:45+00:00,#socialdistancing #covid_19 #movementcontrolorder #juststayathome #hsaisnotmyhome @Sultanah Aminah Hospital https://www.instagram.com/p/B95QGjaneJn/?igshid=1q5iyzsopg8k3,1240429971467841536,soigneboi,
2020-03-18 15:52:44+00:00,Working from home..... #rgbMadness #persoanlSpace #SocialDistancing @Singapore https://www.instagram.com/p/B94XVckpX6tLA8F66viYNuaBAu2Rm1ImjIeYns0/?igshid=39v3civhz04j,1240305143419002887,nathanjobs91,
2020-03-18 14:54:16+00:00,Social distancing 101 #oneteam @TwitterOneTeam h/t @shelley_mae,1240290428328357888,angadsg,
2020-03-18 13:37:12+00:00,it’s not “better” you SHOULD! Social distancing hello???? ,1240271036349681664,staciachang,
2020-03-18 12:32:39+00:00,#SocialDistancing – at Western Digital (M) Sdn. Bhd. (JO1 Plant),1240254790015148033,kidalhandal,
2020-03-18 12:07:28+00:00,What can I say? I’m practicing social distancing. (Was doing it before it was cool),1240248451310342145,LeFalseNumber12,
2020-03-18 08:55:46+00:00,Ini nih gambaran social distancing ,1240200211487588352,Anggiani_Sukma,
2020-03-18 08:53:19+00:00,See? No need to panic buy and stock up months of supplies. Just calm down and practise social distancing and responsibility. ,1240199592609599493,AliIsBk1,
2020-03-18 07:22:20+00:00,Be thankful that are all but stuck with the people we love and in a place of comfort and good governance. I guess we should all take care of social distancing for the ones you see at the end of each day. #Corona… https://www.instagram.com/p/B93c7W0npzX/?igshid=1ov3yitk9y570,1240176695635783680,leonlimyz,
2020-03-18 06:49:20+00:00,"What is #socialdistancing ? Walk far far away from yr crew n cast ! Ps- my ""overseas"" is just go pulau ubin hor no need go thro custom one k #noscaredok No need #SHN .. @Punggol, Singapore https://www.instagram.com/p/B93YP7HhnH5/?igshid=1c94drxtc8ntx",1240168393245933568,flyirene,
2020-03-18 04:03:06+00:00,"""Optimal mitigation policies (home quarantine, and social distancing of the elderly) might reduce peak healthcare demand and deaths by half. However, it is likely to result in hundreds of thousands of deaths and collapsing health systems. "" reported by Imperial College. 😔 ",1240126556837687303,berraksismann,
2020-03-18 03:30:02+00:00,"Di tengah maraknya penyebaran virus corona akhir- akhir ini, terjadi perubahan besar dalam beberapa aspek terutama ekonomi. Fenomena social distancing dan work from home membawa dampak yang besar terhadap… https://www.instagram.com/p/B93CV4Rg42J/?igshid=1owqxfqxmqtzl",1240118238022750208,Bennylimping,
2020-03-18 00:48:52+00:00,"Hoping they will implement WFH soon. If you’re taking train/bus daily, there’s still a big chance that you can catch #COVID19. Social distancing can’t be done when you’re on public transport.",1240077675697332225,mrbranch,
2020-03-17 16:20:47+00:00,One of the benefits of leaving office past 11.30pm is the fact that the bus home will be less packed or even empty #socialdistancing,1239949813262635009,basilyeo,
2020-03-17 15:50:39+00:00,Here in Singapore we have been accommodating COVID-19 measures since January. Online Lecturing at #NUS to accommodate social distancing #Covid_19TheShowMustGoOn #MentalHealthMatters,1239942228950151171,farah_shiraz,
2020-03-17 15:30:52+00:00,Mana social distancing guidelines kalian 😰 Contradict betul dengan apa yang kita sepatutnya buat. Hmmmmmm,1239937252743983104,ziqazamri,
2020-03-17 13:32:03+00:00,Opinion: People should be charged under the Infectious Disease Act if they already have symptoms yet chose not to practise social distancing. This is why our numbers keep going up—because some idiots in the community refuses to take this seriously ,1239907350242189312,_vrei_,
2020-03-17 12:40:52+00:00,"⛑ As the worldwide health organizations call for home isolation and social distancing to help contain the spread of Covid19, we like to add a little Caribbean kick to your home cooking! Stuck at home and want to… https://www.instagram.com/p/B91clOkHMoo/?igshid=1nsifsgistwup",1239894471057313793,masiaone,
2020-03-17 11:54:20+00:00,Scorpion on social distancing ,1239882761885773824,LeFalseNumber12,
2020-03-17 11:41:28+00:00,"NAH INI PINTER #JagaJarakDulu bukan berarti tidak bisa mencari nafkah. Social Distancing, tanggung jawab bersama. Agar #COVID19 tidak makin tersebar di Indonesia 🇮🇩",1239879522717065216,ainunnajib,
2020-03-17 10:56:58+00:00,"Well done fitnessfirstsg 👏🏼👏🏼👏🏼 Proud to be a member of a responsible and caring organisation. If your gym is not doing this, my advice GET OUT now!!! #letsbesociallyresponsible #letsmakecovidkaput #socialdistancing… https://www.instagram.com/p/B91QshDABwJ/?igshid=mkf6sb6krz0l",1239868322470080512,GlennEgoman,
2020-03-17 09:33:10+00:00,Nothing against any human but without any threat to health we should have social distancing once in a month every year. #coronavirus #CoronavirusOutbreak #StaySafe #NaturesLastLaugh #PollutionControl #CleanEarth,1239847232066600962,Sonakshi288,
2020-03-17 09:29:39+00:00,"I just do not understand why are foreigners not allow to even leave the country during the restriction orders period? Commuting also prohibited for malaysians working in Singapore. Look at the congestion at the causeway, where is the social distancing between riders? @501Awani",1239846350193188864,oscarjoshua69,
2020-03-17 06:57:11+00:00,"Lagi tahap ""social distancing"" dan menjaga kebersihan rumah dan diri, dipikir-pikir tanpa sadar udah kayak pengidap OCD 😂😂",1239807980154925057,pputriiwin,
2020-03-17 05:49:44+00:00,Social distancing = going out in the field? #saferontheseawall #SeawallEMEL,1239791005341122560,EMEL_NUS,
2020-03-17 05:47:54+00:00,Some retrenchment is starting. Many are definitely giving part timers no shifts and enforcing full timers to burn their annual leave. Some are forced to take no pay leave. It's corporations first here. One telco just shed 50. You'd think telcos benefit from social distancing,1239790545704087552,machinationstu,
2020-03-17 04:42:12+00:00,I think I sat on a taped seat but didn’t know it was for social distancing. Now I just put my bag on it.,1239774009220186112,eviltofu,
2020-03-17 03:48:13+00:00,Social distancing illustration by @harimerdeka #corona#coronavirus#illustration#illustrator#indonesiaillustration#ilustrasiindonesia#art#drawing#Artist#artbali#baliarts#artwork#baliartwork#,1239760422636376064,HeartBali,
2020-03-17 01:03:59+00:00,So on Saturday after a last minute discussion the elders laid out the chairs for “additional social distancing measures” which looked like this. On one hand we will all have the small… https://www.instagram.com/p/B90M1U7HUu6cSYQBvL4GxsL_E9NNYtUfaW9EW80/?igshid=1ppskceujxwea,1239719093298761728,yapcaleb,
2020-03-16 23:45:11+00:00,We are currently suspending judgement. There's a need for social distancing right now. I still say this is excessive.,1239699263795281920,AtiyaahDollfie,
2020-03-16 23:43:27+00:00,Socially disconnected people are less #Happy #loneliness #SocialDistancing,1239698828350984192,amitmathur31,
2020-03-16 23:26:24+00:00,Singapore semalam ada pasar malam and it was packed. Singaporeans really not giving any f bout that “social distancing”. 😂😂😂 They be like: Corona tak corona tu keropok lekor better be in my tummy. ,1239694535321509889,NoFatsNoMuscle,
2020-03-16 23:04:39+00:00,"SOCIAL DISTANCING Do everything at home... Semoga kita semua senantiasa terlindungi dari wabah Covid-19.. pola hidup sehat, olah raga teratur, minum multivitamin.. Tetap semangat dan salam sehat 💪💪 DAIRA Skin Care… https://www.instagram.com/p/B9z_GxOF_oJ/?igshid=rq8wwmk8myvn",1239689064221114369,DAIRA21312544,
2020-03-16 16:09:14+00:00,"i've been practising social distancing even before the #CoronavirusOutbreak. so, i'm very fine w it😂 #introvertadvantage",1239584518094241804,avrilxxiii,
2020-03-16 15:39:00+00:00,Yes. Your gif expresses the sentiment. Maybe a little more social distancing in practice though?,1239576910323232770,_PhilipRoberts,
2020-03-16 15:36:38+00:00,Circus. Where do I start? All the Florida and Hollywood theme parks are closed. NBA season is cancelled. Hockey season is almost. Even eSports will lose some of its allure with social distancing keeping the audience seats emptied at major playoffs.,1239576313725214721,PatchouliW,
2020-03-16 15:22:55+00:00,My eyes are right now practicing social distancing. I look and I see any chance of this pandemic staying contained in America running far away anti socially.,1239572864321220608,AtiyaahDollfie,
2020-03-16 14:46:08+00:00,"Social distancing in Singapore 2/2: jeu de quilles in a (mostly) empty park in the late afternoon with daughters and dog. (A couple of other dogs, more social than ours, took a liking to these quilles soon after this photo was taken). – at Dog Run @West Coast Park",1239563608213934085,_PhilipRoberts,
2020-03-16 14:39:48+00:00,Social distancing is the new KonMari method this season.,1239562013614862337,AtiyaahDollfie,
2020-03-16 14:20:49+00:00,Why Experts Are Urging Social Distancing to Combat Coronavirus Outbreak ,1239557234083770369,Jimmy91668962,
2020-03-16 14:20:27+00:00,Why Experts Are Urging Social Distancing to Combat Coronavirus Outbreak https://www.ucsf.edu/news/2020/03/416906/why-experts-are-urging-social-distancing-combat-coronavirus-outbreak,1239557141683290113,venturefarms,
2020-03-16 14:20:18+00:00,Why Experts Are Urging Social Distancing to Combat Coronavirus Outbreak https://www.ucsf.edu/news/2020/03/416906/why-experts-are-urging-social-distancing-combat-coronavirus-outbreak,1239557103552835584,aquaculturesg,
2020-03-16 13:59:00+00:00,and also social distancing: keep away from toxic people. tibahhhhh ,1239551743786008577,gocawesome,
2020-03-16 13:51:53+00:00,I’m just going to be that naggy person who nags at people about social distancing,1239549955334787072,wynlim,
2020-03-16 13:34:32+00:00,Make sure you practice.. social distancing that is.. @Esplanade - Theatres on the Bay https://www.instagram.com/p/B9y9lhCHcsL/?igshid=banwdw75mbx8,1239545587185278976,JoachimTheodore,
2020-03-16 13:17:17+00:00,tucker is this your social distancing hobby,1239541245594099717,christiiineeee,
2020-03-16 12:53:20+00:00,"Social distancing and use of virtual spaces to a greater extent may make such experiences more problematic to cater in future. Ironically, that may drive up their price and value.",1239535221084524544,PatchouliW,
2020-03-16 12:13:10+00:00,An Optus ad once advised us to try being more dog. Well screw that. Right now cats are masters of social distancing and we could learn from them.,1239525110081400832,PatchouliW,
2020-03-16 09:40:01+00:00,"Kayo matigas ulo, pinipilit social distancing di naman kaya mag provide sa pangangailangan ng mga tao! Sapat ba transportation? U basta utos lang di naman nag analyze? 😤 @DOTrPH",1239486571713191937,CrappyHeart,
2020-03-16 08:23:17+00:00,ga perlu social distancing. dia aja udah menjauh. – at ION Orchard,1239467260361584642,andytjai,
2020-03-16 07:17:53+00:00,Singapore is held up as gold standard in nCoV containment. As I type I'm sitting in a busy cafe in downtown S'pore having got here by bus and returning via MRT. Everybody here being prudent. Lots of hand washing and social distancing. But otherwise business as usual.,1239450802692874240,elgatochilli,
2020-03-16 07:16:19+00:00,"This helps me think calmly and clearly with this restriction approach imposed by the govt. For now, time to postpone my travel plans and make more beats. #covıd19 #socialdistancing ",1239450406998007808,faixosman,
2020-03-16 05:47:36+00:00,Fashion statements for #SocialDistancing. #COVID19,1239428078700396544,Evaneyf,
2020-03-16 04:47:12+00:00,Social distancing at work... means more takeaway from the canteen! Here’s my Taiwanese version of surf and turf! Fried chicken cutlet and fried squid with rice! Covid19 be gone soon! @Ngee Ann Polytechnic https://www.instagram.com/p/B9yBlGUhlN0/?igshid=1rhr5nk68oder,1239412880996536321,fireopal82,
2020-03-16 04:29:05+00:00,broadcast news in the time of #coronavirus - our presenters @AdamBakhtiarCNA and @JulieYooCNA setting a example for the public wrt social distancing #COVID19,1239408320009523200,LinetteLimCNA,
2020-03-16 03:54:39+00:00,"Cara social distancing ala buzzer: Tekan employers utk instruksikan karyawan kerja dr rumah ❌ Prioritaskan petugas kesehatan &amp; pelayanan, ksh akses transport ❌ Batasi akses transportasi publik &amp; cek previlese, biar org yg sedikit previlese berdesakan di angkutan publik ✅ 🤦🏻‍♀️ ",1239399657064689664,anindadewayanti,
2020-03-16 01:59:53+00:00,Not a lot of social distancing going on there,1239370772860137472,NancyCNBC,
2020-03-16 00:46:17+00:00,"Keep that Blue and COVID-19 away // 🤧 Maintain a healthy lifestyle with ample rest, nutritious foods and adequate exercise (while keeping social distancing where possible). Of course, be socially responsible with… https://www.instagram.com/p/B9xmA61lmV0/?igshid=a2puhh1wqo8h",1239352253527531522,jhwphay,
2020-03-16 00:07:07+00:00,Practice social distancing ,1239342395197546496,DocRayMart,
2020-03-15 23:35:53+00:00,"Much of the other social distancing procedures have been done through employers. Employers are in a lot of ways responsible for their employee’s well-being and compliance. If your employee gets sick or has a stay-at-home notice, you need to provide paid leave and meal delivery.",1239334534841118720,tmllr,
2020-03-15 21:52:06+00:00,Some terms being used during this Covid 19 pandemic that will be useful to remember : 1) Social Distancing - placing a physical distance between yourself and others as a means of protection 2) Flatten the Curve -… https://www.instagram.com/p/B9xSEiBgac-/?igshid=483k0dw80nyc,1239308414888611841,AartiOlivia,
2020-03-15 16:40:32+00:00,"Went to the mall nearby today and it was so busy, like Christmas busy. As if everything was over. I’m not sure. Is everything over? Some degree of social distancing wouldn’t do any harm. ",1239230007496433664,interchris,
2020-03-15 13:22:04+00:00,Social distancing Singapore style. Thank you for the photo @dralisoneyring @Singapore https://www.instagram.com/p/B9wXtfmAr7k/?igshid=sklvd8eabvzb,1239180062924169218,muratozturan,
2020-03-15 12:31:48+00:00,Social distancing? Didn't get the memo I guess!,1239167413976879104,KradoTheLion,
2020-03-15 12:27:24+00:00,Anong klaseng senador to??? No hindi man lang sinaway mga tao na mag social distancing at nag wefie pa talaga??? Nakakagalit 😤🤮,1239166306227597312,biatcht21,
2020-03-15 09:39:59+00:00,Social distancing. – at High Park Residences,1239124173949034496,abasmayorr,
2020-03-15 09:20:10+00:00,"a nice break from scrolling twitter at home while social distancing is a quick interval workout, tons you can find for free online. you can do most of these with a yoga mat worth of space and no equipment",1239119187936567298,christiiineeee,
2020-03-15 08:03:27+00:00,Really love visualisation of these model - easy to understand Go for social distancing https://www.washingtonpost.com/graphics/2020/world/corona-simulator/?fbclid=IwAR0atib5vpJ1rInCACh92hB1hScC1Il6lYW8YOHthVW5ZjPKCoe2Kp4FMoA&amp;utm_campaign=wp_main&amp;utm_medium=social&amp;utm_source=facebook,1239099880179527680,PatSaK,
