Datetime,Text,TweetID,username,geo
2020-03-27 14:14:33+00:00,Showing the suffering and the people who suffer it’s very important for reality. There are good and positive interventions going on as well but removing the blanket is very important. 😔 Sharing the mic during social distancing isn’t easy. #Hope #CoronavirusOutbreakindia,1243541924222550019,Sonakshi288,
2020-03-27 13:32:44+00:00,Social Distancing at Dinner &amp; Lunch these days is just normal. Including distance lines on the ground for safe distancing in queues! #socialdistancing #mealtime #staysafe #singapore – at Donna,1243531400042541057,WayneGKline,
2020-03-27 11:55:27+00:00,"On a cold night, a simple and refreshing chicken and corn soup with leek and carrots and tomato is most welcomed, especially with the totoros still practicing social distancing :)))) @The Silver Chef Bistro https://www.instagram.com/p/B-PHVfAh2cP/?igshid=1q6vbwblsjirm",1243506917953220608,ianlow32,
2020-03-27 11:46:46+00:00,Dirumah aja 🏠 Stay at home 😉🏠 Social distancing 🙂 @Kp Bugis Pasir Putih Blp https://www.instagram.com/p/B-PGWEeFdqI/?igshid=jpagfu7oif6q,1243504735497457664,RulyPramanaPtra,
2020-03-27 11:42:50+00:00,Enjoying some cocktails at caffefernetsg during the social distancing rules here in #singapore in the battle against #covid_19 #negroni #pinotgris #oldfashioned #sour #sommelier #socialdistancing @Caffe Fernet https://www.instagram.com/p/B-PF5G3pwM8/?igshid=26qkzjm93z7l,1243503745276600320,FatsoSomm,
2020-03-27 11:42:50+00:00,#SocialDistancing #depressiontribe,1243503744421179396,DEPRESSIONcomsg,
2020-03-27 11:42:14+00:00,#SocialDistancing #sectsshop,1243503593115639808,SectsShop,
2020-03-27 10:55:46+00:00,"So I turned my back and said, “Hi, actually you are supposed to stand behind that line. It’s for social distancing” he looked at the line and walked back. Markers are not placed for leisure, this virus is serious. Stop taking it so lightly.",1243491900637810689,fafuierice,
2020-03-27 10:55:46+00:00,"Someone in line behind me at the grocery wasn’t practicing social distancing when it was already clearly shown by the markers. Normally, I wouldn’t talk to people when they violate my space outside but this was different. F, y’all have to start taking this seriously!",1243491898901184512,fafuierice,
2020-03-27 10:49:26+00:00,Mythbusters ‘Contamination’ Experiment Proves Why Social Distancing Is So Damn Important https://www.dmarge.com/2020/03/mythbusters-contamination-experiment.html #COVID19,1243490305308946432,solomusafir,
2020-03-27 10:21:50+00:00,You don't need somebody with human touch. #COVID19 #SocialDistancing ,1243483360623648770,InteractiveIra,
2020-03-27 10:20:04+00:00,Coffee break and social distancing with wifey. @The Bravery Cafe https://www.instagram.com/p/B-O8ax3BoIA/?igshid=xryjleeastu0,1243482915603955713,librus17,
2020-03-27 09:26:07+00:00,"PM Lee's Rply On ""Why School Should Remain Open"" Is So Rationale.. And To Some Students, Stop Complaining ""Why Put Strict Social Distancing Guidelines But Never Close School?"".. Jngn Bengap Sangat Pls HAHHAHAH",1243469339203760128,haziqqqaaahzik,
2020-03-27 05:23:38+00:00,First lunch tgthr with the crew after so so long of being away.. they say they hv to practise #socialdistancing with me... so i 1person sit by myself at next table! Enough distance 'mmmm? Haha #happygolucky2… https://www.instagram.com/p/B-OafnKBwYR/?igshid=1m7xkhmg9uf5l,1243408316866285569,flyirene,
2020-03-27 04:43:08+00:00,TGIF! Chicken briyani for lunch! Let’s all observe social distancing when dining out! @Springleaf prata place 106 Clementi st 12 https://www.instagram.com/p/B-OV3OKj1e3/?igshid=1agm1aijfwui4,1243398123705126912,fireopal82,
2020-03-27 04:15:41+00:00,Take it from the living room to the studio (while social distancing of course). Turn your creativity on at @Lionheartstud &amp; make payment a breeze with interest-free instalments via #AtomeSG 🎨 #Singapore,1243391213996109825,AtomeSg,
2020-03-27 04:10:28+00:00,We have much to learn from water in #SocialDistancing #COVID19,1243389900948299777,chemFunMan,
2020-03-27 04:05:24+00:00,social distancing sa mga hawker stalls ,1243388626039222276,ellucid1,
2020-03-27 03:53:53+00:00,"Humans vs Covid-19😶 Covid-19 doesn't discriminate, please; Stay at home (if possible), else Maintain social distancing &amp; Wash your hands frequently, Avoid touching your eyes, nose &amp; mouth. If unwell, seek medical advice promptly. #COVID19 #publichealth #healthcare #Singapore",1243385727687069697,DrAdamChee,
2020-03-27 03:41:51+00:00,Glad I have animal crossing to help me stay comfy and happy indoors :) social distancing folks!!! Do the thing!!!!,1243382701366755330,deesaffelstein,
2020-03-27 03:23:28+00:00,Just me practicing social distancing. ,1243378074076364801,LesliePragasam,
2020-03-27 03:08:00+00:00,Subway Singapore created the first edible social distancing tool. Eat this and people around you will automatically stay more than 1m away from you. ,1243374182127173632,AaronNotKoch,
2020-03-27 02:58:03+00:00,There is now jail time and/or a fine if residents of Singapore do not practice social distancing.,1243371680170307584,eviltofu,
2020-03-27 02:54:30+00:00,"#SocialDistancing in #elevators, #Singapore style. #Sentosa #lifts #covid_19 – at Village Hotel at Sentosa",1243370786896801792,cheryltan88,
2020-03-27 02:23:59+00:00,Even the monkeys are practicing social distancing. Apparently one of them subscribes to the government WhatsApp info broadcast. @Bukit Batok Nature Park https://www.instagram.com/p/B-OF8A3DBuo/?igshid=1rp1v359bgquq,1243363103636516866,akusadi,
2020-03-27 02:08:49+00:00,COVID-19: Fine or jail for not observing at least 1-metre social distancing in public https://sg.news.yahoo.com/covid-19-fine-or-jail-for-not-observing-1-metre-social-distancing-in-public-174032204.html?soc_src=community&amp;soc_trk=tw via @Yahoo,1243359286295531520,OlivLatteFamily,
2020-03-27 02:08:11+00:00,Kahit online shopping sa Watsons may social distancing!? 😂 Hubby and Wifey #OTWOLClarkAndLeahMedina,1243359129583808513,OTWOLheart,
2020-03-27 00:48:42+00:00,This has to be one of the best posts ever explain why #socialdistancing matters. Any parent will see the logic clearly. #parents #kids #twins #sanity #covid19,1243339126016897024,ArishKhajotia,
2020-03-27 00:12:25+00:00,"Wow: “They can be fined up to $10,000, jailed for up to six months, or face both penalties upon conviction under updates to the Infectious Diseases Act made by the Ministry of Health and published in the Government Gazette on Thursday.” #SocialDistancing #COVID19 #Singapore",1243329995335819265,cheryltan88,
2020-03-27 00:08:52+00:00,New social distancing measures. Constant recalibration to keep schools open. Schools staying open allows parents to work and keep essential services functioning and keeping the economy from going completely under. There are sacrifices to be made and we will do it to survive. ,1243329101500256258,yihyng,
2020-03-26 23:53:42+00:00,@Vijayabaskarofl please use @VadiveluOffl in your communication regarding social distancing and precautions. Can b series of 1 or 2 min videos. There is no better communicator to rural masses and Gen Y and Z than Vadivelu. Please try.,1243325283345633280,venkatanathana,
2020-03-26 23:48:35+00:00,Social distancing in action. It was mostly bags that were social distancing at the pool. – at University Sports Centre,1243323995664961536,tahahamed,
2020-03-26 15:08:19+00:00,Miss ko na din mang bully kasama ka. Hahaha miss and love you! Social distancing muna tayo ngayon beshie_28!,1243193066447499267,miniminimynemo,
2020-03-26 14:25:27+00:00,"With virtual worlds and systems, you can check your PPE and social distancing at the coat check and be close with everybody you meet who doesn't discomfort you.",1243182281264467975,PatchouliW,
2020-03-26 13:24:11+00:00,Let’s help flatten the curve #stayhome #letsdoourpart #socialdistancing #sociallyresponsible #saynotocovid19 #wecandoit #togetherwecan #unitedwecan #sgunited #sph #sphradio #moneyfm893 @Singapore Press Holdings… https://www.instagram.com/p/B-MssrUnUY8/?igshid=1me9pc3nzoxol,1243166861908418562,bernardlim108,
2020-03-26 13:21:07+00:00,Good job on the Social Distancing :),1243166089556758529,dwallbank,
2020-03-26 11:23:34+00:00,"#SocialDistancing menjadi solusi memperkecil kemungkinan penularan #Covid19 , jaga kesehatan dan ikuti himbauan pemerintah. Jangan panik dan lakukan #SelfIsolation , God Bless All",1243136508501999617,hato_tiutiu78,
2020-03-26 10:41:07+00:00,Social distancing guidelines from a socially distant lifestyle expert: ✅Stay home (nothings out there) ✅Connect to wifi (all you need and food) ✅Keep 1m gap w/ each other (wag clingy) ✅Maximum 10 pax per party Pero… https://www.instagram.com/p/B-MaCGoDweu/?igshid=xwekd4wpivt2,1243125823399493634,HaagenDars,
2020-03-26 10:26:25+00:00,Killer litter is what you need to know. It’s not funny at all. You are as “ignorant” as those not practicing social distancing. ,1243122123733733377,dafugly_prince,
2020-03-26 10:25:51+00:00,"My reading for the day.. Actually, most days 😅 Jokes aside, please observe basic hygiene and social distancing! #sgunited – at Jalan Pisang (Singapore)",1243121983505584129,OfficialPothosd,
2020-03-26 09:14:01+00:00,Now Govt give you all $300-$900 each. Make sure you stay home and order #GrabFood. #SocialDistancing @GrabSG,1243103905333964805,zec_chilovek,
2020-03-26 09:01:39+00:00,We've changed up our store layout to better help you maintain social distancing. Come on down and grab a board game to play with your family at home! @Games at PI https://www.instagram.com/p/B-MOp2_njpa/?igshid=rlkr0mkwxo58,1243100795094077440,GamesAtPI,
2020-03-26 08:48:34+00:00,"Hadiah spesial tahun ini, personil chabe lengkap 🌸 Walaupun sekarang harus nerapin ""social distancing"", tapi gak jadi masalah karena grup makin aktif. Kalau udah gak sanggup, ntar pakai… https://www.instagram.com/p/B-MJXFgFQwm81tugNNWbxBU3deHsrRP_b7i2AI0/?igshid=zrrobtyrgold",1243097499864358913,cicisriwhyni,
2020-03-26 08:24:36+00:00,I don’t understand why they don’t want to do social distancing in the mrt,1243091470854184962,golfwankk,
2020-03-26 08:24:24+00:00,"Jalanan sepi, kampus sepi,hotel sepi, mall sepi,semua sepi. Hati pun terkena social distancing dan sepi. #corona #CoronaIndonesia #sepi #kamisambyar #BelanjaDariRumah #hatisepi",1243091420577030145,ivanagustinus5,
2020-03-26 08:19:54+00:00,It's so funny how people are practising social distancing now and day to day when I'm in public and see my friends that I already practice non-reactivity. It's just fun observing my friends /people I know going about their day to day things in their own bubble 😂. Not weird.,1243090285740961792,JoycelynXie,
2020-03-26 06:24:07+00:00,Social distancing. Not only physically but also your heart.,1243061147143524353,fuckyeahisk,
2020-03-26 05:53:25+00:00,"Social distancing means avoiding large gatherings and maintaining distance (6 ft) from others. While we're at it, remember to keep it at least 300 ft for larger wildlife. #ThrowbackThursday #nikonphotography #PhysicalDistancing #safari #tigers #Banwildlifetrade #SocialDistancing ",1243053423013949440,dr_ashok0124,
2020-03-26 05:47:23+00:00,"Kudos to #starbucks at Marina One #singapore. Not only were there demarcated areas due to #SocialDistancing, staff were also proactive and told customers to maintain their distance while queueing or waiting their turn – at Marina One The Heart",1243051902729777152,lsolaTioN,
2020-03-26 05:38:54+00:00,"It’s an #almostfriday #lunchdate with social distancing - reserves sign on next table. Thank you thecoastalsettlement - happy to support local businesses on the rare occasion out these days, especially my fave ones… https://www.instagram.com/p/B-L3cl8npNI/?igshid=16jtcusxb4x06",1243049768021938177,beckalim,
2020-03-26 04:10:09+00:00,Takeaway to eat at my work desk.... social distancing at work... @Ngee Ann Polytechnic https://www.instagram.com/p/B-LtSxcjH2a/?igshid=53exv7xb18pn,1243027434787700737,fireopal82,
2020-03-26 03:15:57+00:00,"Fear and uncertainity are in the air since the Covid 19 virus has spread globally. Besides practice good personal hygiene, social distancing and AVOID gathering in large group, I think it is important for us not to… https://www.instagram.com/p/B-LnFfLpQZo/?igshid=vxufpjd1pge6",1243013796207030272,mshannahchia,
2020-03-26 02:36:44+00:00,"One good thing about crossed seats at public places as part of social distancing, I am not sure why it is being exempted as of now at the public transport system i. e MRT &amp; public buses? – at Clarke Quay Central",1243003926644834310,RAMLIPUTEH,
2020-03-26 02:35:44+00:00,"This! Data, and the analysis of data, doesn't lie. Data gives us inputs so we can make informed decisions and actions. Take a look, play around with the model, and see/understand the impact of social distancing. ",1243003676202950657,kborsetti,
2020-03-26 01:30:41+00:00,Social distancing pls.... #pinkiebell #cat #cats #catmolester #neko #猫 #ねこ #고양이 #maospotted #sgcats @Singapore https://www.instagram.com/p/B-LbCzkljFZ/?igshid=10qxoeevldere,1242987304551165955,ediscm,
2020-03-26 01:25:34+00:00,It’s Thursday in #Singapore and we had our highest single day of 73 new cases yesterday. Is a #lockdown imminent? Stay safe and fully abide by #SocialDistancing so we can avoid being just like every other place. #covid19 🇸🇬,1242986017415544832,ArishKhajotia,
2020-03-25 23:58:32+00:00,"Been WFH the past 3 days. Otw to work this morn i’m like... “WHAT IS THIS SOCIAL DISTANCING THE GOVT TALKS ABT?!” My LRT was packed like sardines, now so is the MRT. One of them said “avoid peak hr commuting.” How do we get to work then? Dont tell me Grab or cab. ",1242964113531129856,enzoticaaa,
2020-03-25 23:00:58+00:00,"Even the planets are social distancing in the skies this early Thursday morning • (from top right) Jupiter, Mars and Saturn • pic taken at 6:15am on my iPhone X • #socialdistancing #Planets #Jupiter #Mars #Saturn… https://www.instagram.com/p/B-LJ6TWn8Cm/?igshid=12i0n7giqqjmn",1242949626682097664,jeremyratnam,
2020-03-25 22:55:10+00:00,"Even the planets are social distancing in the skies this early Thursday morning • (from top right) Jupiter, Mars and Saturn • pic taken at 6:15am on my iPhone X • #socialdistancing… https://www.instagram.com/p/B-LJPluHpIKWISmedw78dr0zadK-iUnMY0q2jM0/?igshid=cabzv31doxv9",1242948168494518274,jeremyratnam,
2020-03-25 18:20:56+00:00,How it’s going to be for the rest of the year! 😷😩 ☕️ #TAG SUM1 THAT LOVES COFFEE ! 👀😯 #starbucks #coffee #socialdistancing #quarantine #usa #canada. @Ontorio Canada https://www.instagram.com/p/B-KpqvgDrx3/?igshid=1hwuh8eyrmkwo,1242879155382956032,CFlyersTV,
2020-03-25 16:44:15+00:00,Social Distancing 😷 ,1242854822237179904,spriscillart,
2020-03-25 16:40:28+00:00,You just need to be a human to become a hero! #CoronaVirus #COVID19 #StayAtHome #SocialDistancing – at Compass Heights,1242853869245218817,silvergupta,
2020-03-25 15:38:34+00:00,Okay so everyone going club today I shall be a good girl and maintain social distancing staying at home 😛,1242838292631924736,jeevzxcy,
2020-03-25 15:11:50+00:00,"El canal se estableció el 29 de enero y desde entonces es el principal medio de acceso a la última información. Aquí no hay cuarentena ni law enforcement, no estado de emergencia. Hay restricciones respecto de viajes y por supuesto social distancing pero todos siguen trabajando.",1242831565635244033,diegoluisr,
2020-03-25 15:09:49+00:00,"In line with government measures of social distancing and responsibility, #jadescape management has set up queue pole from the entrance of the showsuite and individual type show unit. The sitting tables for buyers… https://www.instagram.com/p/B-KTq3WnaWu/?igshid=1fnutel48kkcm",1242831058661511170,Jlow8999,
2020-03-25 13:40:41+00:00,Hi everything. Extend? Ok thank you! #COVID19 #CoronaVirus #KitaJagaKita #LockDown #StayAtHome #SocialDistancing @People's Park Center China Town - Singapura https://www.instagram.com/p/B-KJyn1pzhm/?igshid=2uuy1gpgvhik,1242808627985031168,faizainal,
2020-03-25 12:59:32+00:00,"Do social distancing at all. And on top of that, they asked us to bring our OWN LAPTOP to work. Eh putangina, pwede naman pala na yung trabaho ginawa ko sa sariling laptop at yung meeting hindi naman face to face bakit ko pa kailangan pumasok, hence, adding possible exposure to",1242798271006830593,fafuierice,
2020-03-25 12:46:10+00:00,when they gonna put social distancing on trains???,1242794906260627456,MikeMunez,
2020-03-25 11:02:53+00:00,Belanja hari ini buat beberapa hari bebi wkwkkw biar ndak ribet bolak balik pasar ntar sama saja tdk social distancing,1242768916448808960,mutasi_srg_soon,
2020-03-25 10:47:32+00:00,"As we see the 🌎 around us increasingly go into lockdown mode, grateful for the little things we can still cherish in Singapore such as an evening spent here watching the sunset 🌅#WFH #socialdistancing #gratitude – at Marina Barrage Roof Top",1242765053725536256,chandan_deep,
2020-03-25 09:32:28+00:00,Can I just say how ASD-friendly the neurotypical world is becoming because of COVID19. i.e visual and physical structures to of social-distancing / more visuals &amp; infographic that share concise info #TurnAdversitiesIntoAdvantages,1242746160726462466,FarieRose,
2020-03-25 07:49:00+00:00,#CORRECTION @SkyNews: #Singapore was never put on lockdown and is still not under lockdown conditions after yesterday's tightened social distancing measures. ,1242720121543462912,jbhavan,
2020-03-25 07:42:49+00:00,#covid19 #coronavirus #thisisreal #newnormal #socialdistancing #foodcourt @Koufu 口福 Buangkok Square Mall https://www.instagram.com/p/B-Jg1fGB6Ux/?igshid=1t7wj1k5ug3dd,1242718566316748800,vincent_pang,
2020-03-25 07:35:29+00:00,Yes even the RatnamKiDS’ Minecraft plushies are exhibiting Social Distancing this afternoon • well done • Be Responsible • #SGunited #SocialDistancing #Covid19 #Enderman #ZombiePigman #Skeleton #Zombie @Singapore https://www.instagram.com/p/B-Jf_qHHT6Q/?igshid=rzr0wo7ct5zp,1242716719262715904,jeremyratnam,
2020-03-25 07:03:53+00:00,new reason to avoid lepak ngn members ;) #SocialDistancing,1242708766899892225,2tired4urshitz,
2020-03-25 06:14:09+00:00,#socialdistancing #kamudirumahaja #kamiyangkerja #kamimasakuntukkamu #kamiantarpesanankamu #waroengmakmurgreenland #debox #djadulkeprimall #ayamgeprekmahkota #roastchix @Waroeng Makmur https://www.instagram.com/p/B-JWr-GA_GY/?igshid=jx1yj1mahkke,1242696254523572225,Waroeng_Makmur,
2020-03-25 05:59:48+00:00,"Someone that I really look up to posted this on his story saying that if this lockdown, social distancing order is causing depression on you or starting to create some mental issues you don’t even know you have,… https://www.instagram.com/p/B-JVC7nBcEQ/?igshid=p48xm356u5kp",1242692641336299521,HaikarlTurner,
2020-03-25 05:47:32+00:00,Social Distancing at Food Court #SocialDistancing #Coronavirus #Covid19 #Covid19SG #Singapore – at Northpoint City,1242689552994545664,EricssenWen,
2020-03-25 05:18:39+00:00,"Great piece of data journalism and particle simulation visualization about coronavirus global spread by the NYTimes. Gives a very good indication on the sitch we’re in (and also why testing and social distancing are so important in the UK, US and Aus.). ",1242682286811672576,awws,
2020-03-25 05:05:58+00:00,"Being in a school that is still open during #covid19 means students need good #socialdistancing practices. Shout out to our Art Department @SAISVisualArt for having the students line up 1 meter away from each other, and with their own inspirational message. #SAISrocks #CognitaWay",1242679093721612288,ATorrens84,
2020-03-25 04:58:39+00:00,Quick quick lunch... while observing proper social distancing! Thank you shopbackgo and shopbacksg for the upsized cashback! @Crystal Jade Singapore https://www.instagram.com/p/B-JOC8MjSaa/?igshid=zuc9rpkge0hi,1242677251235368960,fireopal82,
2020-03-25 04:30:14+00:00,@soniandtv Brave of your reporter but pls advice them not to touch people while interveiwing! #SocialDistancing ,1242670099502231552,RajeshChakram,
2020-03-25 04:29:11+00:00,I would also say that education around social distancing should be put into the public transport system. The air is recirculated and seats are cramped.,1242669835412103169,heydelorenzo,
2020-03-25 04:29:07+00:00,Here is someone who refuses to adhere to #SocialDistancing. Don't be like him! 𝐒𝐭𝐚𝐲 𝐬𝐚𝐟𝐞 𝐞𝐯𝐞𝐫𝐲𝐨𝐧𝐞! 🖤 #Adopted #StrayCat #MaoMao #9troCat #Cat #Cats #CatsOfInstagram @Singapore https://www.instagram.com/p/B-JKqw9nvE9/?igshid=1try1so0x82pp,1242669822317649920,hong_9tro,
2020-03-25 04:22:08+00:00,Getting out while we still can! #hiking #treetopwalk #Singapore #nature #wellness #mentalhealth #outdooreducation #natureschool #socialdistancing @HSBC TreeTop Walk https://www.instagram.com/p/B-JJ3gEg1Z7/?igshid=7nz7qmlucmrk,1242668062618329088,PeterGCuthbert,
2020-03-25 03:48:33+00:00,"The last time I tried social distancing in the MRT, I found myself standing outside",1242659612211306496,Nabeel_Zia23,
2020-03-25 03:30:04+00:00,Nanti lah ya tunggu kelar social distancing ini. Pengen kali sarapan diluar gitu,1242654958299664384,hornyindomie,
2020-03-25 02:56:38+00:00,Please be responsible and practice Social Distancing • #SGunited #BeattheVirus @Punggol Waterway Park https://www.instagram.com/p/B-I_8Y4HbTC/?igshid=1wm02zpvjp21n,1242646545373298690,jeremyratnam,
2020-03-25 01:17:07+00:00,Day 02 of our by-invite only Cultural Medallion sharing with Atin Amat. We did Pak Samad Said’s Salina which was staged in ‘93 and ‘97. We #dontkancheong and #staystrong with #socialdistancing #lessthan10. Our… https://www.instagram.com/p/B-I0sWehCSQ/?igshid=6wdncf46dusu,1242621501683236865,DandyarAmri,
2020-03-25 00:28:26+00:00,It is pretty amazing to see some wanting to achieve much in this temporary era of social distancing. Maybe it is a good time to revisit some of the priorities that we hold so dear to us ,1242609249085034499,Jacqueline_Goh,
2020-03-25 00:26:22+00:00,"A swarm of flying insects not practising ""social distancing"" 🙂 @Bukit Batok Nature Park https://www.instagram.com/p/B-IueafHGtM/?igshid=1asdvjjxidpoz",1242608732191719427,jimmytst,
2020-03-25 00:09:51+00:00,"Lol ""practice social distancing"" everywhere but not buses and MRTs?",1242604571861463040,theriaria,
2020-03-25 00:09:44+00:00,"I don't mind giving my money to virtual worlds companies. They make social distancing unnecessary within their context, and provide an outlet we need in these times.",1242604542518157312,PatchouliW,
2020-03-24 23:33:42+00:00,i love how sg doesn’t give a fuck about social distancing,1242595476651642881,sadlyzai,
2020-03-24 19:49:05+00:00,How can people return to work AND practice social distancing? What kind of half-baked nonsense is he talking about? ,1242538950486421504,jamiliagrier,
2020-03-24 19:21:29+00:00,【 空 】 . . #throwback #sg #igsg #singapore #theprojectorsg #goldenmiletower #retro #vintage #空 #empty #socialdistancing #stayhome #day3 #wednesday #midweek #2020cancelled #letsjustskipto2021 @The Projector https://www.instagram.com/p/B-IL_wYhcmY/?igshid=shusro58sxd7,1242532003997577217,chengpin89822,
2020-03-24 17:18:37+00:00,I don’t like the way she treats ppl. Especially Kourtney. Kim should stay away from other ppl. Put it on her campaign. #SocialDistancing 😅,1242501082065948672,faixosman,
2020-03-24 17:07:39+00:00,"Ways to deal with Loneliness and Healthy Social Distancing during this season. 1. Solitude instead of Loneliness 2. Shared Experiences instead of Shared Spaces. Learn to communicate. 3. Change your 3S (Sight, Scent and Sound) ",1242498324113969152,rovingsole,
2020-03-24 15:55:55+00:00,Practicing social distancing from now,1242480273008103426,jeevzxcy,
2020-03-24 15:20:32+00:00,This is dead serious if Singapore is willing to suspend tuition centres. 😂 #COVID19 #coronavirus #SocialDistancing ,1242471365283729408,eridhan,
2020-03-24 15:02:38+00:00,I don’t see the social distancing.,1242466860953530370,Ganeshspeaks,
2020-03-24 14:40:00+00:00,"(24 March 2020) In line with the increasing number of imported Covid-19 cases in Singapore, further measures have been implemented by the Government of Singapore, such as the strict enforcement of social distancing… https://www.instagram.com/p/B-HryHJHUnC/?igshid=1g1wsj6hayan0",1242461164472111105,sgbusexpeditors,
2020-03-24 12:25:02+00:00,"In view of the importance of social distancing, I’m still bamboozled that SIT is asking all of us to come back to sch tmr???????",1242427199765934080,_DivyaaPillai,
2020-03-24 12:15:50+00:00,#Singapore has closed all places of entertainment and external tuition &amp; education centres. #SocialDistancing #,1242424884027969538,JKannanR,
2020-03-24 12:12:14+00:00,#socialdistancing #workfromhome #stayathome #staysafe #letuscookforyou #letusworkforyou #gojekinaja #waroengmakmurgreenland #waroengmakmur #roastchix #debox #ayamgeprekmahkota #djadulkeprimall @Waroeng Makmur https://www.instagram.com/p/B-Ha37XgDEE/?igshid=1mnil44qtg363,1242423980281266176,Waroeng_Makmur,
2020-03-24 11:59:07+00:00,Wah never do social distancing ah,1242420678533378049,izreloaded,
2020-03-24 11:53:52+00:00,"Cases increasing day by day. Today it is someone else tomorrow it can be you and me or our loved ones. Please appreciate the effort by government, people who are running campaigns. Social distancing is followed 100%. Don't act careless. #CoronavirusOutbreak #COVID19 #Singapore",1242419356031541248,AquibIkubal,
